Sheet: 未出货订单类别统计表
A1: 未出货订单类别统计表
G2: 更新时间：2016.03.09
A3: NO. | B3: 客户 | C3: 类型 | F3: 在手量
C4: 针织件数 | D4: 梭织件数 | F4: 总数量 | G4: 总金额
A5: 1 | B5: SELF | C5: 1558858 | D5: 852920 | F5: =RC[-3]+RC[-2] -> 2411778 | G5: 9660606
A6: 2 | B6: STONY | F6: =RC[-3]+RC[-2] -> 0
A7: 3 | B7: TD | F7: =RC[-3]+RC[-2] -> 0
A8: 4 | B8: DK | F8: =RC[-3]+RC[-2] -> 0
A9: 5 | B9: H&S | F9: =RC[-3]+RC[-2] -> 0
A10: 6 | B10: GS | F10: =RC[-3]+RC[-2] -> 0
A11: 7 | B11: ALMOST | F11: =RC[-3]+RC[-2] -> 0
A12: 8 | B12: SWAT | F12: =RC[-3]+RC[-2] -> 0
A13: 9 | B13: LF Sourcing | F13: =RC[-3]+RC[-2] -> 0
A14: 10 | B14: JPR
A16: 10 | B16: KELLWOOD | F16: =RC[-3]+RC[-2] -> 0
A17: 11 | B17: Crew Knitwear | F17: =RC[-3]+RC[-2] -> 0
A18: Grand Total | C18: =R[-13]C+R[-12]C+R[-11]C+R[-10]C+R[-9]C+R[-8]C+R[-7]C+R[-6]C+R[-5]C+R[-3]C+R[-2]C+R[-1]C -> 1558858 | D18: =R[-13]C+R[-12]C+R[-11]C+R[-10]C+R[-9]C+R[-8]C+R[-7]C+R[-6]C+R[-5]C+R[-3]C+R[-2]C+R[-1]C -> 852920 | F18: =R[-13]C+R[-12]C+R[-11]C+R[-10]C+R[-9]C+R[-8]C+R[-7]C+R[-6]C+R[-5]C+R[-3]C+R[-2]C+R[-1]C -> 2411778 | G18: =R[-13]C+R[-12]C+R[-11]C+R[-10]C+R[-9]C+R[-8]C+R[-7]C+R[-6]C+R[-5]C+R[-3]C+R[-2]C+R[-1]C -> 9660606

Sheet: 业务员统计
A1: 客户 | B1: 业务员 | C1: 订单数量 | D1: 订单金额
A2: STONY | B2: 周婷
A3: STONY | B3: 唐琼茜
A4: STONY | B4: 吕婵娟
A5: STONY | B5: 胡金文
A6: STONY | B6: 李绍兰
A7: STONY | B7: 袁松燕
A8: STONY | B8: 董灏
A9: STONY | B9: 潭春艳
A10: STONY | B10: 王强
B11: 林碧云
B12: 付连
B13: 付连
B14: 王晓檬
B15: 王晓檬
B16: 胡金文
B17: 龚芳
B18: 王强
B19: 鲁晨诗
B20: 潭春艳
B21: 胡珍姑
B22: 李绍兰
B23: 仝绪娥
B24: 潭春艳
B25: 张莉
B26: 孙娟
B27: 秦芳霞
B28: 卿春艳（孙金）
B29: 党文科
B30: 李绍兰
B31: 武玲玲
B32: 王强
B33: 吴龙方

Sheet: 各工厂现有订单统计
A1: 各工厂现有订单统计
C2: 2016.03.09
A3: No. | B3: 工厂 | C3: 件数
A4: 1 | B4: 百利达 | C4: 1233654
A5: 2 | B5: 依饰杰 | C5: 853857
A6: 3 | B6: 泰豪 | C6: 812485
A7: 4 | B7: 景润 | C7: 797667
A8: 5 | B8: 白云/泰豪/美琪/依饰杰 | C8: 275490
A9: 6 | B9: 依饰杰/忆莱/高梵 | C9: 246040
A10: 7 | B10: 百利达/依尚 | C10: 229650
A11: 8 | B11: 白云 | C11: 172290
A12: 9 | B12: 支云塔 | C12: 156171
A13: 10 | B13: 百利达/铁源 | C13: 144005
A14: 11 | B14: 铁源 | C14: 139205
A15: 12 | B15: 百利达/白云/支云塔 | C15: 127573
A16: 13 | B16: 支云塔/百利达 | C16: 122504
A17: 14 | B17: 欧凯 | C17: 109116
A18: 15 | B18: 美琪 | C18: 106177
A19: 16 | B19: 唯路易 | C19: 99921
A20: 17 | B20: 同飞 | C20: 88107
A21: 18 | B21: 高梵 | C21: 70628
A22: 19 | B22: 忆莱 | C22: 66442
A23: 20 | B23: 云英 | C23: 63006
A24: 21 | B24: 润鑫 | C24: 46015
A25: 22 | B25: 百利达/炜雅娜 | C25: 43989
A26: 23 | B26: 泰豪/支云塔 | C26: 41704
A27: 24 | B27: 同飞/支云塔 | C27: 24133
A28: 25 | B28: 东莉 | C28: 17630
A29: 26 | B29: 依尚 | C29: 14400
A30: 27 | B30: 泰豪/铁源 | C30: 12840
A31: 28 | B31: 炜雅娜 | C31: 12777
A32: 29 | B32: 昊天 | C32: 8636
A33: 30 | B33: 忆莱/云英 | C33: 6000
A34: 31 | B34: 百利达/丁大/依尚 | C34: 2100
A35: 32 | B35: 明月 | C35: 800
A36: 33 | B36: 未排工厂 | C36: 519533
A37: TTL： | C37: =SUM(R[-33]C:R[-1]C) -> 6664545

Sheet: 2016工厂现有订单明细 
A1: 2016工厂现有订单明细 更新：2016.03.10
A2: RCT | B2: FAC. | C2: MERCHANDISER | D2: P/O | E2: STYLE NO. | F2: STORE | G2: QTY | H2: UNIT PRICE | I2: TOTAL AMOUNT | J2: EX-F | K2: I/H DATE
A3: 2016-02-26T00:00:00.000 | B3: 白云 | C3: 吕婵娟 | D3: BA302-1 | E3: J3520MMEYZ | F3: TARGET | G3: 42500 | H3: 6.5 | I3: =RC[-2]*RC[-1] -> 276250 | J3: 2016-5-9 | K3: 2016-06-01T00:00:00.000 | L3: 梭织
A4: 2016-03-03T00:00:00.000 | B4: 白云 | C4: 吕婵娟 | D4: BA302EC-1 | E4: J3520MMEYZ | G4: 4 | H4: 6.3 | I4: =RC[-2]*RC[-1] -> 25.2 | J4: 2016-5-9 | K4: 2016-06-01T00:00:00.000 | L4: 梭织
A5: 2016-03-03T00:00:00.000 | B5: 白云 | C5: 董灏 | D5: BA303-1 | E5: J8042MMEYK | F5: TARGET | G5: 24907 | H5: 4.8 | I5: =RC[-2]*RC[-1] -> 119553.59999999999 | J5: 2016-5-2 | K5: 2016-05-25T00:00:00.000 | L5: 梭织
A6: 2015-12-09T00:00:00.000 | B6: 白云 | C6: 武玲玲 | D6: CL153479-1 | E6: JCPD010479 | F6: JCP | G6: 2710 | H6: 5.75 | I6: =RC[-2]*RC[-1] -> 15582.5 | J6: 2016-3-27 | K6: 2016-04-15T00:00:00.000 | L6: 针织
A7: 2015-12-09T00:00:00.000 | B7: 白云 | C7: 武玲玲 | D7: CL153479-2 | E7: JCPD010479 | F7: JCP | G7: 400 | H7: 5.75 | I7: =RC[-2]*RC[-1] -> 2300 | J7: 2016-3-27 | K7: 2016-04-15T00:00:00.000 | L7: 针织
A8: 2015-12-09T00:00:00.000 | B8: 白云 | C8: 武玲玲 | D8: CL153479-3 | E8: JCPD010479 | F8: JCP | G8: 16 | H8: 5.75 | I8: =RC[-2]*RC[-1] -> 92 | J8: 2016-3-27 | K8: 2016-04-15T00:00:00.000 | L8: 针织
A9: 2016-01-23T00:00:00.000 | B9: 白云 | C9: 秦芳霞 | D9: 016117 | E9: XHFTK0863 | F9: TARGET | G9: 51189 | H9: 3.32 | I9: =RC[-2]*RC[-1] -> 169947.47999999998 | J9: 2016-4-18 | K9: 2016-05-04T00:00:00.000 | L9: 针织
A10: 2016-01-23T00:00:00.000 | B10: 白云 | C10: 秦芳霞 | D10: 016117 | E10: XHFTK0863 | F10: TARGET | G10: 27564 | H10: 3.56 | I10: =RC[-2]*RC[-1] -> 98127.84 | J10: 2016-4-18 | K10: 2016-05-04T00:00:00.000 | L10: 针织
A11: 2016-02-03T00:00:00.000 | B11: 白云 | C11: 武玲玲 | D11: CL160241 | E11: FDK5440 | F11: FIRE | G11: 5000 | H11: 5 | I11: =RC[-2]*RC[-1] -> 25000 | J11: 2016-5-1 | K11: 2016-05-17T00:00:00.000 | L11: 针织
A12: 2016-02-03T00:00:00.000 | B12: 白云 | C12: 武玲玲 | D12: CL160242 | E12: FDK5440 | F12: FIRE | G12: 5000 | H12: 5.25 | I12: =RC[-2]*RC[-1] -> 26250 | J12: 2016-5-1 | K12: 2016-05-17T00:00:00.000 | L12: 针织
A13: 2016-02-03T00:00:00.000 | B13: 白云 | C13: 武玲玲 | D13: CL160243 | E13: FDK5185 | F13: FIRE | G13: 5000 | H13: 5 | I13: =RC[-2]*RC[-1] -> 25000 | J13: 2016-5-1 | K13: 2016-05-17T00:00:00.000 | L13: 针织
A14: 2016-02-03T00:00:00.000 | B14: 白云 | C14: 武玲玲 | D14: CL160244 | E14: FDK5185 | F14: FIRE | G14: 5000 | H14: 5.35 | I14: =RC[-2]*RC[-1] -> 26750 | J14: 2016-5-1 | K14: 2016-05-17T00:00:00.000 | L14: 针织
A15: 2016-02-06T00:00:00.000 | B15: 白云 | C15: 武玲玲 | D15: 016562 | E15: SFT020546 | F15: FIRE | G15: 1500 | H15: 4.75 | I15: =RC[-2]*RC[-1] -> 7125 | J15: 2016-5-1 | K15: 2016-05-23T00:00:00.000 | L15: 针织
A16: 2016-02-19T00:00:00.000 | B16: 白云 | C16: 武玲玲 | D16: 016771 | E16: SFT020540 | F16: BELK | G16: 1500 | H16: 6.55 | I16: =RC[-2]*RC[-1] -> 9825 | J16: 2016-5-1 | K16: 2016-05-18T00:00:00.000 | L16: 针织
A17: 2016-01-13T00:00:00.000 | B17: 白云/泰豪/美琪/依饰杰 | C17: 胡珍姑 | D17: 3736 | E17: ANL7 | F17: WALMART | G17: 20262 | H17: 3.65 | I17: =RC[-2]*RC[-1] -> 73956.3 | J17: 2016-4-4 | K17: 2016-04-22T00:00:00.000 | L17: 针织
A18: 2016-02-15T00:00:00.000 | B18: 白云/泰豪/美琪/依饰杰 | C18: 胡珍姑 | D18: 3949 | E18: ANL7 | F18: WALMART | G18: 4578 | H18: 3.65 | I18: =RC[-2]*RC[-1] -> 16709.7 | J18: 2016-5-2 | K18: 2016-05-20T00:00:00.000 | L18: 针织
A19: 2016-02-15T00:00:00.000 | B19: 白云/泰豪/美琪/依饰杰 | C19: 胡珍姑 | D19: 3950 | E19: ANL7 | F19: WALMART | G19: 8046 | H19: 3.65 | I19: =RC[-2]*RC[-1] -> 29367.899999999998 | J19: 2016-6-6 | K19: 2016-06-24T00:00:00.000 | L19: 针织
A20: 2016-02-15T00:00:00.000 | B20: 白云/泰豪/美琪/依饰杰 | C20: 胡珍姑 | D20: 3951 | E20: ANL7 | F20: WALMART | G20: 65388 | H20: 3.65 | I20: =RC[-2]*RC[-1] -> 238666.19999999998 | J20: 2016-4-4 | K20: 2016-04-22T00:00:00.000 | L20: 针织
A21: 2016-02-15T00:00:00.000 | B21: 白云/泰豪/美琪/依饰杰 | C21: 胡珍姑 | D21: 3952 | E21: ANL7 | F21: WALMART | G21: 52416 | H21: 3.65 | I21: =RC[-2]*RC[-1] -> 191318.39999999999 | J21: 2016-5-2 | K21: 2016-05-20T00:00:00.000 | L21: 针织
A22: 2016-02-15T00:00:00.000 | B22: 白云/泰豪/美琪/依饰杰 | C22: 胡珍姑 | D22: 3956 | E22: ANL7 | F22: WALMART | G22: 20184 | H22: 3.65 | I22: =RC[-2]*RC[-1] -> 73671.599999999991 | J22: 2016-6-6 | K22: 2016-06-24T00:00:00.000 | L22: 针织
A23: 2016-02-15T00:00:00.000 | B23: 白云/泰豪/美琪/依饰杰 | C23: 胡珍姑 | D23: 3957 | E23: ANL7 | F23: WALMART | G23: 23124 | H23: 3.65 | I23: =RC[-2]*RC[-1] -> 84402.599999999991 | J23: 2016-4-4 | K23: 2016-04-22T00:00:00.000 | L23: 针织
A24: 2016-02-15T00:00:00.000 | B24: 白云/泰豪/美琪/依饰杰 | C24: 胡珍姑 | D24: 3959 | E24: ANL7 | F24: WALMART | G24: 13272 | H24: 3.65 | I24: =RC[-2]*RC[-1] -> 48442.799999999996 | J24: 2016-4-18 | K24: 2016-05-06T00:00:00.000 | L24: 针织
A25: 2016-02-15T00:00:00.000 | B25: 白云/泰豪/美琪/依饰杰 | C25: 胡珍姑 | D25: 3961 | E25: ANL7 | F25: WALMART | G25: 37572 | H25: 3.65 | I25: =RC[-2]*RC[-1] -> 137137.79999999999 | J25: 2016-5-16 | K25: 2016-06-03T00:00:00.000 | L25: 针织
A26: 2016-02-15T00:00:00.000 | B26: 白云/泰豪/美琪/依饰杰 | C26: 胡珍姑 | D26: 3963 | E26: ANL7 | F26: WALMART | G26: 30648 | H26: 3.65 | I26: =RC[-2]*RC[-1] -> 111865.2 | J26: 2016-6-20 | K26: 2016-07-08T00:00:00.000 | L26: 针织
A27: 2015-12-16T00:00:00.000 | B27: 百利达 | C27: 吕婵娟 | D27: BA241-1 | E27: J5885CAVRK | F27: TARGET | G27: 540 | H27: 4.9000000000000004 | I27: =RC[-2]*RC[-1] -> 2646 | J27: 2016-3-14 | K27: 2016-04-08T00:00:00.000 | L27: 针织
A28: 2015-12-16T00:00:00.000 | B28: 百利达 | C28: 吕婵娟 | D28: BA241ATS | E28: J5885CAVRK | F28: HOUSE ACCOUNT | G28: 954 | H28: 4.9000000000000004 | I28: =RC[-2]*RC[-1] -> 4674.6000000000004 | J28: 2016-3-21 | K28: 2016-04-12T00:00:00.000 | L28: 针织
A29: 2015-12-16T00:00:00.000 | B29: 百利达 | C29: 吕婵娟 | D29: BA241ATS-01 | E29: J5885CAVRK | F29: ZUMIEZ | G29: 300 | H29: 4.7 | I29: =RC[-2]*RC[-1] -> 1410 | J29: 2016-3-21 | K29: 2016-04-12T00:00:00.000 | L29: 针织
A30: 2015-12-16T00:00:00.000 | B30: 百利达 | C30: 吕婵娟 | D30: BA241ATSEC-01 | E30: J5885CAVRK | G30: 6 | H30: 4.7 | I30: =RC[-2]*RC[-1] -> 28.200000000000003 | J30: 2016-3-21 | K30: 2016-04-12T00:00:00.000 | L30: 针织
A31: 2015-12-16T00:00:00.000 | B31: 百利达 | C31: 吕婵娟 | D31: BA242-1 | E31: J5886CAVQK | F31: TARGET | G31: 540 | H31: 4.55 | I31: =RC[-2]*RC[-1] -> 2457 | J31: 2016-3-14 | K31: 2016-04-08T00:00:00.000 | L31: 针织
A32: 2015-12-16T00:00:00.000 | B32: 百利达 | C32: 吕婵娟 | D32: BA242ATS | E32: J5886CAVQK | F32: HOUSE ACCOUNT | G32: 414 | H32: 4.55 | I32: =RC[-2]*RC[-1] -> 1883.6999999999998 | J32: 2016-3-14 | K32: 2016-04-08T00:00:00.000 | L32: 针织
A33: 2015-12-16T00:00:00.000 | B33: 百利达 | C33: 吕婵娟 | D33: BA242ATS-01 | E33: J5886CAVQK | F33: FRED MEYER | G33: 846 | H33: 4.55 | I33: =RC[-2]*RC[-1] -> 3849.2999999999997 | J33: 2016-3-14 | K33: 2016-04-08T00:00:00.000 | L33: 针织
A34: 2015-12-16T00:00:00.000 | B34: 百利达 | C34: 吕婵娟 | D34: BA243-1 | E34: J5886CBCYK | F34: TARGET | G34: 540 | H34: 4.1500000000000004 | I34: =RC[-2]*RC[-1] -> 2241 | J34: 2016-3-14 | K34: 2016-04-08T00:00:00.000 | L34: 针织
A35: 2015-12-16T00:00:00.000 | B35: 百利达 | C35: 吕婵娟 | D35: BA243ATS | E35: J5886CBCYK | F35: HOUSE ACCOUNT | G35: 1260 | H35: 4.1500000000000004 | I35: =RC[-2]*RC[-1] -> 5229 | J35: 2016-3-14 | K35: 2016-04-08T00:00:00.000 | L35: 针织
A36: 2015-12-16T00:00:00.000 | B36: 百利达 | C36: 吕婵娟 | D36: BA244-1 | E36: J5895CAVQK | F36: TARGET | G36: 540 | H36: 3.9 | I36: =RC[-2]*RC[-1] -> 2106 | J36: 2016-3-14 | K36: 2016-04-08T00:00:00.000 | L36: 针织
A37: 2015-12-16T00:00:00.000 | B37: 百利达 | C37: 吕婵娟 | D37: BA244ATS | E37: J5895CAVQK | F37: HOUSE ACCOUNT | G37: 954 | H37: 3.9 | I37: =RC[-2]*RC[-1] -> 3720.6 | J37: 2016-3-14 | K37: 2016-04-08T00:00:00.000 | L37: 针织
A38: 2015-12-16T00:00:00.000 | B38: 百利达 | C38: 吕婵娟 | D38: BA244ATS-01 | E38: J5895CAVQK | F38: ZUMIEZ | G38: 300 | H38: 3.7 | I38: =RC[-2]*RC[-1] -> 1110 | J38: 2016-3-14 | K38: 2016-04-08T00:00:00.000 | L38: 针织
A39: 2015-12-16T00:00:00.000 | B39: 百利达 | C39: 吕婵娟 | D39: BA244ATSEC-01 | E39: J5895CAVQK | G39: 6 | H39: 3.7 | I39: =RC[-2]*RC[-1] -> 22.200000000000003 | J39: 2016-3-14 | K39: 2016-04-08T00:00:00.000 | L39: 针织
A40: 2015-12-16T00:00:00.000 | B40: 百利达 | C40: 吕婵娟 | D40: BA245-1 | E40: J5895CAVRK | F40: TARGET | G40: 540 | H40: 4 | I40: =RC[-2]*RC[-1] -> 2160 | J40: 2016-3-14 | K40: 2016-04-08T00:00:00.000 | L40: 针织
A41: 2015-12-16T00:00:00.000 | B41: 百利达 | C41: 吕婵娟 | D41: BA245ATS | E41: J5895CAVRK | F41: HOUSE ACCOUNT | G41: 960 | H41: 4 | I41: =RC[-2]*RC[-1] -> 3840 | J41: 2016-3-14 | K41: 2016-04-08T00:00:00.000 | L41: 针织
A42: 2016-01-29T00:00:00.000 | B42: 百利达 | C42: 吕婵娟 | D42: BA245ATS-01 | E42: J5895CAVRK | F42: ZUMIEZ | G42: 300 | H42: 3.8 | I42: =RC[-2]*RC[-1] -> 1140 | J42: 2016-3-14 | K42: 2016-04-08T00:00:00.000 | L42: 针织
A43: 2015-12-23T00:00:00.000 | B43: 百利达 | C43: 董灏 | D43: BA264-1 | E43: J8060MYUSZ | F43: TARGET | G43: 13579 | H43: 4.3 | I43: =RC[-2]*RC[-1] -> 58389.7 | J43: 2016-4-4 | K43: 2016-04-27T00:00:00.000 | L43: 梭织
A44: 2016-01-18T00:00:00.000 | B44: 百利达 | C44: 董灏 | D44: BA264EC-1 | E44: J8060MYUSZ | G44: 6 | H44: 4.0999999999999996 | I44: =RC[-2]*RC[-1] -> 24.599999999999998 | J44: 2016-4-4 | K44: 2016-04-27T00:00:00.000 | L44: 梭织
A45: 2016-01-13T00:00:00.000 | B45: 百利达 | C45: 董灏 | D45: BA264A-1 | E45: J8060MYUSZ | F45: TARGET.COM | G45: 57 | H45: 4.0999999999999996 | I45: =RC[-2]*RC[-1] -> 233.7 | J45: 2016-4-4 | K45: 2016-04-27T00:00:00.000 | L45: 梭织
A46: 2015-12-23T00:00:00.000 | B46: 百利达 | C46: 董灏 | D46: BA265-1 | E46: J8060MYUYZ | F46: TARGET | G46: 13579 | H46: 4.3 | I46: =RC[-2]*RC[-1] -> 58389.7 | J46: 2016-4-4 | K46: 2016-04-27T00:00:00.000 | L46: 梭织
A47: 2016-01-13T00:00:00.000 | B47: 百利达 | C47: 董灏 | D47: BA265A-1 | E47: J8060MYUYZ | F47: TARGET | G47: 58 | H47: 4.0999999999999996 | I47: =RC[-2]*RC[-1] -> 237.79999999999998 | J47: 2016-4-4 | K47: 2016-04-27T00:00:00.000 | L47: 梭织
A48: 2016-02-23T00:00:00.000 | B48: 百利达 | C48: 周婷/董灏 | D48: BA297-1 | E48: J6119CBDNK | F48: TARGET | G48: 117454 | H48: 3.8 | I48: =RC[-2]*RC[-1] -> 446325.19999999995 | J48: 2016-5-9 | K48: 2016-06-01T00:00:00.000 | L48: 针织
A49: 2016-02-23T00:00:00.000 | B49: 百利达 | C49: 周婷/董灏 | D49: BA298-1 | E49: J6119MWQUK | F49: TARGET | G49: 220459 | H49: 3.4 | I49: =RC[-2]*RC[-1] -> 749560.6 | J49: 2016-5-9 | K49: 2016-06-01T00:00:00.000 | L49: 针织
A50: 2015-10-30T00:00:00.000 | B50: 百利达 | C50: 武玲玲 | D50: CL152874 | E50: RMFD009271TT | F50: RRR | G50: 2680 | H50: 7.2 | I50: =RC[-2]*RC[-1] -> 19296 | J50: 2016-5-15 | K50: 2016-06-03T00:00:00.000 | L50: 针织
A51: 2015-10-30T00:00:00.000 | B51: 百利达 | C51: 武玲玲 | D51: CL152875 | E51: RMFD009271TT | F51: RRR | G51: 1882 | H51: 6.15 | I51: =RC[-2]*RC[-1] -> 11574.300000000001 | J51: 2016-5-15 | K51: 2016-06-03T00:00:00.000 | L51: 针织
A52: 2015-12-04T00:00:00.000 | B52: 百利达 | C52: 武玲玲 | D52: 014225 | E52: AVB018094 | F52: TARGET | G52: 2154 | H52: 7.5 | I52: =RC[-2]*RC[-1] -> 16155 | J52: 2016-3-13 | K52: 2016-04-01T00:00:00.000 | L52: 针织
A53: 2015-12-14T00:00:00.000 | B53: 百利达 | C53: 武玲玲 | D53: CL153505 | E53: MBT016169S | F53: TARGET | G53: 28746 | H53: 4.3899999999999997 | I53: =RC[-2]*RC[-1] -> 126194.93999999999 | J53: 2016-4-10 | K53: 2016-05-01T00:00:00.000 | L53: 针织
A54: 2015-12-14T00:00:00.000 | B54: 百利达 | C54: 武玲玲 | D54: CL153505 | E54: MBT016169ST2 | F54: TARGET | G54: 43406 | H54: 6.65 | I54: =RC[-2]*RC[-1] -> 288649.90000000002 | J54: 2016-4-10 | K54: 2016-05-01T00:00:00.000 | L54: 针织
A55: 2016-03-04T00:00:00.000 | B55: 百利达 | C55: 武玲玲 | D55: 017204 | E55: SFT021034 | F55: Stitch Fix Line | G55: 1000 | H55: 7.5 | I55: =RC[-2]*RC[-1] -> 7500 | J55: 2016-5-29 | K55: 2016-06-17T00:00:00.000 | L55: 针织
A56: 2015-11-26T00:00:00.000 | B56: 百利达 | C56: 王强 | D56: HFC#91446 | E56: 21719A0001 | F56: MACYS | G56: 7560 | I56: =RC[-2]*RC[-1] -> 0 | J56: 2016-3-28 | K56: 2016-04-13T00:00:00.000 | L56: 针织
A57: 2015-11-26T00:00:00.000 | B57: 百利达 | C57: 王强 | D57: HFC#91446-1 | E57: 21719A0001 | F57: MACYS | G57: 405 | I57: =RC[-2]*RC[-1] -> 0 | J57: 2016-3-28 | K57: 2016-04-13T00:00:00.000 | L57: 针织
A58: 2015-12-30T00:00:00.000 | B58: 百利达 | C58: 王晓檬 | D58: HFC#91464 | E58: 22648A0001 | F58: MACYS | G58: 16818 | I58: =RC[-2]*RC[-1] -> 0 | J58: 2016-4-25 | K58: 2016-05-11T00:00:00.000 | L58: 针织
A59: 2015-12-30T00:00:00.000 | B59: 百利达 | C59: 王晓檬 | D59: HFC#91464-1 | E59: 22648A0001 | F59: MACYS | G59: 1299 | I59: =RC[-2]*RC[-1] -> 0 | J59: 2016-4-25 | K59: 2016-05-11T00:00:00.000 | L59: 针织
A60: 2015-12-30T00:00:00.000 | B60: 百利达 | C60: 王晓檬 | D60: HFC#91464-2 | E60: 22648A0001 | F60: MACYS | G60: 120 | I60: =RC[-2]*RC[-1] -> 0 | J60: 2016-4-25 | K60: 2016-05-11T00:00:00.000 | L60: 针织
A61: 2015-12-30T00:00:00.000 | B61: 百利达 | C61: 王晓檬 | D61: HFC#91464-3 | E61: 22648A0001 | F61: MACYS | G61: 378 | I61: =RC[-2]*RC[-1] -> 0 | J61: 2016-4-25 | K61: 2016-05-11T00:00:00.000 | L61: 针织
A62: 2015-12-30T00:00:00.000 | B62: 百利达 | C62: 王晓檬 | D62: HFC#91466 | E62: 22648B0001 | F62: MACYS | G62: 3807 | I62: =RC[-2]*RC[-1] -> 0 | J62: 2016-4-25 | K62: 2016-05-11T00:00:00.000 | L62: 针织
A63: 2015-12-30T00:00:00.000 | B63: 百利达 | C63: 王晓檬 | D63: HFC#91466-1 | E63: 22648B0001 | F63: MACYS | G63: 1200 | I63: =RC[-2]*RC[-1] -> 0 | J63: 2016-4-25 | K63: 2016-05-11T00:00:00.000 | L63: 针织
A64: 2015-12-30T00:00:00.000 | B64: 百利达 | C64: 王晓檬 | D64: HFC#91466-2 | E64: 22648B0001 | F64: MACYS | G64: 630 | I64: =RC[-2]*RC[-1] -> 0 | J64: 2016-4-25 | K64: 2016-04-27T00:00:00.000 | L64: 针织
A65: 2016-02-03T00:00:00.000 | B65: 百利达 | C65: 鲁晨诗 | D65: 4-16-403952 | E65: 46680A0001 | F65: MACYS | G65: 5285 | H65: 6.7 | I65: =RC[-2]*RC[-1] -> 35409.5 | J65: 2016-05-16T00:00:00.000 | K65: 2016-06-08T00:00:00.000 | L65: 针织
A66: 2016-02-03T00:00:00.000 | B66: 百利达 | C66: 鲁晨诗 | D66: 4-16-403953 | E66: 46680A0001 | F66: MACYS | G66: 360 | H66: 6.7 | I66: =RC[-2]*RC[-1] -> 2412 | J66: 2016-05-16T00:00:00.000 | K66: 2016-06-08T00:00:00.000 | L66: 针织
A67: 2016-02-17T00:00:00.000 | B67: 百利达 | C67: 鲁晨诗 | D67: 4-16-403954 | E67: 46680A0001 | F67: MACYS | G67: 96 | H67: 6.7 | I67: =RC[-2]*RC[-1] -> 643.20000000000005 | J67: 2016-05-16T00:00:00.000 | K67: 2016-06-08T00:00:00.000 | L67: 针织
A68: 2015-11-06T00:00:00.000 | B68: 百利达 | C68: 付连 | D68: 12022 | E68: 6875 | F68: WALMART | G68: 32276 | H68: 3.48 | I68: =RC[-2]*RC[-1] -> 112320.48 | J68: 2016-3-6 | K68: 2016-04-01T00:00:00.000 | L68: 针织
A69: 2015-11-06T00:00:00.000 | B69: 百利达 | C69: 付连 | D69: 12023 | E69: 6875 | F69: WALMART | G69: 114984 | H69: 3.48 | I69: =RC[-2]*RC[-1] -> 400144.32 | J69: 2016-3-6 | K69: 2016-04-01T00:00:00.000 | L69: 针织
A70: 2015-11-06T00:00:00.000 | B70: 百利达 | C70: 付连 | D70: 12024 | E70: 6875 | F70: WALMART | G70: 159996 | H70: 3.48 | I70: =RC[-2]*RC[-1] -> 556786.07999999996 | J70: 2016-3-6 | K70: 2016-04-01T00:00:00.000 | L70: 针织
A71: 2015-11-06T00:00:00.000 | B71: 百利达 | C71: 付连 | D71: 12025 | E71: 6875 | F71: WALMART | G71: 2940 | H71: 3.48 | I71: =RC[-2]*RC[-1] -> 10231.200000000001 | J71: 2016-3-6 | K71: 2016-04-01T00:00:00.000 | L71: 针织
A72: 2015-12-22T00:00:00.000 | B72: 百利达 | C72: 付连 | D72: 12129 | E72: 6923 | F72: WALMART | G72: 7890 | H72: 3.48 | I72: =RC[-2]*RC[-1] -> 27457.200000000001 | J72: 2016-3-6 | K72: 2016-04-01T00:00:00.000 | L72: 针织
A73: 2015-12-22T00:00:00.000 | B73: 百利达 | C73: 付连 | D73: 12130 | E73: 6923 | F73: WALMART | G73: 4500 | H73: 3.48 | I73: =RC[-2]*RC[-1] -> 15660 | J73: 2016-3-6 | K73: 2016-04-01T00:00:00.000 | L73: 针织
A74: 2016-01-13T00:00:00.000 | B74: 百利达 | C74: 胡金文 | D74: P170537-1 | E74: NJ36B742M | F74: WALMART | G74: 96 | H74: 3.7 | I74: =RC[-2]*RC[-1] -> 355.20000000000005 | J74: 2016-4-11 | K74: 2016-05-04T00:00:00.000 | L74: 针织
A75: 2016-01-13T00:00:00.000 | B75: 百利达 | C75: 胡金文 | D75: P170537-2 | E75: NJ36B742M | F75: WALMART | G75: 36 | H75: 3.3 | I75: =RC[-2]*RC[-1] -> 118.8 | J75: 2016-4-11 | K75: 2016-05-04T00:00:00.000 | L75: 针织
A76: 2016-01-13T00:00:00.000 | B76: 百利达 | C76: 胡金文 | D76: P170544-1 | E76: NJ36B742M | F76: WALMART | G76: 72 | H76: 3.7 | I76: =RC[-2]*RC[-1] -> 266.40000000000003 | J76: 2016-5-9 | K76: 2016-06-01T00:00:00.000 | L76: 针织
A77: 2016-01-13T00:00:00.000 | B77: 百利达 | C77: 胡金文 | D77: P170544-2 | E77: NJ36B742M | F77: WALMART | G77: 36 | H77: 3.3 | I77: =RC[-2]*RC[-1] -> 118.8 | J77: 2016-5-9 | K77: 2016-06-01T00:00:00.000 | L77: 针织
A78: 2016-01-13T00:00:00.000 | B78: 百利达 | C78: 胡金文 | D78: P170549-1 | E78: NJ36B742M | F78: WALMART | G78: 696 | H78: 3.7 | I78: =RC[-2]*RC[-1] -> 2575.2000000000003 | J78: 2016-5-9 | K78: 2016-06-01T00:00:00.000 | L78: 针织
A79: 2016-01-13T00:00:00.000 | B79: 百利达 | C79: 胡金文 | D79: P170549-2 | E79: NJ36B742M | F79: WALMART | G79: 300 | H79: 3.3 | I79: =RC[-2]*RC[-1] -> 990 | J79: 2016-5-9 | K79: 2016-06-01T00:00:00.000 | L79: 针织
A80: 2016-01-13T00:00:00.000 | B80: 百利达 | C80: 胡金文 | D80: P170563-1 | E80: NJ36B742M | F80: WALMART | G80: 384 | H80: 3.7 | I80: =RC[-2]*RC[-1] -> 1420.8000000000002 | J80: 2016-5-23 | K80: 2016-06-16T00:00:00.000 | L80: 针织
A81: 2016-01-13T00:00:00.000 | B81: 百利达 | C81: 胡金文 | D81: P170563-2 | E81: NJ36B742M | F81: WALMART | G81: 192 | H81: 3.3 | I81: =RC[-2]*RC[-1] -> 633.59999999999991 | J81: 2016-5-23 | K81: 2016-06-16T00:00:00.000 | L81: 针织
A82: 2016-01-13T00:00:00.000 | B82: 百利达 | C82: 胡金文 | D82: P170564-1 | E82: NJ36B742M | F82: WALMART | G82: 53328 | H82: 3.7 | I82: =RC[-2]*RC[-1] -> 197313.6 | J82: 2016-5-23 | K82: 2016-06-16T00:00:00.000 | L82: 针织
A83: 2016-01-13T00:00:00.000 | B83: 百利达 | C83: 胡金文 | D83: P170564-2 | E83: NJ36B742M | F83: WALMART | G83: 26664 | H83: 3.3 | I83: =RC[-2]*RC[-1] -> 87991.2 | J83: 2016-5-23 | K83: 2016-06-16T00:00:00.000 | L83: 针织
A84: 2016-01-13T00:00:00.000 | B84: 百利达 | C84: 胡金文 | D84: P170565 | E84: NJ36B742M | F84: WALMART | G84: 624 | H84: 3.7 | I84: =RC[-2]*RC[-1] -> 2308.8000000000002 | J84: 2016-6-6 | K84: 2016-07-01T00:00:00.000 | L84: 针织
A85: 2016-01-14T00:00:00.000 | B85: 百利达 | C85: 胡金文 | D85: P170566 | E85: NJ36B742M(SP3669) | F85: WALMART | G85: 77328 | H85: 3.7 | I85: =RC[-2]*RC[-1] -> 286113.60000000003 | J85: 2016-6-6 | K85: 2016-07-01T00:00:00.000 | L85: 针织
A86: 2016-01-14T00:00:00.000 | B86: 百利达 | C86: 胡金文 | D86: P170567 | E86: NJ36B742M(SP3669) | F86: WALMART | G86: 264 | H86: 3.7 | I86: =RC[-2]*RC[-1] -> 976.80000000000007 | J86: 2016-6-20 | K86: 2016-07-15T00:00:00.000 | L86: 针织
A87: 2016-01-14T00:00:00.000 | B87: 百利达 | C87: 胡金文 | D87: P170568 | E87: NJ36B742M(SP3669) | F87: WALMART | G87: 79128 | H87: 3.7 | I87: =RC[-2]*RC[-1] -> 292773.60000000003 | J87: 2016-6-20 | K87: 2016-07-15T00:00:00.000 | L87: 针织
A88: 2016-02-04T00:00:00.000 | B88: 百利达 | C88: 胡金文 | D88: P170956-1 | E88: SP3669 | F88: SHOPKO | G88: 1758 | H88: 3.3 | I88: =RC[-2]*RC[-1] -> 5801.4 | J88: 2016-5-2 | K88: 2016-05-27T00:00:00.000 | L88: 针织
A89: 2016-02-04T00:00:00.000 | B89: 百利达 | C89: 胡金文 | D89: P170956-2 | E89: SP3669 | F89: STOCK | G89: 1500 | H89: 3.8 | I89: =RC[-2]*RC[-1] -> 5700 | J89: 2016-5-2 | K89: 2016-05-27T00:00:00.000 | L89: 针织
A90: 2016-02-04T00:00:00.000 | B90: 百利达 | C90: 胡金文 | D90: P170951-1 | E90: SP3669 | F90: STOCK | G90: 642 | H90: 3.3 | I90: =RC[-2]*RC[-1] -> 2118.6 | J90: 2016-5-2 | K90: 2016-05-27T00:00:00.000 | L90: 针织
A91: 2016-02-04T00:00:00.000 | B91: 百利达 | C91: 胡金文 | D91: P170951-2 | E91: SP3669 | F91: STOCK | G91: 3900 | H91: 3.8 | I91: =RC[-2]*RC[-1] -> 14820 | J91: 2016-5-2 | K91: 2016-05-27T00:00:00.000 | L91: 针织
A92: 2016-02-15T00:00:00.000 | B92: 百利达 | C92: 胡金文 | D92: P171141-1 | E92: NJ36B742M(SP3669) | F92: WALMART.COM | G92: 684 | H92: 3.7 | I92: =RC[-2]*RC[-1] -> 2530.8000000000002 | J92: 2016-4-25 | K92: 2016-05-18T00:00:00.000 | L92: 针织
A93: 2016-02-15T00:00:00.000 | B93: 百利达 | C93: 胡金文 | D93: P171141-2 | E93: NJ36B742M(SP3669) | F93: WALMART.COM | G93: 456 | H93: 3.7 | I93: =RC[-2]*RC[-1] -> 1687.2 | J93: 2016-4-25 | K93: 2016-05-18T00:00:00.000 | L93: 针织
A94: 2015-11-26T00:00:00.000 | B94: 百利达 | C94: 武玲玲 | D94: 100-00019878 | E94: JTB6052CMV | F94: TARGET | G94: 23727 | H94: 5.5 | I94: =RC[-2]*RC[-1] -> 130498.5 | J94: 2016-3-13 | K94: 2016-03-30T00:00:00.000 | L94: 针织
A95: 2015-11-26T00:00:00.000 | B95: 百利达 | C95: 武玲玲 | D95: 100-00019877 | E95: JTW7160CMV | F95: TARGET | G95: 23094 | H95: 6.7 | I95: =RC[-2]*RC[-1] -> 154729.80000000002 | J95: 2016-3-13 | K95: 2016-03-30T00:00:00.000 | L95: 针织
A96: 2016-01-20T00:00:00.000 | B96: 百利达 | C96: 王强 | D96: 10000020841 | E96: JTW7176GLB | F96: TARGET | G96: 53585 | H96: 5.9 | I96: =RC[-2]*RC[-1] -> 316151.5 | J96: 2016-5-8 | K96: 2016-05-31T00:00:00.000 | L96: 梭织
A97: 2016-01-20T00:00:00.000 | B97: 百利达 | C97: 王强 | D97: 10000020842 | E97: JTB6060GLB | F97: TARGET | G97: 55498 | H97: 5.5 | I97: =RC[-2]*RC[-1] -> 305239 | J97: 2016-5-8 | K97: 2016-05-31T00:00:00.000 | L97: 梭织
A98: 2014-12-24T00:00:00.000 | B98: 百利达 | C98: 胡珍姑 | D98: 0000021126/001-003-005 | E98: MLG003_TRG_WPL | G98: 7500 | H98: 4.8499999999999996 | I98: =RC[-2]*RC[-1] -> 36375 | J98: 2015-04-07T00:00:00.000 | K98: 2015-04-17T00:00:00.000 | L98: 针织
A99: 2015-09-15T00:00:00.000 | B99: 百利达 | C99: 胡珍姑 | D99: 0000729342/001-002 | G99: 3000 | H99: 4.5 | I99: =RC[-2]*RC[-1] -> 13500 | J99: 2015-12-31T00:00:00.000 | K99: 2015-12-31T00:00:00.000 | L99: 针织
A100: 2106-03-01T00:00:00.000 | B100: 百利达 | C100: 谭春艳 | D100: CL160434(PO278) | E100: ILG118_SOUT_SOM | F100: Southern Marsh | G100: 1548 | H100: 3.6 | I100: =RC[-2]*RC[-1] -> 5572.8 | J100: 2016-4-30 | K100: 2016-4-30 | L100: 针织
A101: 2106-03-01T00:00:00.000 | B101: 百利达 | C101: 谭春艳 | D101: CL160437(PO279) | E101: ILG119_SOUT_SOM | F101: Southern Marsh | G101: 3010 | H101: 3.1 | I101: =RC[-2]*RC[-1] -> 9331 | J101: 2016-4-30 | K101: 2016-4-30 | L101: 针织
A102: 2015-12-10T00:00:00.000 | B102: 百利达/白云/支云塔 | C102: 武玲玲 | D102: CL153485 | E102: MBT012604S/H | F102: TARGET | G102: 96742 | H102: 4.4000000000000004 | I102: =RC[-2]*RC[-1] -> 425664.80000000005 | J102: 2016-4-10 | K102: 2016-05-01T00:00:00.000 | L102: 针织
A103: 2015-12-10T00:00:00.000 | B103: 百利达/白云/支云塔 | C103: 武玲玲 | D103: CL153486 | E103: MBT020471 | F103: TARGET | G103: 30831 | H103: 4.6500000000000004 | I103: =RC[-2]*RC[-1] -> 143364.15000000002 | J103: 2016-4-10 | K103: 2016-05-01T00:00:00.000 | L103: 针织
A104: 2016-01-13T00:00:00.000 | B104: 百利达/丁大/依尚 | C104: 付连 | D104: P170550 | E104: NJ26B588M | F104: WALMART | G104: 804 | H104: 4 | I104: =RC[-2]*RC[-1] -> 3216 | J104: 2016-4-25 | K104: 2016-05-18T00:00:00.000 | L104: 针织
A105: 2016-01-13T00:00:00.000 | B105: 百利达/丁大/依尚 | C105: 付连 | D105: P170551 | E105: NJ26B588M | F105: WALMART | G105: 804 | H105: 4 | I105: =RC[-2]*RC[-1] -> 3216 | J105: 2016-4-25 | K105: 2016-05-18T00:00:00.000 | L105: 针织
A106: 2016-01-13T00:00:00.000 | B106: 百利达/丁大/依尚 | C106: 付连 | D106: P170552 | E106: NJ26B588M | F106: WALMART | G106: 492 | H106: 4 | I106: =RC[-2]*RC[-1] -> 1968 | J106: 2016-4-25 | K106: 2016-05-18T00:00:00.000 | L106: 针织
A107: 2016-02-26T00:00:00.000 | B107: 百利达/铁源 | C107: 董灏 | D107: BA300-1 | E107: J2221MZ52Z | F107: TARGET | G107: 14595 | H107: 6.6 | I107: =RC[-2]*RC[-1] -> 96327 | J107: 2016-5-9 | K107: 2016-06-01T00:00:00.000 | L107: 梭织
A108: 2016-03-03T00:00:00.000 | B108: 百利达/铁源 | C108: 董灏 | D108: BA300EC-1 | E108: J2221MZ52Z | G108: 4 | H108: 6.4 | I108: =RC[-2]*RC[-1] -> 25.6 | J108: 2016-5-9 | K108: 2016-06-01T00:00:00.000 | L108: 梭织
A109: 2016-02-26T00:00:00.000 | B109: 百利达/铁源 | C109: 董灏 | D109: BA301-1 | E109: J2280MC73Z | F109: TARGET | G109: 14022 | H109: 7 | I109: =RC[-2]*RC[-1] -> 98154 | J109: 2016-5-9 | K109: 2016-06-01T00:00:00.000 | L109: 梭织
A110: 2016-03-03T00:00:00.000 | B110: 百利达/铁源 | C110: 董灏 | D110: BA301EC-1 | E110: J2280MC73Z | G110: 4 | H110: 6.8 | I110: =RC[-2]*RC[-1] -> 27.2 | J110: 2016-5-9 | K110: 2016-06-01T00:00:00.000 | L110: 梭织
A111: 2016-01-13T00:00:00.000 | B111: 百利达/铁源 | C111: 胡金文 | D111: P170554-1 | E111: NJ36B742M | F111: WALMART | G111: 81600 | H111: 3.7 | I111: =RC[-2]*RC[-1] -> 301920 | J111: 2016-5-9 | K111: 2016-06-01T00:00:00.000 | L111: 针织
A112: 2016-01-13T00:00:00.000 | B112: 百利达/铁源 | C112: 胡金文 | D112: P170554-2 | E112: NJ36B742M | F112: WALMART | G112: 33780 | H112: 3.3 | I112: =RC[-2]*RC[-1] -> 111474 | J112: 2016-5-9 | K112: 2016-06-01T00:00:00.000 | L112: 针织
A113: 2015-11-25T00:00:00.000 | B113: 百利达/炜雅娜 | C113: 唐琼茜 | D113: BA234-1 | E113: J3448MLSWZ | F113: TARGET | G113: 43917 | H113: 4.9000000000000004 | I113: =RC[-2]*RC[-1] -> 215193.30000000002 | J113: 2016-3-21 | K113: 2016-04-13T00:00:00.000 | L113: 梭织
A114: 2015-12-11T00:00:00.000 | B114: 百利达/炜雅娜 | C114: 唐琼茜 | D114: BA234A-1 | E114: J3448MLSWZ | F114: VANITY | G114: 72 | H114: 4.7 | I114: =RC[-2]*RC[-1] -> 338.40000000000003 | J114: 2016-3-21 | K114: 2016-04-13T00:00:00.000 | L114: 梭织
A115: 2015-11-18T00:00:00.000 | B115: 百利达/依尚 | C115: 武玲玲 | D115: CL153119 | E115: FLG26711 | F115: WALMART | G115: 120768 | H115: 4.05 | I115: =RC[-2]*RC[-1] -> 489110.39999999997 | J115: 2016-3-13 | K115: 2016-04-08T00:00:00.000 | L115: 针织
A116: 2015-11-18T00:00:00.000 | B116: 百利达/依尚 | C116: 武玲玲 | D116: CL153119 | E116: FLG26711 | F116: WALMART | G116: 50496 | H116: 4.0999999999999996 | I116: =RC[-2]*RC[-1] -> 207033.59999999998 | J116: 2016-3-13 | K116: 2016-04-08T00:00:00.000 | L116: 针织
A117: 2015-12-25T00:00:00.000 | B117: 百利达/依尚 | C117: 武玲玲 | D117: 10000020505 | E117: JTW3806GCM | F117: TARGET | G117: 21793 | H117: 6.03 | I117: =RC[-2]*RC[-1] -> 131411.79 | J117: 2016-4-3 | K117: 2016-04-20T00:00:00.000 | L117: 梭织
A118: 2015-12-25T00:00:00.000 | B118: 百利达/依尚 | C118: 武玲玲 | D118: 10000020506 | E118: JTW3750EEC | F118: TARGET | G118: 36593 | H118: 5.59 | I118: =RC[-2]*RC[-1] -> 204554.87 | J118: 2016-4-3 | K118: 2016-04-20T00:00:00.000 | L118: 梭织
A119: 2015-11-19T00:00:00.000 | B119: 东莉 | C119: 袁松燕 | D119: BA223-2 | E119: J7943MMEY | F119: BELK | G119: 4668 | H119: 5.75 | I119: =RC[-2]*RC[-1] -> 26841 | J119: 2016-3-21 | K119: 2016-04-13T00:00:00.000 | L119: 梭织
A120: 2015-11-24T00:00:00.000 | B120: 东莉 | C120: 袁松燕 | D120: BA223A-2 | E120: J7943MMEY | F120: BELK | G120: 2916 | H120: 5.75 | I120: =RC[-2]*RC[-1] -> 16767 | J120: 2016-3-21 | K120: 2016-04-13T00:00:00.000 | L120: 梭织
A121: 2015-12-03T00:00:00.000 | B121: 东莉 | C121: 袁松燕 | D121: BA223-4 | E121: J7943MMEY | F121: BELK | G121: 2072 | H121: 5.75 | I121: =RC[-2]*RC[-1] -> 11914 | J121: 2016-3-21 | K121: 2016-04-13T00:00:00.000 | L121: 梭织
A122: 2015-12-03T00:00:00.000 | B122: 东莉 | C122: 袁松燕 | D122: BA223-5 | E122: J7943MMEY | F122: BELK | G122: 48 | H122: 5.75 | I122: =RC[-2]*RC[-1] -> 276 | J122: 2016-3-21 | K122: 2016-04-13T00:00:00.000 | L122: 梭织
A123: 2015-12-04T00:00:00.000 | B123: 东莉 | C123: 袁松燕 | D123: BA223B-1 | E123: J7943MMEY | F123: BELK | G123: 208 | H123: 5.55 | I123: =RC[-2]*RC[-1] -> 1154.3999999999999 | J123: 2016-3-21 | K123: 2016-04-13T00:00:00.000 | L123: 梭织
A124: 2015-12-04T00:00:00.000 | B124: 东莉 | C124: 袁松燕 | D124: BA223A-2 | E124: J7943MMEY | F124: BELK | G124: 1504 | H124: 5.75 | I124: =RC[-2]*RC[-1] -> 8648 | J124: 2016-3-21 | K124: 2016-04-13T00:00:00.000 | L124: 梭织
A125: 2015-12-04T00:00:00.000 | B125: 东莉 | C125: 袁松燕 | D125: BA223A-3 | E125: J7943MMEY | F125: BELK | G125: 1332 | H125: 5.75 | I125: =RC[-2]*RC[-1] -> 7659 | J125: 2016-3-21 | K125: 2016-04-13T00:00:00.000 | L125: 梭织
A126: 2015-12-04T00:00:00.000 | B126: 东莉 | C126: 袁松燕 | D126: BA223A-4 | E126: J7943MMEY | F126: BELK | G126: 16 | H126: 5.75 | I126: =RC[-2]*RC[-1] -> 92 | J126: 2016-3-21 | K126: 2016-04-13T00:00:00.000 | L126: 梭织
A127: 2016-02-16T00:00:00.000 | B127: 东莉 | C127: 谭春艳 | D127: BA294-1 | E127: B7860MMEY | F127: CARSON'S | G127: 864 | H127: 6.05 | I127: =RC[-2]*RC[-1] -> 5227.2 | J127: 2016-4-25 | K127: 2016-05-20T00:00:00.000 | L127: 梭织
A128: 2016-02-16T00:00:00.000 | B128: 东莉 | C128: 谭春艳 | D128: BA294ATS | E128: B7860MMEY | F128: HOUSE ACCOUNT | G128: 792 | H128: 6.05 | I128: =RC[-2]*RC[-1] -> 4791.5999999999995 | J128: 2016-4-25 | K128: 2016-05-20T00:00:00.000 | L128: 梭织
A129: 2016-02-16T00:00:00.000 | B129: 东莉 | C129: 谭春艳 | D129: BA294ATS-01 | E129: B7860MMEY | F129: BUCKLE | G129: 480 | H129: 5.85 | I129: =RC[-2]*RC[-1] -> 2808 | J129: 2016-4-25 | K129: 2016-05-20T00:00:00.000 | L129: 梭织
A130: 2016-02-16T00:00:00.000 | B130: 东莉 | C130: 谭春艳 | D130: BA294ATS-02 | E130: B7860MMEY | F130: TARGET.COM | G130: 330 | H130: 5.85 | I130: =RC[-2]*RC[-1] -> 1930.4999999999998 | J130: 2016-4-25 | K130: 2016-05-20T00:00:00.000 | L130: 梭织
A131: 2016-02-16T00:00:00.000 | B131: 东莉 | C131: 董灏 | D131: BA293-1 | E131: J6066MZ60P | F131: BUCKLE | G131: 2400 | H131: 5.35 | I131: =RC[-2]*RC[-1] -> 12840 | J131: 2016-5-9 | K131: 2016-06-01T00:00:00.000 | L131: 梭织
A132: 2016-01-04T00:00:00.000 | B132: 高梵 | C132: 孙娟 | D132: 3548 | E132: 03JW | F132: VANITY | G132: 1344 | H132: 8.1 | I132: =RC[-2]*RC[-1] -> 10886.4 | J132: 2016-5-2 | K132: 2016-05-18T00:00:00.000 | L132: 针织
A133: 2015-11-07T00:00:00.000 | B133: 高梵 | C133: 吕婵娟 | D133: BA219-1 | E133: J1908MLSWC | F133: CATO | G133: 4620 | H133: 5.4 | I133: =RC[-2]*RC[-1] -> 24948 | J133: 2016-2-22 | K133: 2016-03-16T00:00:00.000 | L133: 梭织
A134: 2015-11-07T00:00:00.000 | B134: 高梵 | C134: 吕婵娟 | D134: BA219-2 | E134: J1908MLSWC | F134: CATO | G134: 1967 | H134: 5.4 | I134: =RC[-2]*RC[-1] -> 10621.800000000001 | J134: 2016-2-22 | K134: 2016-03-16T00:00:00.000 | L134: 梭织
A135: 2015-11-07T00:00:00.000 | B135: 高梵 | C135: 吕婵娟 | D135: BA219-3 | E135: J1908MLSWC | F135: CATO | G135: 180 | H135: 5.4 | I135: =RC[-2]*RC[-1] -> 972.00000000000011 | J135: 2016-2-22 | K135: 2016-03-16T00:00:00.000 | L135: 梭织
A136: 2015-11-07T00:00:00.000 | B136: 高梵 | C136: 吕婵娟 | D136: BA220-1 | E136: B1908MLSWC | F136: CATO | G136: 2718 | H136: 6.3 | I136: =RC[-2]*RC[-1] -> 17123.399999999998 | J136: 2016-2-22 | K136: 2016-03-16T00:00:00.000 | L136: 梭织
A137: 2015-11-07T00:00:00.000 | B137: 高梵 | C137: 吕婵娟 | D137: BA220-2 | E137: B1908MLSWC | F137: CATO | G137: 1818 | H137: 6.3 | I137: =RC[-2]*RC[-1] -> 11453.4 | J137: 2016-2-22 | K137: 2016-03-16T00:00:00.000 | L137: 梭织
A138: 2015-11-07T00:00:00.000 | B138: 高梵 | C138: 吕婵娟 | D138: BA220-3 | E138: B1908MLSWC | F138: CATO | G138: 144 | H138: 6.3 | I138: =RC[-2]*RC[-1] -> 907.19999999999993 | J138: 2016-2-22 | K138: 2016-03-16T00:00:00.000 | L138: 梭织
A139: 2015-11-17T00:00:00.000 | B139: 高梵 | C139: 吕婵娟 | D139: BA224-1 | E139: J3320MBFBT | F139: TARGET.COM | G139: 2166 | H139: 7.15 | I139: =RC[-2]*RC[-1] -> 15486.900000000001 | J139: 2016-3-7 | K139: 2016-03-30T00:00:00.000 | L139: 梭织
A140: 2015-12-08T00:00:00.000 | B140: 高梵 | C140: 董灏 | D140: BA239-1 | E140: B3350MYTYC | F140: CATO | G140: 2400 | H140: 7.05 | I140: =RC[-2]*RC[-1] -> 16920 | J140: 2016-3-14 | K140: 2016-04-06T00:00:00.000 | L140: 梭织
A141: 2015-12-23T00:00:00.000 | B141: 高梵 | C141: 吕婵娟 | D141: BA259-1 | E141: J7759CAPAZ | F141: TARGET | G141: 18168 | H141: 5.3 | I141: =RC[-2]*RC[-1] -> 96290.4 | J141: 2016-4-4 | K141: 2016-04-27T00:00:00.000 | L141: 梭织
A142: 2016-01-14T00:00:00.000 | B142: 高梵 | C142: 吕婵娟 | D142: BA259A-1 | E142: J7759CAPAZ | F142: TARGET.COM | G142: 239 | H142: 5.0999999999999996 | I142: =RC[-2]*RC[-1] -> 1218.8999999999999 | J142: 2016-4-4 | K142: 2016-04-27T00:00:00.000 | L142: 梭织
A143: 2015-12-31T00:00:00.000 | B143: 高梵 | C143: 吕婵娟 | D143: BA259EC-1 | E143: J7759CAPAZ | G143: 6 | H143: 5.0999999999999996 | I143: =RC[-2]*RC[-1] -> 30.599999999999998 | J143: 2016-4-4 | K143: 2016-04-27T00:00:00.000 | L143: 梭织
A144: 2015-12-23T00:00:00.000 | B144: 高梵 | C144: 吕婵娟 | D144: BA260-1 | E144: J7759MYUZZ | F144: TARGET | G144: 13417 | H144: 5.3 | I144: =RC[-2]*RC[-1] -> 71110.099999999991 | J144: 2016-4-4 | K144: 2016-04-27T00:00:00.000 | L144: 梭织
A145: 2016-01-14T00:00:00.000 | B145: 高梵 | C145: 吕婵娟 | D145: BA260A-1 | E145: J7759MYUZZ | F145: TARGET.COM | G145: 248 | H145: 5.0999999999999996 | I145: =RC[-2]*RC[-1] -> 1264.8 | J145: 2016-4-4 | K145: 2016-04-27T00:00:00.000 | L145: 梭织
A146: 2015-12-23T00:00:00.000 | B146: 高梵 | C146: 吕婵娟 | D146: BA261-1 | E146: J7759MZ74Z | F146: TARGET | G146: 18122 | H146: 5.9 | I146: =RC[-2]*RC[-1] -> 106919.8 | J146: 2016-4-4 | K146: 2016-04-27T00:00:00.000 | L146: 梭织
A147: 2016-01-14T00:00:00.000 | B147: 高梵 | C147: 吕婵娟 | D147: BA261A-1 | E147: J7759MZ74Z | F147: TARGET.COM | G147: 271 | H147: 5.7 | I147: =RC[-2]*RC[-1] -> 1544.7 | J147: 2016-4-4 | K147: 2016-04-27T00:00:00.000 | L147: 梭织
A148: 2016-02-24T00:00:00.000 | B148: 高梵 | C148: 鲁晨诗 | D148: HFC#41866 | E148: 49554A0003 | F148: KOHLS.COM | G148: 1000 | H148: 6.5 | I148: =RC[-2]*RC[-1] -> 6500 | J148: 2016-05-16T00:00:00.000 | K148: 2016-06-01T00:00:00.000 | L148: 梭织
A149: 2016-02-24T00:00:00.000 | B149: 高梵 | C149: 鲁晨诗 | D149: HFC#41866 | E149: 49554A0005 | F149: KOHLS.COM | G149: 600 | H149: 6.5 | I149: =RC[-2]*RC[-1] -> 3900 | J149: 2016-05-16T00:00:00.000 | K149: 2016-06-01T00:00:00.000 | L149: 梭织
A150: 2016-03-04T00:00:00.000 | B150: 高梵 | C150: 鲁晨诗 | D150: HFC#41866 | E150: 49554A0006 | F150: KOHLS.COM | G150: 500 | H150: 6.5 | I150: =RC[-2]*RC[-1] -> 3250 | J150: 2016-05-16T00:00:00.000 | K150: 2016-06-01T00:00:00.000 | L150: 梭织
A151: 2016-02-24T00:00:00.000 | B151: 高梵 | C151: 鲁晨诗 | D151: HFC#41866 | E151: 49554A0004 | F151: KOHLS.COM | G151: 700 | H151: 6.5 | I151: =RC[-2]*RC[-1] -> 4550 | J151: 2016-05-16T00:00:00.000 | K151: 2016-06-01T00:00:00.000 | L151: 梭织
A152: 2015-12-07T00:00:00.000 | B152: 昊天 | C152: 张莉 | D152: 3183 | E152: 03FJ | F152: BELK | G152: 96 | H152: 5.95 | I152: =RC[-2]*RC[-1] -> 571.20000000000005 | J152: 2016-3-14 | K152: 2016-03-30T00:00:00.000 | L152: 针织
A153: 2015-12-07T00:00:00.000 | B153: 昊天 | C153: 张莉 | D153: 3189 | E153: 03FJ | F153: BELK | G153: 4724 | H153: 5.95 | I153: =RC[-2]*RC[-1] -> 28107.8 | J153: 2016-3-14 | K153: 2016-03-30T00:00:00.000 | L153: 针织
A154: 2016-02-19T00:00:00.000 | B154: 昊天 | C154: 王晓檬 | D154: HFC#91499 | E154: 92738A0001 | F154: MACYS | G154: 3816 | H154: 6.9 | I154: =RC[-2]*RC[-1] -> 26330.400000000001 | J154: 2016-05-23T00:00:00.000 | K154: 2016-06-08T00:00:00.000 | L154: 针织
A155: 2016-02-04T00:00:00.000 | B155: 景润 | C155: 张莉 | D155: 3907 | E155: ANA3 | F155: WALMART | G155: 144 | H155: 6.1 | I155: =RC[-2]*RC[-1] -> 878.4 | J155: 2016-4-25 | K155: 2016-05-11T00:00:00.000 | L155: 梭织
A156: 2016-02-04T00:00:00.000 | B156: 景润 | C156: 张莉 | D156: 3908 | E156: ANA3 | F156: WALMART | G156: 1008 | H156: 6.1 | I156: =RC[-2]*RC[-1] -> 6148.7999999999993 | J156: 2016-4-25 | K156: 2016-05-11T00:00:00.000 | L156: 梭织
A157: 2016-02-04T00:00:00.000 | B157: 景润 | C157: 张莉 | D157: 3909 | E157: ANA3 | F157: WALMART | G157: 24 | H157: 6.1 | I157: =RC[-2]*RC[-1] -> 146.39999999999998 | J157: 2016-4-25 | K157: 2016-05-11T00:00:00.000 | L157: 梭织
A158: 2016-02-04T00:00:00.000 | B158: 景润 | C158: 张莉 | D158: 3916 | E158: ANA3 | F158: WALMART | G158: 86512 | H158: 6.1 | I158: =RC[-2]*RC[-1] -> 527723.19999999995 | J158: 2016-4-25 | K158: 2016-05-11T00:00:00.000 | L158: 梭织
A159: 2016-02-04T00:00:00.000 | B159: 景润 | C159: 张莉 | D159: 3918 | E159: ANA3 | F159: WALMART | G159: 840 | H159: 6.1 | I159: =RC[-2]*RC[-1] -> 5124 | J159: 2016-4-25 | K159: 2016-05-11T00:00:00.000 | L159: 梭织
A160: 2015-12-23T00:00:00.000 | B160: 景润 | C160: 董灏 | D160: BA256-1 | E160: J2121CAJTZ | F160: TARGET | G160: 21211 | H160: 5.75 | I160: =RC[-2]*RC[-1] -> 121963.25 | J160: 2016-4-4 | K160: 2016-04-27T00:00:00.000 | L160: 梭织
A161: 2016-01-14T00:00:00.000 | B161: 景润 | C161: 董灏 | D161: BA256A-1 | E161: J2121CAJTZ | F161: TARGET.COM | G161: 210 | H161: 5.55 | I161: =RC[-2]*RC[-1] -> 1165.5 | J161: 2016-4-4 | K161: 2016-04-27T00:00:00.000 | L161: 梭织
A162: 2016-02-01T00:00:00.000 | B162: 景润 | C162: 董灏 | D162: BA256B-1 | E162: J2121CAJTZ | F162: FRED MEYER | G162: 714 | H162: 5.75 | I162: =RC[-2]*RC[-1] -> 4105.5 | J162: 2016-4-4 | K162: 2016-04-27T00:00:00.000 | L162: 梭织
A163: 2015-12-23T00:00:00.000 | B163: 景润 | C163: 董灏 | D163: BA257-1 | E163: J2121MZ81Z | F163: TARGET | G163: 18978 | H163: 7.8 | I163: =RC[-2]*RC[-1] -> 148028.4 | J163: 2016-4-4 | K163: 2016-04-27T00:00:00.000 | L163: 梭织
A164: 2016-01-14T00:00:00.000 | B164: 景润 | C164: 董灏 | D164: BA257A-1 | E164: J2121MZ81Z | F164: TARGET.COM | G164: 191 | H164: 7.6 | I164: =RC[-2]*RC[-1] -> 1451.6 | J164: 2016-4-4 | K164: 2016-04-27T00:00:00.000 | L164: 梭织
A165: 2015-12-23T00:00:00.000 | B165: 景润 | C165: 董灏 | D165: BA258-1 | E165: J2121MZHRZ | F165: TARGET | G165: 18811 | H165: 6.15 | I165: =RC[-2]*RC[-1] -> 115687.65000000001 | J165: 2016-4-4 | K165: 2016-04-27T00:00:00.000 | L165: 梭织
A166: 2016-01-14T00:00:00.000 | B166: 景润 | C166: 董灏 | D166: BA258A-1 | E166: J2121MZHRZ | F166: TARGET.COM | G166: 190 | H166: 5.95 | I166: =RC[-2]*RC[-1] -> 1130.5 | J166: 2016-4-4 | K166: 2016-04-27T00:00:00.000 | L166: 梭织
A167: 2016-02-01T00:00:00.000 | B167: 景润 | C167: 董灏 | D167: BA258B-1 | E167: J2121MZHRZ | F167: FRED MEYER | G167: 714 | H167: 6.15 | I167: =RC[-2]*RC[-1] -> 4391.1000000000004 | J167: 2016-4-4 | K167: 2016-04-27T00:00:00.000 | L167: 梭织
A168: 2015-12-31T00:00:00.000 | B168: 景润 | C168: 董灏 | D168: BA258EC-1 | E168: J2121MZHRZ | G168: 6 | H168: 5.95 | I168: =RC[-2]*RC[-1] -> 35.700000000000003 | J168: 2016-4-4 | K168: 2016-04-27T00:00:00.000 | L168: 梭织
A169: 2015-12-02T00:00:00.000 | B169: 景润 | C169: 武玲玲 | D169: CL153388 | E169: EJ-B017673-WS/BS | F169: TARGET | G169: 20000 | H169: 7.2 | I169: =RC[-2]*RC[-1] -> 144000 | J169: 2016-3-6 | K169: 2016-03-25T00:00:00.000 | L169: 针织
A170: 2015-12-04T00:00:00.000 | B170: 景润 | C170: 武玲玲 | D170: 014749 | E170: EMT017673-BS/WS | F170: T.J MAXX | G170: 1008 | H170: 6.2 | I170: =RC[-2]*RC[-1] -> 6249.6 | J170: 2016-3-1 | K170: 2016-03-01T00:00:00.000 | L170: 针织
A171: 2015-11-24T00:00:00.000 | B171: 景润 | C171: 王强 | D171: HFC#1372 | E171: 79632A01 | F171: WALMART | G171: 1296 | H171: 4.1500000000000004 | I171: =RC[-2]*RC[-1] -> 5378.4000000000005 | J171: 2016-3-14 | K171: 2015-03-30T00:00:00.000 | L171: 针织
A172: 2015-11-24T00:00:00.000 | B172: 景润 | C172: 王强 | D172: HFC#1373 | E172: 79632A01 | F172: WALMART | G172: 96240 | H172: 4.1500000000000004 | I172: =RC[-2]*RC[-1] -> 399396.00000000006 | J172: 2016-3-21 | K172: 2016-04-06T00:00:00.000 | L172: 针织
A173: 2016-01-16T00:00:00.000 | B173: 景润 | C173: 付连 | D173: HFC#1388 | E173: 49572A | F173: WALMART | G173: 2646 | H173: 5.55 | I173: =RC[-2]*RC[-1] -> 14685.3 | J173: 2016-6-6 | K173: 2016-06-22T00:00:00.000 | L173: 梭织
A174: 2016-01-16T00:00:00.000 | B174: 景润 | C174: 付连 | D174: HFC#1389 | E174: 49572A | F174: WALMART | G174: 275886 | H174: 5.55 | I174: =RC[-2]*RC[-1] -> 1531167.3 | J174: 2016-6-20 | K174: 2016-07-06T00:00:00.000 | L174: 梭织
A175: 2016-01-16T00:00:00.000 | B175: 景润 | C175: 付连 | D175: HFC#1390 | E175: 49572A | F175: WALMART | G175: 2862 | H175: 5.55 | I175: =RC[-2]*RC[-1] -> 15884.1 | J175: 2016-7-11 | K175: 2016-07-27T00:00:00.000 | L175: 梭织
A176: 2016-03-02T00:00:00.000 | B176: 景润 | C176: 王强 | D176: HFC#1402 | E176: 22689B | F176: WALMART | G176: 75600 | H176: 4.2 | I176: =RC[-2]*RC[-1] -> 317520 | J176: 2016-05-23T00:00:00.000 | K176: 2016-06-08T00:00:00.000 | L176: 针织
A177: 2016-01-18T00:00:00.000 | B177: 景润 | C177: 付连 | D177: P170542 | E177: NJ36T208M | F177: WALMART | G177: 124288 | H177: 3.55 | I177: =RC[-2]*RC[-1] -> 441222.39999999997 | J177: 2016-5-2 | K177: 2016-05-25T00:00:00.000 | L177: 梭织
A178: 2016-02-17T00:00:00.000 | B178: 景润 | C178: 付连 | D178: P171070 | E178: NJ36T300M(ZR9646) | F178: WALMART | G178: 656 | H178: 4.5 | I178: =RC[-2]*RC[-1] -> 2952 | J178: 2016-5-16 | K178: 2016-06-08T00:00:00.000 | L178: 针织
A179: 2016-02-17T00:00:00.000 | B179: 景润 | C179: 付连 | D179: P171071 | E179: NJ36T300M(ZR9646) | F179: WALMART | G179: 47632 | H179: 4.5 | I179: =RC[-2]*RC[-1] -> 214344 | J179: 2016-5-16 | K179: 2016-06-08T00:00:00.000 | L179: 针织
A180: 2016-02-18T00:00:00.000 | B180: 美琪 | C180: 孙娟 | D180: 4103 | E180: 0ZMN | F180: MACYS | G180: 528 | H180: 3.7 | I180: =RC[-2]*RC[-1] -> 1953.6000000000001 | J180: 2016-5-9 | K180: 2016-05-25T00:00:00.000 | L180: 针织
A181: 2016-02-18T00:00:00.000 | B181: 美琪 | C181: 孙娟 | D181: 4104 | E181: 0ZMN | F181: MACYS | G181: 1892 | H181: 3.7 | I181: =RC[-2]*RC[-1] -> 7000.4000000000005 | J181: 2016-5-9 | K181: 2016-05-25T00:00:00.000 | L181: 针织
A182: 2016-02-18T00:00:00.000 | B182: 美琪 | C182: 孙娟 | D182: 4105 | E182: 0ZMN | F182: MACYS | G182: 8985 | H182: 3.85 | I182: =RC[-2]*RC[-1] -> 34592.25 | J182: 2016-5-9 | K182: 2016-05-25T00:00:00.000 | L182: 针织
A183: 2016-02-18T00:00:00.000 | B183: 美琪 | C183: 孙娟 | D183: 4106 | E183: 0ZMN | F183: MACYS | G183: 122 | H183: 3.85 | I183: =RC[-2]*RC[-1] -> 469.7 | J183: 2016-4-4 | K183: 2016-04-22T00:00:00.000 | L183: 针织
A184: 2016-02-20T00:00:00.000 | B184: 美琪 | C184: 孙娟 | D184: 4365 | E184: 0ZMN | F184: SHOPKO | G184: 1324 | H184: 4.5 | I184: =RC[-2]*RC[-1] -> 5958 | J184: 2016-5-23 | K184: 2016-06-10T00:00:00.000 | L184: 针织
A185: 2016-02-24T00:00:00.000 | B185: 美琪 | C185: 孙娟 | D185: 4682 | E185: 0ZMN | F185: BURLINGTON | G185: 5616 | H185: 3.85 | I185: =RC[-2]*RC[-1] -> 21621.600000000002 | J185: 2016-5-9 | K185: 2016-05-25T00:00:00.000 | L185: 针织
A186: 2015-11-20T00:00:00.000 | B186: 美琪 | C186: 王强 | D186: HFC#1367 | E186: 41526A0001 | F186: WALMART | G186: 17928 | I186: =RC[-2]*RC[-1] -> 0 | J186: 2016-3-21 | K186: 2016-04-06T00:00:00.000 | L186: 针织
A187: 2015-11-20T00:00:00.000 | B187: 美琪 | C187: 王强 | D187: HFC#1367 | E187: 41526A0002 | F187: WALMART | G187: 14848 | I187: =RC[-2]*RC[-1] -> 0 | J187: 2016-3-21 | K187: 2016-04-06T00:00:00.000 | L187: 针织
A188: 2015-11-20T00:00:00.000 | B188: 美琪 | C188: 王强 | D188: HFC#1367 | E188: 41526A0003 | F188: WALMART | G188: 3626 | I188: =RC[-2]*RC[-1] -> 0 | J188: 2016-3-21 | K188: 2016-04-06T00:00:00.000 | L188: 针织
A189: 2015-11-20T00:00:00.000 | B189: 美琪 | C189: 王强 | D189: HFC#1367 | E189: 41526A0004 | F189: WALMART | G189: 17928 | I189: =RC[-2]*RC[-1] -> 0 | J189: 2016-3-21 | K189: 2016-04-06T00:00:00.000 | L189: 针织
A190: 2015-10-14T00:00:00.000 | B190: 美琪 | C190: 付连 | D190: P168653 | E190: XT4060-7461-7383 | F190: STAGE | G190: 4446 | H190: 4.5 | I190: =RC[-2]*RC[-1] -> 20007 | J190: 2016-3-6 | K190: 2016-03-30T00:00:00.000 | L190: 针织
A191: 2015-11-23T00:00:00.000 | B191: 美琪 | C191: 付连 | D191: P169893 | E191: ZQ6161 | F191: STOCK | G191: 4800 | H191: 3.65 | I191: =RC[-2]*RC[-1] -> 17520 | J191: 2016-3-7 | K191: 2016-03-30T00:00:00.000 | L191: 针织
A192: 2015-12-23T00:00:00.000 | B192: 美琪 | C192: 付连 | D192: P170314 | E192: ZQ6161 | F192: STOCK | G192: 2400 | H192: 3.65 | I192: =RC[-2]*RC[-1] -> 8760 | J192: 2016-3-28 | K192: 2016-04-20T00:00:00.000 | L192: 针织
A193: 2015-12-23T00:00:00.000 | B193: 美琪 | C193: 付连 | D193: P170320 | E193: ZQ6161 | F193: STAGE | G193: 5256 | H193: 3.9 | I193: =RC[-2]*RC[-1] -> 20498.399999999998 | J193: 2016-3-28 | K193: 2016-04-13T00:00:00.000 | L193: 针织
A194: 2015-12-23T00:00:00.000 | B194: 美琪 | C194: 付连 | D194: P170321 | E194: ZQ6161 | F194: STAGE.COM | G194: 234 | H194: 3.65 | I194: =RC[-2]*RC[-1] -> 854.1 | J194: 2016-3-28 | K194: 2016-04-13T00:00:00.000 | L194: 针织
A195: 2016-01-19T00:00:00.000 | B195: 美琪 | C195: 胡金文 | D195: P170582 | E195: ZU2979-7878-5427 | F195: STOCK | G195: 2394 | H195: 4.0999999999999996 | I195: =RC[-2]*RC[-1] -> 9815.4 | J195: 2016-4-18 | K195: 2016-05-11T00:00:00.000 | L195: 针织
A196: 2016-01-19T00:00:00.000 | B196: 美琪 | C196: 胡金文 | D196: P171444 | E196: ZU2979-7878-5427 | F196: ARMY ECOM | G196: 48 | H196: 4.0999999999999996 | I196: =RC[-2]*RC[-1] -> 196.79999999999998 | J196: 2016-4-18 | K196: 2016-05-11T00:00:00.000 | L196: 针织
A197: 2016-01-19T00:00:00.000 | B197: 美琪 | C197: 胡金文 | D197: P171445 | E197: ZU2979-7878-5427 | F197: ARMY BULK | G197: 1002 | H197: 4.3499999999999996 | I197: =RC[-2]*RC[-1] -> 4358.7 | J197: 2016-4-18 | K197: 2016-05-11T00:00:00.000 | L197: 针织
A198: 2016-01-19T00:00:00.000 | B198: 美琪 | C198: 胡金文 | D198: P171446 | E198: ZU2979-7878-5427 | F198: STAGE | G198: 1356 | H198: 4.3499999999999996 | I198: =RC[-2]*RC[-1] -> 5898.5999999999995 | J198: 2016-4-18 | K198: 2016-05-11T00:00:00.000 | L198: 针织
A199: 2016-02-17T00:00:00.000 | B199: 美琪 | C199: 胡金文 | D199: P170945 | E199: ZU2979-7878-5427 | F199: MACYS | G199: 9432 | H199: 4.45 | I199: =RC[-2]*RC[-1] -> 41972.4 | J199: 2016-5-2 | K199: 2016-05-25T00:00:00.000 | L199: 针织
A200: 2016-02-17T00:00:00.000 | B200: 美琪 | C200: 胡金文 | D200: P171604 | E200: ZU2979-7878-5427 | F200: MACYS.COM | G200: 1941 | H200: 4.2 | I200: =RC[-2]*RC[-1] -> 8152.2000000000007 | J200: 2016-5-2 | K200: 2016-05-25T00:00:00.000 | L200: 针织
A201: 2016-02-17T00:00:00.000 | B201: 美琪 | C201: 胡金文 | D201: P171605 | E201: ZU2979-7878-5427 | F201: MACYS | G201: 71 | H201: 4.45 | I201: =RC[-2]*RC[-1] -> 315.95 | J201: 2016-4-4 | K201: 2016-04-27T00:00:00.000 | L201: 针织
A202: 2015-12-29T00:00:00.000 | B202: 明月 | C202: 卿春艳 | D202: 650175 | E202: 12PA29716(G2182) | G202: 320 | H202: 9.9499999999999993 | I202: =RC[-2]*RC[-1] -> 3184 | J202: 2016-4-4 | K202: 2016-04-20T00:00:00.000 | L202: 梭织
A203: 2015-12-29T00:00:00.000 | B203: 明月 | C203: 卿春艳 | D203: 650175 | E203: 12PA29716(G2182) | G203: 480 | H203: 10.1 | I203: =RC[-2]*RC[-1] -> 4848 | J203: 2016-4-4 | K203: 2016-04-20T00:00:00.000 | L203: 梭织
A204: 2015-12-03T00:00:00.000 | B204: 欧凯 | C204: 孙娟 | D204: 3146 | E204: 0YPB | F204: BELK | G204: 1096 | H204: 7.6 | I204: =RC[-2]*RC[-1] -> 8329.6 | J204: 2016-3-7 | K204: 2016-03-28T00:00:00.000 | L204: 针织
A205: 2015-12-25T00:00:00.000 | B205: 欧凯 | C205: 孙娟 | D205: 3371 | E205: 0YPB | F205: BELK | G205: 75 | H205: 7.45 | I205: =RC[-2]*RC[-1] -> 558.75 | J205: 2016-3-7 | K205: 2016-03-28T00:00:00.000 | L205: 针织
A206: 2015-12-25T00:00:00.000 | B206: 欧凯 | C206: 孙娟 | D206: 3372 | E206: 0YPB | F206: BELK | G206: 75 | H206: 7.45 | I206: =RC[-2]*RC[-1] -> 558.75 | J206: 2016-3-7 | K206: 2016-03-28T00:00:00.000 | L206: 针织
A207: 2015-12-03T00:00:00.000 | B207: 欧凯 | C207: 孙娟 | D207: 3147 | E207: 0YPB | F207: BELK | G207: 2332 | H207: 7.6 | I207: =RC[-2]*RC[-1] -> 17723.2 | J207: 2016-3-7 | K207: 2016-03-28T00:00:00.000 | L207: 针织
A208: 2015-12-11T00:00:00.000 | B208: 欧凯 | C208: 孙娟 | D208: 3277 | E208: 0YLT | F208: SHOPKO | G208: 5583 | H208: 6.5 | I208: =RC[-2]*RC[-1] -> 36289.5 | J208: 2016-4-4 | K208: 2016-04-20T00:00:00.000 | L208: 针织
A209: 2015-12-11T00:00:00.000 | B209: 欧凯 | C209: 孙娟 | D209: 3278 | E209: 0YKB | F209: SHOPKO | G209: 6460 | H209: 5.5 | I209: =RC[-2]*RC[-1] -> 35530 | J209: 2016-4-4 | K209: 2016-04-20T00:00:00.000 | L209: 针织
A210: 2015-12-11T00:00:00.000 | B210: 欧凯 | C210: 孙娟 | D210: 3279 | E210: 0YKB | F210: SHOPKO | G210: 188 | H210: 5.5 | I210: =RC[-2]*RC[-1] -> 1034 | J210: 2016-4-4 | K210: 2016-04-20T00:00:00.000 | L210: 针织
A211: 2015-12-11T00:00:00.000 | B211: 欧凯 | C211: 孙娟 | D211: 3280 | E211: 0YSQ | F211: SHOPKO | G211: 5742 | H211: 5.6 | I211: =RC[-2]*RC[-1] -> 32155.199999999997 | J211: 2016-4-4 | K211: 2016-04-20T00:00:00.000 | L211: 针织
A212: 2015-12-11T00:00:00.000 | B212: 欧凯 | C212: 孙娟 | D212: 3281 | E212: 0YSQ | F212: SHOPKO | G212: 120 | H212: 5.45 | I212: =RC[-2]*RC[-1] -> 654 | J212: 2016-4-4 | K212: 2016-04-20T00:00:00.000 | L212: 针织
A213: 2016-02-15T00:00:00.000 | B213: 欧凯 | C213: 孙娟 | D213: 3902 | E213: 0YKB | F213: SHOPKO | G213: 2178 | H213: 5.5 | I213: =RC[-2]*RC[-1] -> 11979 | J213: 2016-4-4 | K213: 2016-04-20T00:00:00.000 | L213: 针织
A214: 2016-03-01T00:00:00.000 | B214: 欧凯 | C214: 张莉 | D214: 0428 | E214: 0YVX | F214: MACYS | G214: 14910 | H214: 4.3499999999999996 | I214: =RC[-2]*RC[-1] -> 64858.499999999993 | J214: 2016-5-9 | K214: 2016-05-25T00:00:00.000 | L214: 针织
A215: 2016-03-01T00:00:00.000 | B215: 欧凯 | C215: 张莉 | D215: 0441 | E215: 0YVX | F215: GABRIEL BROTHERS | G215: 368 | H215: 4.2 | I215: =RC[-2]*RC[-1] -> 1545.6000000000001 | J215: 2016-5-9 | K215: 2016-05-25T00:00:00.000 | L215: 针织
A216: 2016-03-01T00:00:00.000 | B216: 欧凯 | C216: 张莉 | D216: 0454 | E216: 0YVX | F216: MACY.COM | G216: 734 | H216: 4.2 | I216: =RC[-2]*RC[-1] -> 3082.8 | J216: 2016-5-9 | K216: 2016-05-25T00:00:00.000 | L216: 针织
A217: 2015-11-06T00:00:00.000 | B217: 欧凯 | C217: 王强 | D217: BA217-1 | E217: B3367CABPP-NH | F217: TORRID | G217: 1408 | H217: 4.95 | I217: =RC[-2]*RC[-1] -> 6969.6 | J217: 2016-2-22 | K217: 2016-03-16T00:00:00.000 | L217: 梭织
A218: 2015-11-20T00:00:00.000 | B218: 欧凯 | C218: 王强 | D218: BA217-2 | E218: B3367CABPP-NH | F218: TORRID | G218: 1117 | H218: 4.95 | I218: =RC[-2]*RC[-1] -> 5529.1500000000005 | J218: 2016-2-22 | K218: 2016-03-16T00:00:00.000 | L218: 梭织
A219: 2015-11-20T00:00:00.000 | B219: 欧凯 | C219: 王强 | D219: BA217A-1 | E219: B3367CABPP-NH | F219: TORRID | G219: 1277 | H219: 4.95 | I219: =RC[-2]*RC[-1] -> 6321.1500000000005 | J219: 2016-2-22 | K219: 2016-03-16T00:00:00.000 | L219: 梭织
A220: 2015-11-20T00:00:00.000 | B220: 欧凯 | C220: 王强 | D220: BA217A-2 | E220: B3367CABPP-NH | F220: TORRID | G220: 1832 | H220: 4.95 | I220: =RC[-2]*RC[-1] -> 9068.4 | J220: 2016-2-22 | K220: 2016-03-16T00:00:00.000 | L220: 梭织
A221: 2015-11-20T00:00:00.000 | B221: 欧凯 | C221: 王强 | D221: BA217B-1 | E221: B3367CABPP-NH | F221: TORRID | G221: 556 | H221: 4.95 | I221: =RC[-2]*RC[-1] -> 2752.2000000000003 | J221: 2016-2-22 | K221: 2016-03-16T00:00:00.000 | L221: 梭织
A222: 2015-11-20T00:00:00.000 | B222: 欧凯 | C222: 王强 | D222: BA217C-1 | E222: B3367CABPP-NH | F222: TORRID | G222: 97 | H222: 4.95 | I222: =RC[-2]*RC[-1] -> 480.15000000000003 | J222: 2016-2-22 | K222: 2016-03-16T00:00:00.000 | L222: 梭织
A223: 2016-01-06T00:00:00.000 | B223: 欧凯 | C223: 董灏 | D223: BA276-1 | E223: J7569MZ65G | G223: 1112 | H223: 7 | I223: =RC[-2]*RC[-1] -> 7784 | J223: 2016-5-16 | K223: 2016-06-08T00:00:00.000 | L223: 梭织
A224: 2016-01-06T00:00:00.000 | B224: 欧凯 | C224: 董灏 | D224: BA276-2 | E224: J7569MZ65G | G224: 1672 | H224: 7 | I224: =RC[-2]*RC[-1] -> 11704 | J224: 2016-5-16 | K224: 2016-06-08T00:00:00.000 | L224: 梭织
A225: 2016-01-06T00:00:00.000 | B225: 欧凯 | C225: 董灏 | D225: BA276-3 | E225: J7569MZ65G | G225: 728 | H225: 7 | I225: =RC[-2]*RC[-1] -> 5096 | J225: 2016-5-16 | K225: 2016-06-08T00:00:00.000 | L225: 梭织
A226: 2016-01-06T00:00:00.000 | B226: 欧凯 | C226: 董灏 | D226: BA276A-1 | E226: J7569MZ65G | G226: 48 | H226: 6.8 | I226: =RC[-2]*RC[-1] -> 326.39999999999998 | J226: 2016-5-16 | K226: 2016-06-08T00:00:00.000 | L226: 梭织
A227: 2016-01-06T00:00:00.000 | B227: 欧凯 | C227: 董灏 | D227: BA277-1 | E227: B7569MZ65G | G227: 1392 | H227: 7.7 | I227: =RC[-2]*RC[-1] -> 10718.4 | J227: 2016-5-16 | K227: 2016-06-08T00:00:00.000 | L227: 梭织
A228: 2016-01-06T00:00:00.000 | B228: 欧凯 | C228: 董灏 | D228: BA277-2 | E228: B7569MZ65G | G228: 112 | H228: 7.7 | I228: =RC[-2]*RC[-1] -> 862.4 | J228: 2016-5-16 | K228: 2016-06-08T00:00:00.000 | L228: 梭织
A229: 2016-01-06T00:00:00.000 | B229: 欧凯 | C229: 董灏 | D229: BA277-3 | E229: B7569MZ65G | G229: 16 | H229: 7.7 | I229: =RC[-2]*RC[-1] -> 123.2 | J229: 2016-5-16 | K229: 2016-06-08T00:00:00.000 | L229: 梭织
A230: 2016-01-06T00:00:00.000 | B230: 欧凯 | C230: 董灏 | D230: BA277A-1 | E230: B7569MZ65G | G230: 56 | H230: 7.5 | I230: =RC[-2]*RC[-1] -> 420 | J230: 2016-5-16 | K230: 2016-06-08T00:00:00.000 | L230: 梭织
A231: 2016-02-16T00:00:00.000 | B231: 欧凯 | C231: 吕婵娟 | D231: BA289-1 | E231: J7899CAEUC | F231: CATO | G231: 3780 | H231: 5.75 | I231: =RC[-2]*RC[-1] -> 21735 | J231: 2016-4-25 | K231: 2016-05-20T00:00:00.000 | L231: 针织
A232: 2016-02-16T00:00:00.000 | B232: 欧凯 | C232: 吕婵娟 | D232: BA289-2 | E232: J7899CAEUC | F232: CATO | G232: 2513 | H232: 5.75 | I232: =RC[-2]*RC[-1] -> 14449.75 | J232: 2016-4-25 | K232: 2016-05-20T00:00:00.000 | L232: 针织
A233: 2016-02-16T00:00:00.000 | B233: 欧凯 | C233: 吕婵娟 | D233: BA289-3 | E233: J7899CAEUC | F233: CATO | G233: 90 | H233: 5.75 | I233: =RC[-2]*RC[-1] -> 517.5 | J233: 2016-4-25 | K233: 2016-05-20T00:00:00.000 | L233: 针织
A234: 2016-02-17T00:00:00.000 | B234: 欧凯 | C234: 吕婵娟 | D234: BA295-1 | E234: J9643CBGCC | F234: CATO | G234: 2616 | H234: 4.2 | I234: =RC[-2]*RC[-1] -> 10987.2 | J234: 2016-5-16 | K234: 2016-06-10T00:00:00.000 | L234: 针织
A235: 2016-02-17T00:00:00.000 | B235: 欧凯 | C235: 吕婵娟 | D235: BA295-2 | E235: J9643CBGCC | F235: CATO | G235: 1736 | H235: 4.2 | I235: =RC[-2]*RC[-1] -> 7291.2000000000007 | J235: 2016-5-16 | K235: 2016-06-10T00:00:00.000 | L235: 针织
A236: 2016-02-17T00:00:00.000 | B236: 欧凯 | C236: 吕婵娟 | D236: BA296-1 | E236: B9643CBGCC | F236: CATO | G236: 4158 | H236: 4.8499999999999996 | I236: =RC[-2]*RC[-1] -> 20166.3 | J236: 2016-5-16 | K236: 2016-06-10T00:00:00.000 | L236: 针织
A237: 2016-02-17T00:00:00.000 | B237: 欧凯 | C237: 吕婵娟 | D237: BA296-2 | E237: B9643CBGCC | F237: CATO | G237: 745 | H237: 4.8499999999999996 | I237: =RC[-2]*RC[-1] -> 3613.2499999999995 | J237: 2016-5-16 | K237: 2016-06-10T00:00:00.000 | L237: 针织
A238: 2015-12-02T00:00:00.000 | B238: 欧凯 | C238: 武玲玲 | D238: CL153387 | E238: EJ-T019686-WS | F238: TARGET | G238: 7429 | H238: 9.25 | I238: =RC[-2]*RC[-1] -> 68718.25 | J238: 2016-3-6 | K238: 2016-03-25T00:00:00.000 | L238: 针织
A239: 2015-12-04T00:00:00.000 | B239: 欧凯 | C239: 武玲玲 | D239: 014743 | E239: EMT019686-BS/WS | F239: ED INC | G239: 1752 | H239: 9.25 | I239: =RC[-2]*RC[-1] -> 16206 | J239: 2016-3-13 | K239: 2016-04-01T00:00:00.000 | L239: 针织
A240: 2015-12-04T00:00:00.000 | B240: 欧凯 | C240: 武玲玲 | D240: 016657 | E240: EMT019686-BS/WS | F240: T.J MAXX | G240: 648 | H240: 8.25 | I240: =RC[-2]*RC[-1] -> 5346 | J240: 2016-3-1 | K240: 2016-03-01T00:00:00.000 | L240: 针织
A241: 2015-11-26T00:00:00.000 | B241: 欧凯 | C241: 王强 | D241: HFC#91444 | E241: 25992A0001 | F241: MACYS | G241: 1434 | I241: =RC[-2]*RC[-1] -> 0 | J241: 2016-3-28 | K241: 2016-04-13T00:00:00.000 | L241: 针织
A242: 2016-01-05T00:00:00.000 | B242: 欧凯 | C242: 付连 | D242: 2-16-204644 | E242: 25992C0001 | F242: MACYS | G242: 870 | I242: =RC[-2]*RC[-1] -> 0 | J242: 2016-4-25 | K242: 2016-05-11T00:00:00.000 | L242: 针织
A243: 2016-01-05T00:00:00.000 | B243: 欧凯 | C243: 付连 | D243: 2-16-204645 | E243: 25992C0001 | F243: MACYS | G243: 600 | I243: =RC[-2]*RC[-1] -> 0 | J243: 2016-4-25 | K243: 2016-05-11T00:00:00.000 | L243: 针织
A244: 2016-01-05T00:00:00.000 | B244: 欧凯 | C244: 付连 | D244: 2-16-204642 | E244: 25992A0001 | F244: MACYS | G244: 4236 | I244: =RC[-2]*RC[-1] -> 0 | J244: 2016-4-25 | K244: 2016-05-11T00:00:00.000 | L244: 针织
A245: 2016-01-05T00:00:00.000 | B245: 欧凯 | C245: 付连 | D245: 2-16-204643 | E245: 25992B0001 | F245: MACYS | G245: 1836 | I245: =RC[-2]*RC[-1] -> 0 | J245: 2016-4-25 | K245: 2016-05-11T00:00:00.000 | L245: 针织
A246: 2015-11-25T00:00:00.000 | B246: 欧凯 | C246: 王强 | D246: 7424 | E246: JB0694K3821 | G246: 3204 | H246: 5.8 | I246: =RC[-2]*RC[-1] -> 18583.2 | J246: 2016-3-21 | K246: 2016-04-08T00:00:00.000 | L246: 针织
A247: 2015-11-25T00:00:00.000 | B247: 欧凯 | C247: 王强 | D247: 7424 | E247: JB0694K3821 | G247: 264 | H247: 5.65 | I247: =RC[-2]*RC[-1] -> 1491.6000000000001 | J247: 2016-3-21 | K247: 2016-04-08T00:00:00.000 | L247: 针织
A248: 2015-11-25T00:00:00.000 | B248: 欧凯 | C248: 王强 | D248: 7425 | E248: JB0694K3821 | G248: 156 | H248: 5.8 | I248: =RC[-2]*RC[-1] -> 904.8 | J248: 2016-3-21 | K248: 2016-04-08T00:00:00.000 | L248: 针织
A249: 2015-12-08T00:00:00.000 | B249: 欧凯 | C249: 王强 | D249: 7613 | E249: MT2146L9A16 | G249: 1126 | H249: 8.85 | I249: =RC[-2]*RC[-1] -> 9965.1 | J249: 2016-3-7 | K249: 2016-03-23T00:00:00.000 | L249: 针织
A250: 2016-02-24T00:00:00.000 | B250: 欧凯 | C250: 王强 | D250: 9427 | E250: KT5372S6395 | G250: 395 | H250: 4 | I250: =RC[-2]*RC[-1] -> 1580 | J250: 2016-6-6 | K250: 2016-06-24T00:00:00.000 | L250: 针织
A251: 2016-02-24T00:00:00.000 | B251: 欧凯 | C251: 王强 | D251: 9427 | E251: KT5372S6395 | G251: 5980 | H251: 4.1500000000000004 | I251: =RC[-2]*RC[-1] -> 24817.000000000004 | J251: 2016-6-6 | K251: 2016-06-24T00:00:00.000 | L251: 针织
A252: 2016-03-01T00:00:00.000 | B252: 欧凯 | C252: 王强 | D252: 9680 | E252: MT4704K0A76 | G252: 11551 | H252: 4.6500000000000004 | I252: =RC[-2]*RC[-1] -> 53712.15 | J252: 2016-5-23 | K252: 2016-06-10T00:00:00.000 | L252: 针织
A253: 2016-03-01T00:00:00.000 | B253: 欧凯 | C253: 王强 | D253: 9680 | E253: MT4704K0A76 | G253: 675 | H253: 4.5 | I253: =RC[-2]*RC[-1] -> 3037.5 | J253: 2016-5-23 | K253: 2016-06-10T00:00:00.000 | L253: 针织
A254: 2016-03-01T00:00:00.000 | B254: 欧凯 | C254: 王强 | D254: 9682 | E254: MT4704K0A76 | G254: 38 | H254: 4.6500000000000004 | I254: =RC[-2]*RC[-1] -> 176.70000000000002 | J254: 2016-5-9 | K254: 2016-05-27T00:00:00.000 | L254: 针织
A255: 2015-12-23T00:00:00.000 | B255: 润鑫 | C255: 袁松燕 | D255: BA223C | E255: J7943MMEY | F255: STAGE | G255: 6528 | H255: 5.75 | I255: =RC[-2]*RC[-1] -> 37536 | J255: 2016-3-21 | K255: 2016-04-13T00:00:00.000 | L255: 梭织
A256: 2015-11-23T00:00:00.000 | B256: 润鑫 | C256: 袁松燕 | D256: BA225-1 | E256: B7943MMEY | F256: BELK | G256: 1496 | H256: 6.5 | I256: =RC[-2]*RC[-1] -> 9724 | J256: 2016-2-29 | K256: 2016-03-23T00:00:00.000 | L256: 梭织
A257: 2015-12-09T00:00:00.000 | B257: 润鑫 | C257: 袁松燕 | D257: BA225-3 | E257: B7943MMEY | F257: BELK | G257: 392 | H257: 6.5 | I257: =RC[-2]*RC[-1] -> 2548 | J257: 2016-2-29 | K257: 2016-03-23T00:00:00.000 | L257: 梭织
A258: 2015-12-09T00:00:00.000 | B258: 润鑫 | C258: 袁松燕 | D258: BA225A-2 | E258: B7943MMEY | F258: BELK | G258: 72 | H258: 6.3 | I258: =RC[-2]*RC[-1] -> 453.59999999999997 | J258: 2016-2-29 | K258: 2016-03-23T00:00:00.000 | L258: 梭织
A259: 2015-11-23T00:00:00.000 | B259: 润鑫 | C259: 袁松燕 | D259: BA225ATS | E259: B7943MMEY | F259: HOUSE ACCOUNT | G259: 558 | H259: 6.5 | I259: =RC[-2]*RC[-1] -> 3627 | J259: 2016-2-29 | K259: 2016-03-23T00:00:00.000 | L259: 梭织
A260: 2015-11-23T00:00:00.000 | B260: 润鑫 | C260: 袁松燕 | D260: BA225ATS-04 | E260: B7943MMEY | F260: MACY.COM | G260: 546 | H260: 6.3 | I260: =RC[-2]*RC[-1] -> 3439.7999999999997 | J260: 2016-2-29 | K260: 2016-03-23T00:00:00.000 | L260: 梭织
A261: 2015-11-23T00:00:00.000 | B261: 润鑫 | C261: 袁松燕 | D261: BA225ATSEC-01 | E261: B7943MMEY | F261: HOUSE ACCOUNT | G261: 6 | H261: 6.3 | I261: =RC[-2]*RC[-1] -> 37.799999999999997 | J261: 2016-2-29 | K261: 2016-03-23T00:00:00.000 | L261: 梭织
A262: 2016-01-08T00:00:00.000 | B262: 润鑫 | C262: 袁松燕 | D262: BA225ATS-02 | E262: B7943MMEY | F262: TARGET.COM | G262: 150 | H262: 6.3 | I262: =RC[-2]*RC[-1] -> 945 | J262: 2016-2-29 | K262: 2016-03-23T00:00:00.000 | L262: 梭织
A263: 2016-01-08T00:00:00.000 | B263: 润鑫 | C263: 袁松燕 | D263: BA225ATS-03 | E263: B7943MMEY | F263: HOUSE ACCOUNT | G263: 582 | H263: 6.5 | I263: =RC[-2]*RC[-1] -> 3783 | J263: 2016-2-29 | K263: 2016-03-23T00:00:00.000 | L263: 梭织
A264: 2015-12-10T00:00:00.000 | B264: 润鑫 | C264: 袁松燕 | D264: BA225ATS-01 | E264: B7943MMEY | F264: NORDSTROM | G264: 564 | H264: 6.3 | I264: =RC[-2]*RC[-1] -> 3553.2 | J264: 2016-2-29 | K264: 2016-03-23T00:00:00.000 | L264: 梭织
A265: 2015-11-24T00:00:00.000 | B265: 润鑫 | C265: 董灏 | D265: BA228-1 | E265: J5925MQFR | F265: BURLINGTON | G265: 1800 | H265: 5.2 | I265: =RC[-2]*RC[-1] -> 9360 | J265: 2016-3-21 | K265: 2016-04-12T00:00:00.000 | L265: 针织
A266: 2015-11-24T00:00:00.000 | B266: 润鑫 | C266: 董灏 | D266: BA228A-1 | E266: J5925MQFR | F266: BURLINGTON | G266: 1800 | H266: 5.2 | I266: =RC[-2]*RC[-1] -> 9360 | J266: 2016-3-21 | K266: 2016-04-12T00:00:00.000 | L266: 针织
A267: 2015-12-09T00:00:00.000 | B267: 润鑫 | C267: 董灏 | D267: BA228B-1 | E267: J5925MQFR | F267: VON MAUR | G267: 240 | H267: 5.4 | I267: =RC[-2]*RC[-1] -> 1296 | J267: 2016-3-21 | K267: 2016-04-12T00:00:00.000 | L267: 针织
A268: 2015-12-02T00:00:00.000 | B268: 润鑫 | C268: 周婷 | D268: BA236-1 | E268: J3376MMEY | F268: FRED MEYER | G268: 4020 | H268: 6 | I268: =RC[-2]*RC[-1] -> 24120 | J268: 2016-3-21 | K268: 2016-04-13T00:00:00.000 | L268: 梭织
A269: 2015-12-02T00:00:00.000 | B269: 润鑫 | C269: 周婷 | D269: BA236ATS-01 | E269: J3376MMEY | F269: CATO | G269: 4560 | H269: 5.8 | I269: =RC[-2]*RC[-1] -> 26448 | J269: 2016-3-21 | K269: 2016-04-13T00:00:00.000 | L269: 梭织
A270: 2015-12-02T00:00:00.000 | B270: 润鑫 | C270: 周婷 | D270: BA236ATSBT-1 | E270: J3376MMEY | F270: CATO | G270: 240 | H270: 5.8 | I270: =RC[-2]*RC[-1] -> 1392 | J270: 2016-3-21 | K270: 2016-04-13T00:00:00.000 | L270: 梭织
A271: 2015-11-26T00:00:00.000 | B271: 润鑫 | C271: 付连 | D271: HFC#91429-1 | E271: 92369A0001 | F271: MACYS | G271: 2409 | I271: =RC[-2]*RC[-1] -> 0 | J271: 2016-3-7 | K271: 2016-03-23T00:00:00.000 | L271: 针织
A272: 2015-11-26T00:00:00.000 | B272: 润鑫 | C272: 付连 | D272: HFC#91431-1 | E272: 92369C0001 | F272: MACYS | G272: 1062 | I272: =RC[-2]*RC[-1] -> 0 | J272: 2016-3-7 | K272: 2016-03-23T00:00:00.000 | L272: 针织
A273: 2015-11-26T00:00:00.000 | B273: 润鑫 | C273: 王强 | D273: HFC#91434 | E273: 21748A0001 | F273: MACYS | G273: 8682 | I273: =RC[-2]*RC[-1] -> 0 | J273: 2016-3-7 | K273: 2016-03-23T00:00:00.000 | L273: 针织
A274: 2015-11-26T00:00:00.000 | B274: 润鑫 | C274: 王强 | D274: HFC#91434-1 | E274: 21748A0001 | F274: MACYS | G274: 402 | I274: =RC[-2]*RC[-1] -> 0 | J274: 2016-3-7 | K274: 2016-03-23T00:00:00.000 | L274: 针织
A275: 2015-11-26T00:00:00.000 | B275: 润鑫 | C275: 付连 | D275: HFC#91440 | E275: 21748C0001 | F275: MACYS | G275: 4758 | I275: =RC[-2]*RC[-1] -> 0 | J275: 2016-3-7 | K275: 2016-03-23T00:00:00.000 | L275: 针织
A276: 2015-11-26T00:00:00.000 | B276: 润鑫 | C276: 付连 | D276: HFC#91440-1 | E276: 21748C0001 | F276: MACYS | G276: 201 | I276: =RC[-2]*RC[-1] -> 0 | J276: 2016-3-7 | K276: 2016-03-23T00:00:00.000 | L276: 针织
A277: 2016-01-07T00:00:00.000 | B277: 润鑫 | C277: 王晓檬 | D277: HFC#91471 | E277: 92394A0001 | F277: MACYS | G277: 4347 | I277: =RC[-2]*RC[-1] -> 0 | J277: 2016-4-25 | K277: 2016-05-11T00:00:00.000 | L277: 针织
A278: 2016-01-07T00:00:00.000 | B278: 润鑫 | C278: 王晓檬 | D278: HFC#91471-1 | E278: 92394A0001 | F278: MACYS | G278: 600 | I278: =RC[-2]*RC[-1] -> 0 | J278: 2016-4-25 | K278: 2016-05-11T00:00:00.000 | L278: 针织
A279: 2015-12-01T00:00:00.000 | B279: 泰豪 | C279: 孙娟 | D279: 3102 | E279: AHZ4 | F279: WALMART | G279: 1024 | H279: 2.94 | I279: =RC[-2]*RC[-1] -> 3010.56 | J279: 2016-4-4 | K279: 2016-04-22T00:00:00.000 | L279: 针织
A280: 2015-12-01T00:00:00.000 | B280: 泰豪 | C280: 孙娟 | D280: 3103 | E280: AHZ4 | F280: WALMART | G280: 118624 | H280: 2.94 | I280: =RC[-2]*RC[-1] -> 348754.56 | J280: 2016-4-4 | K280: 2016-04-22T00:00:00.000 | L280: 针织
A281: 2016-02-15T00:00:00.000 | B281: 泰豪 | C281: 孙娟 | D281: 4011 | E281: AMW3 | F281: WALMART | G281: 144 | H281: 3.9 | I281: =RC[-2]*RC[-1] -> 561.6 | J281: 2016-5-9 | K281: 2016-05-27T00:00:00.000 | L281: 针织
A282: 2016-02-15T00:00:00.000 | B282: 泰豪 | C282: 孙娟 | D282: 4012 | E282: AMW3 | F282: WALMART | G282: 1104 | H282: 3.9 | I282: =RC[-2]*RC[-1] -> 4305.5999999999995 | J282: 2016-5-9 | K282: 2016-05-27T00:00:00.000 | L282: 针织
A283: 2016-02-15T00:00:00.000 | B283: 泰豪 | C283: 孙娟 | D283: 4013 | E283: AMW3 | F283: WALMART | G283: 91680 | H283: 3.9 | I283: =RC[-2]*RC[-1] -> 357552 | J283: 2016-5-9 | K283: 2016-05-27T00:00:00.000 | L283: 针织
A284: 2016-02-15T00:00:00.000 | B284: 泰豪 | C284: 孙娟 | D284: 4014 | E284: ANU7 | F284: WALMART | G284: 48 | H284: 4 | I284: =RC[-2]*RC[-1] -> 192 | J284: 2016-5-9 | K284: 2016-05-27T00:00:00.000 | L284: 针织
A285: 2016-02-15T00:00:00.000 | B285: 泰豪 | C285: 孙娟 | D285: 4015 | E285: ANU7 | F285: WALMART | G285: 240 | H285: 4 | I285: =RC[-2]*RC[-1] -> 960 | J285: 2016-5-9 | K285: 2016-05-27T00:00:00.000 | L285: 针织
A286: 2016-02-15T00:00:00.000 | B286: 泰豪 | C286: 孙娟 | D286: 4016 | E286: ANU7 | F286: WALMART | G286: 22816 | H286: 4 | I286: =RC[-2]*RC[-1] -> 91264 | J286: 2016-5-9 | K286: 2016-05-27T00:00:00.000 | L286: 针织
A287: 2016-02-26T00:00:00.000 | B287: 泰豪 | C287: 张莉 | D287: 9973 | E287: ALR0 | F287: WALMART | G287: 35720 | H287: 3.3 | I287: =RC[-2]*RC[-1] -> 117876 | J287: 2016-5-16 | K287: 2016-06-08T00:00:00.000 | L287: 针织
A288: 2016-02-26T00:00:00.000 | B288: 泰豪 | C288: 张莉 | D288: 9977 | E288: ALR0 | F288: WALMART | G288: 568 | H288: 3.3 | I288: =RC[-2]*RC[-1] -> 1874.3999999999999 | J288: 2016-5-16 | K288: 2016-06-08T00:00:00.000 | L288: 针织
A289: 2105-11-18T00:00:00.000 | B289: 泰豪 | C289: 武玲玲 | D289: CL153121 | E289: KNT020004 | F289: TARGET | G289: 50639 | H289: 6 | I289: =RC[-2]*RC[-1] -> 303834 | J289: 2016-3-6 | K289: 2016-04-01T00:00:00.000 | L289: 针织
A290: 2015-11-27T00:00:00.000 | B290: 泰豪 | C290: 武玲玲 | D290: 014129 | E290: KNT020004 | F290: TARGET | G290: 244 | I290: =RC[-2]*RC[-1] -> 0 | J290: 2016-3-16 | K290: 2016-04-01T00:00:00.000 | L290: 针织
A291: 2016-02-18T00:00:00.000 | B291: 泰豪 | C291: 武玲玲 | D291: 016738 | E291: JCPT018150 | F291: JCP | G291: 48 | H291: 4.4000000000000004 | I291: =RC[-2]*RC[-1] -> 211.20000000000002 | J291: 2016-4-30 | K291: 2016-05-19T00:00:00.000 | L291: 针织
A292: 2016-02-18T00:00:00.000 | B292: 泰豪 | C292: 武玲玲 | D292: 016740 | E292: JCPT018150 | F292: JCP | G292: 29172 | H292: 4.4000000000000004 | I292: =RC[-2]*RC[-1] -> 128356.80000000002 | J292: 2016-5-22 | K292: 2016-06-08T00:00:00.000 | L292: 针织
A293: 2016-02-18T00:00:00.000 | B293: 泰豪 | C293: 武玲玲 | D293: 016741 | E293: JCPT018150 | F293: JCP | G293: 8169 | H293: 4.4000000000000004 | I293: =RC[-2]*RC[-1] -> 35943.600000000006 | J293: 2016-5-22 | K293: 2016-06-08T00:00:00.000 | L293: 针织
A294: 2016-02-18T00:00:00.000 | B294: 泰豪 | C294: 武玲玲 | D294: 016742 | E294: JCPT018150 | F294: JCP | G294: 6127 | H294: 4.4000000000000004 | I294: =RC[-2]*RC[-1] -> 26958.800000000003 | J294: 2016-5-22 | K294: 2016-06-08T00:00:00.000 | L294: 针织
A295: 2016-02-18T00:00:00.000 | B295: 泰豪 | C295: 武玲玲 | D295: 016743 | E295: JCPT018150 | F295: JCP | G295: 1304 | H295: 4.3 | I295: =RC[-2]*RC[-1] -> 5607.2 | J295: 2016-5-22 | K295: 2016-06-08T00:00:00.000 | L295: 针织
A296: 2016-02-18T00:00:00.000 | B296: 泰豪 | C296: 武玲玲 | D296: 016799 | E296: JCPT018150P | F296: JCP | G296: 847 | I296: =RC[-2]*RC[-1] -> 0 | J296: 2016-5-22 | K296: 2016-06-08T00:00:00.000 | L296: 针织
A297: 2015-11-12T00:00:00.000 | B297: 泰豪 | C297: 王强 | D297: HFC#20082 | E297: 70093A01 | F297: TARGET | G297: 99735 | I297: =RC[-2]*RC[-1] -> 0 | J297: 2016-3-21 | K297: 2016-04-06T00:00:00.000 | L297: 针织
A298: 2015-11-20T00:00:00.000 | B298: 泰豪 | C298: 王强 | D298: HFC#1368 | E298: 79864A01 | F298: WALMART | G298: 624 | H298: 4.0999999999999996 | I298: =RC[-2]*RC[-1] -> 2558.3999999999996 | J298: 2016-2-29 | K298: 2016-03-16T00:00:00.000 | L298: 针织
A299: 2015-11-20T00:00:00.000 | B299: 泰豪 | C299: 王强 | D299: HFC#1369 | E299: 79864A01 | F299: WALMART | G299: 60408 | H299: 4.0999999999999996 | I299: =RC[-2]*RC[-1] -> 247672.8 | J299: 2016-3-21 | K299: 2016-04-06T00:00:00.000 | L299: 针织
A300: 2016-01-08T00:00:00.000 | B300: 泰豪 | C300: 付连 | D300: HFC#1386 | E300: 79629A01 | F300: WALMART | G300: 80 | H300: 3.1 | I300: =RC[-2]*RC[-1] -> 248 | J300: 2016-4-11 | K300: 2016-04-27T00:00:00.000 | L300: 针织
A301: 2016-01-08T00:00:00.000 | B301: 泰豪 | C301: 付连 | D301: HFC#1386 | E301: 79629A02 | F301: WALMART | G301: 104 | H301: 3.1 | I301: =RC[-2]*RC[-1] -> 322.40000000000003 | J301: 2016-4-11 | K301: 2016-04-27T00:00:00.000 | L301: 针织
A302: 2016-01-08T00:00:00.000 | B302: 泰豪 | C302: 付连 | D302: HFC#1386 | E302: 79629A03 | F302: WALMART | G302: 104 | H302: 3.1 | I302: =RC[-2]*RC[-1] -> 322.40000000000003 | J302: 2016-4-11 | K302: 2016-04-27T00:00:00.000 | L302: 针织
A303: 2016-01-08T00:00:00.000 | B303: 泰豪 | C303: 付连 | D303: HFC#1386 | E303: 79629A04 | F303: WALMART | G303: 104 | H303: 3.1 | I303: =RC[-2]*RC[-1] -> 322.40000000000003 | J303: 2016-4-11 | K303: 2016-04-27T00:00:00.000 | L303: 针织
A304: 2016-01-08T00:00:00.000 | B304: 泰豪 | C304: 付连 | D304: HFC#1387 | E304: 79629A01 | F304: WALMART | G304: 9464 | H304: 3.1 | I304: =RC[-2]*RC[-1] -> 29338.400000000001 | J304: 2016-4-18 | K304: 2016-05-04T00:00:00.000 | L304: 针织
A305: 2016-01-08T00:00:00.000 | B305: 泰豪 | C305: 付连 | D305: HFC#1387 | E305: 79629A02 | F305: WALMART | G305: 11184 | H305: 3.1 | I305: =RC[-2]*RC[-1] -> 34670.400000000001 | J305: 2016-4-18 | K305: 2016-05-04T00:00:00.000 | L305: 针织
A306: 2016-01-08T00:00:00.000 | B306: 泰豪 | C306: 付连 | D306: HFC#1387 | E306: 79629A03 | F306: WALMART | G306: 11184 | H306: 3.1 | I306: =RC[-2]*RC[-1] -> 34670.400000000001 | J306: 2016-4-18 | K306: 2016-05-04T00:00:00.000 | L306: 针织
A307: 2016-01-08T00:00:00.000 | B307: 泰豪 | C307: 付连 | D307: HFC#1387 | E307: 79629A04 | F307: WALMART | G307: 11184 | H307: 3.1 | I307: =RC[-2]*RC[-1] -> 34670.400000000001 | J307: 2016-4-18 | K307: 2016-05-04T00:00:00.000 | L307: 针织
A308: 2016-01-29T00:00:00.000 | B308: 泰豪 | C308: 付连 | D308: HFC#70162 | E308: 36023A0001 | F308: JCP | G308: 53262 | H308: 5.6 | I308: =RC[-2]*RC[-1] -> 298267.19999999995 | J308: 2016-05-30T00:00:00.000 | K308: 2016-06-16T00:00:00.000 | L308: 针织
A309: 2016-01-29T00:00:00.000 | B309: 泰豪 | C309: 付连 | D309: HFC#70162-1 | E309: 36023A0001 | F309: JCP | G309: 60 | I309: =RC[-2]*RC[-1] -> 0 | J309: 2016-05-18T00:00:00.000 | K309: 2016-05-25T00:00:00.000 | L309: 针织
A310: 2016-01-29T00:00:00.000 | B310: 泰豪 | C310: 付连 | D310: HFC#70163 | E310: 36023A0001 | F310: JCP | G310: 4142 | H310: 5.6 | I310: =RC[-2]*RC[-1] -> 23195.199999999997 | J310: 2016-05-30T00:00:00.000 | K310: 2016-06-16T00:00:00.000 | L310: 针织
A311: 2016-01-29T00:00:00.000 | B311: 泰豪 | C311: 付连 | D311: HFC#70163-1 | E311: 36023A0001 | F311: JCP | G311: 6704 | H311: 5.6 | I311: =RC[-2]*RC[-1] -> 37542.399999999994 | J311: 2016-05-30T00:00:00.000 | K311: 2016-06-16T00:00:00.000 | L311: 针织
A312: 2016-01-29T00:00:00.000 | B312: 泰豪 | C312: 付连 | D312: HFC#70163-2 | E312: 36023A0001 | F312: JCP | G312: 824 | H312: 5.6 | I312: =RC[-2]*RC[-1] -> 4614.3999999999996 | J312: 2016-05-30T00:00:00.000 | K312: 2016-06-16T00:00:00.000 | L312: 针织
A313: 2016-01-29T00:00:00.000 | B313: 泰豪 | C313: 付连 | D313: HFC#70164 | E313: 36023A0001 | F313: JCP | G313: 456 | H313: 5.6 | I313: =RC[-2]*RC[-1] -> 2553.6 | J313: 2016-05-30T00:00:00.000 | K313: 2016-06-16T00:00:00.000 | L313: 针织
A314: 2016-03-01T00:00:00.000 | B314: 泰豪 | C314: 付连 | D314: HFC#20092 | E314: 70540A01 | F314: TARGET | G314: 17200 | H314: 4.8499999999999996 | I314: =RC[-2]*RC[-1] -> 83420 | J314: 2016-06-06T00:00:00.000 | K314: 2016-06-22T00:00:00.000 | L314: 针织
A315: 2016-03-02T00:00:00.000 | B315: 泰豪 | C315: 王强 | D315: HFC#1402 | E315: 22956B | F315: WALMART | G315: 75600 | H315: 4.05 | I315: =RC[-2]*RC[-1] -> 306180 | J315: 2016-05-23T00:00:00.000 | K315: 2016-06-08T00:00:00.000 | L315: 针织
A316: 2016-03-03T00:00:00.000 | B316: 泰豪 | C316: 付连 | D316: HFC#20099 | E316: 70563A01 | F316: TARGET | G316: 18200 | H316: 4.9800000000000004 | I316: =RC[-2]*RC[-1] -> 90636.000000000015 | J316: 2016-06-27T00:00:00.000 | K316: 2016-07-13T00:00:00.000 | L316: 梭织
A317: 2015-12-25T00:00:00.000 | B317: 泰豪 | C317: 胡金文 | D317: P170346 | E317: NJ26T165M(ZR7770) | F317: WALMART | G317: 192 | H317: 2.95 | I317: =RC[-2]*RC[-1] -> 566.40000000000009 | J317: 2016-4-11 | K317: 2016-05-04T00:00:00.000 | L317: 针织
A318: 2016-01-07T00:00:00.000 | B318: 泰豪 | C318: 胡金文 | D318: P170420 | E318: NJ26T165M(ZR7770) | F318: WALMART | G318: 712 | H318: 2.95 | I318: =RC[-2]*RC[-1] -> 2100.4 | J318: 2016-4-11 | K318: 2016-05-04T00:00:00.000 | L318: 针织
A319: 2016-01-07T00:00:00.000 | B319: 泰豪 | C319: 胡金文 | D319: P170421 | E319: NJ26T165M(ZR7770) | F319: WALMART | G319: 61552 | H319: 2.95 | I319: =RC[-2]*RC[-1] -> 181578.40000000002 | J319: 2016-4-11 | K319: 2016-05-04T00:00:00.000 | L319: 针织
A320: 2016-01-27T00:00:00.000 | B320: 泰豪 | C320: 胡金文 | D320: P170773 | E320: NJ26T165M(ZR7770) | F320: WALMART.COM | G320: 888 | H320: 2.7 | I320: =RC[-2]*RC[-1] -> 2397.6000000000004 | J320: 2016-4-11 | K320: 2016-05-04T00:00:00.000 | L320: 针织
A321: 2016-02-20T00:00:00.000 | B321: 泰豪/铁源 | C321: 付连 | D321: HFC#70175 | E321: 36023C0001 | F321: JCP | G321: 11190 | H321: 6.2 | I321: =RC[-2]*RC[-1] -> 69378 | J321: 2016-06-27T00:00:00.000 | K321: 2016-07-13T00:00:00.000 | L321: 针织
A322: 2016-02-20T00:00:00.000 | B322: 泰豪/铁源 | C322: 付连 | D322: HFC#70175-1 | E322: 36023C0001 | F322: JCP | G322: 18 | H322: 6.2 | I322: =RC[-2]*RC[-1] -> 111.60000000000001 | J322: 2016-06-13T00:00:00.000 | K322: 2016-06-20T00:00:00.000 | L322: 针织
A323: 2016-02-20T00:00:00.000 | B323: 泰豪/铁源 | C323: 付连 | D323: HFC#70176 | E323: 36023C0001 | F323: JCP | G323: 1632 | H323: 6.2 | I323: =RC[-2]*RC[-1] -> 10118.4 | J323: 2016-06-27T00:00:00.000 | K323: 2016-07-13T00:00:00.000 | L323: 针织
A324: 2016-02-26T00:00:00.000 | B324: 泰豪/支云塔 | C324: 张莉 | D324: 9969 | E324: AMD9 | F324: WALMART | G324: 40888 | H324: 4.8499999999999996 | I324: =RC[-2]*RC[-1] -> 198306.8 | J324: 2016-5-16 | K324: 2016-06-08T00:00:00.000 | L324: 针织
A325: 2016-02-26T00:00:00.000 | B325: 泰豪/支云塔 | C325: 张莉 | D325: 9971 | E325: AMD9 | F325: WALMART | G325: 816 | H325: 4.8499999999999996 | I325: =RC[-2]*RC[-1] -> 3957.6 | J325: 2016-5-16 | K325: 2016-06-08T00:00:00.000 | L325: 针织
A326: 2015-11-25T00:00:00.000 | B326: 铁源 | C326: 周婷 | D326: BA231-1 | E326: J7421MMEYZ | F326: TARGET | G326: 28621 | H326: 7 | I326: =RC[-2]*RC[-1] -> 200347 | J326: 2016-3-14 | K326: 2016-04-06T00:00:00.000 | L326: 梭织
A327: 2015-12-17T00:00:00.000 | B327: 铁源 | C327: 周婷 | D327: BA231A-1 | E327: J7421MMEYZ | F327: TARGET.COM | G327: 204 | H327: 6.8 | I327: =RC[-2]*RC[-1] -> 1387.2 | J327: 2016-3-14 | K327: 2016-04-06T00:00:00.000 | L327: 梭织
A328: 2015-12-08T00:00:00.000 | B328: 铁源 | C328: 周婷 | D328: BA231EC-1 | E328: J7421MMEYZ | F328: LOVE ON HANGER | G328: 12 | H328: 6.8 | I328: =RC[-2]*RC[-1] -> 81.599999999999994 | J328: 2016-3-14 | K328: 2016-04-06T00:00:00.000 | L328: 梭织
A329: 2015-12-25T00:00:00.000 | B329: 铁源 | C329: 周婷 | D329: BA231B-1 | E329: J7421MMEYZ | F329: VON MAUR | G329: 204 | H329: 6.8 | I329: =RC[-2]*RC[-1] -> 1387.2 | J329: 2016-3-14 | K329: 2016-04-06T00:00:00.000 | L329: 梭织
A330: 2015-11-25T00:00:00.000 | B330: 铁源 | C330: 吕婵娟 | D330: BA232-1 | E330: J2077MURNZ | F330: TARGET | G330: 14869 | H330: 6.9 | I330: =RC[-2]*RC[-1] -> 102596.1 | J330: 2016-3-14 | K330: 2016-04-06T00:00:00.000 | L330: 梭织
A331: 2015-12-08T00:00:00.000 | B331: 铁源 | C331: 吕婵娟 | D331: BA232EC-1 | E331: J2077MURNZ | F331: LOVE ON HANGER | G331: 6 | H331: 6.7 | I331: =RC[-2]*RC[-1] -> 40.200000000000003 | J331: 2016-3-14 | K331: 2016-04-06T00:00:00.000 | L331: 梭织
A332: 2015-12-14T00:00:00.000 | B332: 铁源 | C332: 吕婵娟 | D332: BA232A-1 | E332: J2077MURNZ | F332: TARGET.COM | G332: 119 | H332: 6.7 | I332: =RC[-2]*RC[-1] -> 797.30000000000007 | J332: 2016-3-14 | K332: 2016-04-06T00:00:00.000 | L332: 梭织
A333: 2015-11-25T00:00:00.000 | B333: 铁源 | C333: 吕婵娟 | D333: BA233-1 | E333: J2077MURNZ | F333: TARGET | G333: 15830 | H333: 6.15 | I333: =RC[-2]*RC[-1] -> 97354.5 | J333: 2016-3-14 | K333: 2016-04-06T00:00:00.000 | L333: 梭织
A334: 2015-12-08T00:00:00.000 | B334: 铁源 | C334: 吕婵娟 | D334: BA233EC-1 | E334: J2077MURNZ | F334: LOVE ON HANGER | G334: 6 | H334: 5.95 | I334: =RC[-2]*RC[-1] -> 35.700000000000003 | J334: 2016-3-14 | K334: 2016-04-06T00:00:00.000 | L334: 梭织
A335: 2015-12-14T00:00:00.000 | B335: 铁源 | C335: 吕婵娟 | D335: BA233A-1 | E335: J2077MURNZ | F335: TARGET.COM | G335: 129 | H335: 5.95 | I335: =RC[-2]*RC[-1] -> 767.55000000000007 | J335: 2016-3-14 | K335: 2016-04-06T00:00:00.000 | L335: 梭织
A336: 2015-11-26T00:00:00.000 | B336: 铁源 | C336: 李绍兰 | D336: BA235-1 | E336: B7435MHUX | F336: MACY.COM | G336: 804 | H336: 5.6 | I336: =RC[-2]*RC[-1] -> 4502.3999999999996 | J336: 2016-3-21 | K336: 2016-04-13T00:00:00.000 | L336: 针织
A337: 2016-01-22T00:00:00.000 | B337: 铁源 | C337: 李绍兰 | D337: BA235ATS-01 | E337: B7435MHUX | F337: CATO | G337: 1404 | H337: 5.6 | I337: =RC[-2]*RC[-1] -> 7862.4 | J337: 2016-3-21 | K337: 2016-04-13T00:00:00.000 | L337: 针织
A338: 2015-12-11T00:00:00.000 | B338: 铁源 | C338: 吕婵娟 | D338: BA240-1 | E338: J3410MA44 | F338: FRED MEYER | G338: 522 | H338: 6 | I338: =RC[-2]*RC[-1] -> 3132 | J338: 2016-3-21 | K338: 2016-04-13T00:00:00.000 | L338: 梭织
A339: 2015-12-11T00:00:00.000 | B339: 铁源 | C339: 吕婵娟 | D339: BA240ATS | E339: J3410MA44 | F339: HOUSE ACCOUNT | G339: 1650 | H339: 6 | I339: =RC[-2]*RC[-1] -> 9900 | J339: 2016-3-21 | K339: 2016-04-13T00:00:00.000 | L339: 梭织
A340: 2015-12-11T00:00:00.000 | B340: 铁源 | C340: 吕婵娟 | D340: BA240ATSBT-01 | E340: J3410MA44 | F340: HOUSE ACCOUNT | G340: 150 | H340: 6 | I340: =RC[-2]*RC[-1] -> 900 | J340: 2016-3-21 | K340: 2016-04-13T00:00:00.000 | L340: 梭织
A341: 2015-12-24T00:00:00.000 | B341: 铁源 | C341: 董灏 | D341: BA267-1 | E341: J2111MB88Z | F341: TARGET | G341: 15432 | H341: 6.7 | I341: =RC[-2]*RC[-1] -> 103394.40000000001 | J341: 2016-4-4 | K341: 2016-04-27T00:00:00.000 | L341: 梭织
A342: 2016-01-14T00:00:00.000 | B342: 铁源 | C342: 董灏 | D342: BA267A-1 | E342: J2111MB88Z | F342: TARGET.COM | G342: 102 | H342: 6.5 | I342: =RC[-2]*RC[-1] -> 663 | J342: 2016-4-4 | K342: 2016-04-27T00:00:00.000 | L342: 梭织
A343: 2016-02-01T00:00:00.000 | B343: 铁源 | C343: 董灏 | D343: BA267B-1 | E343: J2111MB88Z | F343: FRED MEYER | G343: 354 | H343: 6.7 | I343: =RC[-2]*RC[-1] -> 2371.8000000000002 | J343: 2016-4-4 | K343: 2016-04-27T00:00:00.000 | L343: 梭织
A344: 2015-12-31T00:00:00.000 | B344: 铁源 | C344: 董灏 | D344: BA267EC-1 | E344: J2111MB88Z | G344: 6 | H344: 6.5 | I344: =RC[-2]*RC[-1] -> 39 | J344: 2016-4-4 | K344: 2016-04-27T00:00:00.000 | L344: 梭织
A345: 2015-12-24T00:00:00.000 | B345: 铁源 | C345: 董灏 | D345: BA268-1 | E345: J2111MZ75Z | F345: TARGET | G345: 14397 | H345: 7.6 | I345: =RC[-2]*RC[-1] -> 109417.2 | J345: 2016-4-4 | K345: 2016-04-27T00:00:00.000 | L345: 梭织
A346: 2016-01-18T00:00:00.000 | B346: 铁源 | C346: 董灏 | D346: BA268EC-1 | E346: J2111MZ75Z | G346: 6 | H346: 7.4 | I346: =RC[-2]*RC[-1] -> 44.400000000000006 | J346: 2016-4-4 | K346: 2016-04-27T00:00:00.000 | L346: 梭织
A347: 2016-01-14T00:00:00.000 | B347: 铁源 | C347: 董灏 | D347: BA268A-1 | E347: J2111MZ75Z | F347: TARGET.COM | G347: 94 | H347: 7.4 | I347: =RC[-2]*RC[-1] -> 695.6 | J347: 2016-4-4 | K347: 2016-04-27T00:00:00.000 | L347: 梭织
A348: 2016-02-01T00:00:00.000 | B348: 铁源 | C348: 董灏 | D348: BA268B-1 | E348: J2111MZ75Z | F348: FRED MEYER | G348: 354 | H348: 7.6 | I348: =RC[-2]*RC[-1] -> 2690.4 | J348: 2016-4-4 | K348: 2016-04-27T00:00:00.000 | L348: 梭织
A349: 2015-12-29T00:00:00.000 | B349: 铁源 | C349: 董灏 | D349: BA271-1 | E349: J7569MMEYG | G349: 1712 | H349: 6.75 | I349: =RC[-2]*RC[-1] -> 11556 | J349: 2016-5-16 | K349: 2016-06-08T00:00:00.000 | L349: 梭织
A350: 2015-12-29T00:00:00.000 | B350: 铁源 | C350: 董灏 | D350: BA271-2 | E350: J7569MMEYG | G350: 864 | H350: 6.75 | I350: =RC[-2]*RC[-1] -> 5832 | J350: 2016-5-16 | K350: 2016-06-08T00:00:00.000 | L350: 梭织
A351: 2015-12-29T00:00:00.000 | B351: 铁源 | C351: 董灏 | D351: BA271-3 | E351: J7569MMEYG | G351: 336 | H351: 6.75 | I351: =RC[-2]*RC[-1] -> 2268 | J351: 2016-5-16 | K351: 2016-06-08T00:00:00.000 | L351: 梭织
A352: 2015-12-29T00:00:00.000 | B352: 铁源 | C352: 董灏 | D352: BA271A-1 | E352: J7569MMEYG | G352: 48 | H352: 6.55 | I352: =RC[-2]*RC[-1] -> 314.39999999999998 | J352: 2016-5-16 | K352: 2016-06-08T00:00:00.000 | L352: 梭织
A353: 2015-12-29T00:00:00.000 | B353: 铁源 | C353: 董灏 | D353: BA272-1 | E353: B7569MMEYG | G353: 1392 | H353: 7.3 | I353: =RC[-2]*RC[-1] -> 10161.6 | J353: 2016-5-16 | K353: 2016-06-08T00:00:00.000 | L353: 梭织
A354: 2015-12-29T00:00:00.000 | B354: 铁源 | C354: 董灏 | D354: BA272-2 | E354: B7569MMEYG | G354: 112 | H354: 7.3 | I354: =RC[-2]*RC[-1] -> 817.6 | J354: 2016-5-16 | K354: 2016-06-08T00:00:00.000 | L354: 梭织
A355: 2015-12-29T00:00:00.000 | B355: 铁源 | C355: 董灏 | D355: BA272-3 | E355: B7569MMEYG | G355: 16 | H355: 7.3 | I355: =RC[-2]*RC[-1] -> 116.8 | J355: 2016-5-16 | K355: 2016-06-08T00:00:00.000 | L355: 梭织
A356: 2015-12-29T00:00:00.000 | B356: 铁源 | C356: 董灏 | D356: BA272A-1 | E356: B7569MMEYG | G356: 56 | H356: 7.1 | I356: =RC[-2]*RC[-1] -> 397.59999999999997 | J356: 2016-5-16 | K356: 2016-06-08T00:00:00.000 | L356: 梭织
A357: 2016-02-01T00:00:00.000 | B357: 铁源 | C357: 谭春艳 | D357: BA285-1 | E357: B8042MMEYP | F357: TORRID | G357: 1392 | H357: 5.45 | I357: =RC[-2]*RC[-1] -> 7586.4000000000005 | J357: 2016-4-25 | K357: 2016-05-19T00:00:00.000 | L357: 梭织
A358: 2016-02-01T00:00:00.000 | B358: 铁源 | C358: 谭春艳 | D358: BA285-4 | E358: B8042MMEYP | F358: TORRID | G358: 1491 | H358: 5.45 | I358: =RC[-2]*RC[-1] -> 8125.95 | J358: 2016-4-25 | K358: 2016-05-19T00:00:00.000 | L358: 梭织
A359: 2016-02-01T00:00:00.000 | B359: 铁源 | C359: 谭春艳 | D359: BA285A-1 | E359: B8042MMEYP | F359: TORRID | G359: 1832 | H359: 5.45 | I359: =RC[-2]*RC[-1] -> 9984.4 | J359: 2016-4-25 | K359: 2016-05-19T00:00:00.000 | L359: 梭织
A360: 2016-02-01T00:00:00.000 | B360: 铁源 | C360: 谭春艳 | D360: BA285A-3 | E360: B8042MMEYP | F360: TORRID | G360: 1615 | H360: 5.45 | I360: =RC[-2]*RC[-1] -> 8801.75 | J360: 2016-4-25 | K360: 2016-05-19T00:00:00.000 | L360: 梭织
A361: 2016-02-01T00:00:00.000 | B361: 铁源 | C361: 谭春艳 | D361: BA285B-1 | E361: B8042MMEYP | F361: TORRID | G361: 762 | H361: 5.45 | I361: =RC[-2]*RC[-1] -> 4152.9000000000005 | J361: 2016-4-25 | K361: 2016-05-19T00:00:00.000 | L361: 梭织
A362: 2016-02-01T00:00:00.000 | B362: 铁源 | C362: 谭春艳 | D362: BA285C-1 | E362: B8042MMEYP | F362: TORRID | G362: 158 | H362: 5.45 | I362: =RC[-2]*RC[-1] -> 861.1 | J362: 2016-4-25 | K362: 2016-05-19T00:00:00.000 | L362: 梭织
A363: 2016-02-15T00:00:00.000 | B363: 铁源 | C363: 谭春艳 | D363: BA285ATS | E363: B8042MMEYP | F363: HOUSE ACCOUNT | G363: 2394 | H363: 5.65 | I363: =RC[-2]*RC[-1] -> 13526.1 | J363: 2016-4-25 | K363: 2016-05-19T00:00:00.000 | L363: 梭织
A364: 2016-02-15T00:00:00.000 | B364: 铁源 | C364: 谭春艳 | D364: BA285ATSEC-01 | E364: B8042MMEYP | G364: 6 | H364: 5.45 | I364: =RC[-2]*RC[-1] -> 32.700000000000003 | J364: 2016-4-25 | K364: 2016-05-19T00:00:00.000 | L364: 梭织
A365: 2016-02-02T00:00:00.000 | B365: 铁源 | C365: 董灏 | D365: BA286-1 | E365: J8113MMEYC | F365: CATO | G365: 5184 | H365: 7.1 | I365: =RC[-2]*RC[-1] -> 36806.400000000001 | J365: 2016-5-2 | K365: 2016-05-25T00:00:00.000 | L365: 梭织
A366: 2016-02-02T00:00:00.000 | B366: 铁源 | C366: 董灏 | D366: BA286-2 | E366: J8113MMEYC | F366: CATO | G366: 6342 | H366: 7.1 | I366: =RC[-2]*RC[-1] -> 45028.2 | J366: 2016-5-2 | K366: 2016-05-25T00:00:00.000 | L366: 梭织
A367: 2016-02-02T00:00:00.000 | B367: 铁源 | C367: 董灏 | D367: BA286-3 | E367: J8113MMEYC | F367: CATO | G367: 120 | H367: 7.1 | I367: =RC[-2]*RC[-1] -> 852 | J367: 2016-5-2 | K367: 2016-05-25T00:00:00.000 | L367: 梭织
A368: 2016-02-02T00:00:00.000 | B368: 铁源 | C368: 董灏 | D368: BA287-1 | E368: B8113MMEYC | F368: CATO | G368: 5490 | H368: 8.5500000000000007 | I368: =RC[-2]*RC[-1] -> 46939.500000000007 | J368: 2016-5-2 | K368: 2016-05-25T00:00:00.000 | L368: 梭织
A369: 2016-02-02T00:00:00.000 | B369: 铁源 | C369: 董灏 | D369: BA287-2 | E369: B8113MMEYC | F369: CATO | G369: 948 | H369: 8.5500000000000007 | I369: =RC[-2]*RC[-1] -> 8105.4000000000005 | J369: 2016-5-2 | K369: 2016-05-25T00:00:00.000 | L369: 梭织
A370: 2016-02-02T00:00:00.000 | B370: 铁源 | C370: 董灏 | D370: BA287-3 | E370: B8113MMEYC | F370: CATO | G370: 540 | H370: 8.5500000000000007 | I370: =RC[-2]*RC[-1] -> 4617 | J370: 2016-5-2 | K370: 2016-05-25T00:00:00.000 | L370: 梭织
A371: 2015-12-28T00:00:00.000 | B371: 铁源 | C371: 张莉 | D371: 106038 | E371: JA83801LGG | F371: Kohls Store. | G371: 11120 | H371: 7.5 | I371: =RC[-2]*RC[-1] -> 83400 | J371: 2016-4-11 | K371: 2016-04-27T00:00:00.000 | L371: 梭织
A372: 2015-10-21T00:00:00.000 | B372: 同飞 | C372: 唐琼茜 | D372: BA176-1 | E372: J7913MVZYG | F372: RED CAMEL | G372: 2784 | H372: 5.85 | I372: =RC[-2]*RC[-1] -> 16286.4 | J372: 2016-3-14 | K372: 2016-04-08T00:00:00.000 | L372: 针织
A373: 2015-11-18T00:00:00.000 | B373: 同飞 | C373: 唐琼茜 | D373: BA176-3 | E373: J7913MVZYG | F373: RED CAMEL | G373: 368 | H373: 5.85 | I373: =RC[-2]*RC[-1] -> 2152.7999999999997 | J373: 2016-3-14 | K373: 2016-04-08T00:00:00.000 | L373: 针织
A374: 2015-11-18T00:00:00.000 | B374: 同飞 | C374: 唐琼茜 | D374: BA176-4 | E374: J7913MVZYG | F374: RED CAMEL | G374: 632 | H374: 5.85 | I374: =RC[-2]*RC[-1] -> 3697.2 | J374: 2016-3-14 | K374: 2016-04-08T00:00:00.000 | L374: 针织
A375: 2015-11-18T00:00:00.000 | B375: 同飞 | C375: 唐琼茜 | D375: BA176A-1 | E375: J7913MVZYG | F375: RED CAMEL | G375: 40 | H375: 5.65 | I375: =RC[-2]*RC[-1] -> 226 | J375: 2016-3-14 | K375: 2016-04-08T00:00:00.000 | L375: 针织
A376: 2015-10-26T00:00:00.000 | B376: 同飞 | C376: 唐琼茜 | D376: BA176EC-1 | E376: J7913MVZYG | F376: LOVE ON HANGER | G376: 6 | H376: 5.65 | I376: =RC[-2]*RC[-1] -> 33.900000000000006 | J376: 2016-3-14 | K376: 2016-04-08T00:00:00.000 | L376: 针织
A377: 2015-10-21T00:00:00.000 | B377: 同飞 | C377: 唐琼茜 | D377: BA178-1 | E377: J7913MZGUG | F377: RED CAMEL | G377: 1056 | H377: 6.85 | I377: =RC[-2]*RC[-1] -> 7233.5999999999995 | J377: 2016-2-29 | K377: 2016-03-22T00:00:00.000 | L377: 针织
A378: 2015-11-18T00:00:00.000 | B378: 同飞 | C378: 唐琼茜 | D378: BA178-2 | E378: J7913MZGUG | F378: RED CAMEL | G378: 368 | H378: 6.85 | I378: =RC[-2]*RC[-1] -> 2520.7999999999997 | J378: 2016-2-29 | K378: 2016-03-22T00:00:00.000 | L378: 针织
A379: 2015-11-18T00:00:00.000 | B379: 同飞 | C379: 唐琼茜 | D379: BA178-3 | E379: J7913MZGUG | F379: RED CAMEL | G379: 1424 | H379: 6.85 | I379: =RC[-2]*RC[-1] -> 9754.4 | J379: 2016-2-29 | K379: 2016-03-22T00:00:00.000 | L379: 针织
A380: 2015-11-18T00:00:00.000 | B380: 同飞 | C380: 唐琼茜 | D380: BA178A-1 | E380: J7913MZGUG | F380: RED CAMEL | G380: 40 | H380: 6.65 | I380: =RC[-2]*RC[-1] -> 266 | J380: 2016-2-29 | K380: 2016-03-22T00:00:00.000 | L380: 针织
A381: 2015-11-12T00:00:00.000 | B381: 同飞 | C381: 李绍兰 | D381: BA221-1 | E381: J1976MSJVC | F381: CATO | G381: 1715 | H381: 6.3 | I381: =RC[-2]*RC[-1] -> 10804.5 | J381: 2016-3-7 | K381: 2016-03-30T00:00:00.000 | L381: 梭织
A382: 2015-11-18T00:00:00.000 | B382: 同飞 | C382: 李绍兰 | D382: BA221-2 | E382: J1976MSJVC | F382: CATO | G382: 735 | H382: 6.3 | I382: =RC[-2]*RC[-1] -> 4630.5 | J382: 2016-3-7 | K382: 2016-03-30T00:00:00.000 | L382: 梭织
A383: 2015-11-12T00:00:00.000 | B383: 同飞 | C383: 李绍兰 | D383: BA222-1 | E383: B1976MSJVC | F383: CATO | G383: 2862 | H383: 7.3 | I383: =RC[-2]*RC[-1] -> 20892.599999999999 | J383: 2016-3-7 | K383: 2016-03-30T00:00:00.000 | L383: 梭织
A384: 2015-12-02T00:00:00.000 | B384: 同飞 | C384: 李绍兰 | D384: BA222-2 | E384: B1976MSJVC | F384: CATO | G384: 714 | H384: 7.3 | I384: =RC[-2]*RC[-1] -> 5212.2 | J384: 2016-3-7 | K384: 2016-03-30T00:00:00.000 | L384: 梭织
A385: 2015-12-02T00:00:00.000 | B385: 同飞 | C385: 李绍兰 | D385: BA222-3 | E385: B1976MSJVC | F385: CATO | G385: 72 | H385: 7.3 | I385: =RC[-2]*RC[-1] -> 525.6 | J385: 2016-3-7 | K385: 2016-03-30T00:00:00.000 | L385: 梭织
A386: 2015-11-24T00:00:00.000 | B386: 同飞 | C386: 李绍兰 | D386: BA229-1 | E386: J8072MQFR | F386: BURLINGTON | G386: 1800 | H386: 4.4000000000000004 | I386: =RC[-2]*RC[-1] -> 7920.0000000000009 | J386: 2016-3-21 | K386: 2016-04-12T00:00:00.000 | L386: 针织
A387: 2015-11-24T00:00:00.000 | B387: 同飞 | C387: 李绍兰 | D387: BA229A-1 | E387: J8072MQFR | F387: BURLINGTON | G387: 1800 | H387: 4.4000000000000004 | I387: =RC[-2]*RC[-1] -> 7920.0000000000009 | J387: 2016-3-21 | K387: 2016-04-12T00:00:00.000 | L387: 针织
A388: 2015-12-17T00:00:00.000 | B388: 同飞 | C388: 董灏 | D388: BA247-1 | E388: B5651MWQUC | F388: CATO | G388: 120 | H388: 5.45 | I388: =RC[-2]*RC[-1] -> 654 | J388: 2016-3-21 | K388: 2016-04-13T00:00:00.000 | L388: 针织
A389: 2015-12-17T00:00:00.000 | B389: 同飞 | C389: 董灏 | D389: BA247-2 | E389: B5651MWQUC | F389: CATO | G389: 4680 | H389: 5.45 | I389: =RC[-2]*RC[-1] -> 25506 | J389: 2016-3-21 | K389: 2016-04-13T00:00:00.000 | L389: 针织
A390: 2015-12-17T00:00:00.000 | B390: 同飞 | C390: 董灏 | D390: BA247-3 | E390: B5651MWQUC | F390: CATO | G390: 2010 | H390: 5.45 | I390: =RC[-2]*RC[-1] -> 10954.5 | J390: 2016-3-21 | K390: 2016-04-13T00:00:00.000 | L390: 针织
A391: 2015-12-18T00:00:00.000 | B391: 同飞 | C391: 李绍兰 | D391: BA248-1 | E391: J9651MFKJC | F391: CATO | G391: 1813 | H391: 5.7 | I391: =RC[-2]*RC[-1] -> 10334.1 | J391: 2016-3-28 | K391: 2016-04-20T00:00:00.000 | L391: 针织
A392: 2015-12-18T00:00:00.000 | B392: 同飞 | C392: 李绍兰 | D392: BA248-2 | E392: J9651MFKJC | F392: CATO | G392: 1206 | H392: 5.7 | I392: =RC[-2]*RC[-1] -> 6874.2 | J392: 2016-3-28 | K392: 2016-04-20T00:00:00.000 | L392: 针织
A393: 2015-12-18T00:00:00.000 | B393: 同飞 | C393: 李绍兰 | D393: BA249-1 | E393: B9651MFKJC | F393: CATO | G393: 942 | H393: 6.5 | I393: =RC[-2]*RC[-1] -> 6123 | J393: 2016-3-28 | K393: 2016-04-20T00:00:00.000 | L393: 针织
A394: 2015-12-18T00:00:00.000 | B394: 同飞 | C394: 李绍兰 | D394: BA249-2 | E394: B9651MFKJC | F394: CATO | G394: 408 | H394: 6.5 | I394: =RC[-2]*RC[-1] -> 2652 | J394: 2016-3-28 | K394: 2016-04-20T00:00:00.000 | L394: 针织
A395: 2015-12-22T00:00:00.000 | B395: 同飞 | C395: 李绍兰 | D395: BA254-1 | E395: J9657MPZLP | F395: FRANCESCA'S | G395: 2652 | H395: 5.25 | I395: =RC[-2]*RC[-1] -> 13923 | J395: 2016-4-18 | K395: 2016-05-04T00:00:00.000 | L395: 针织
A396: 2016-01-18T00:00:00.000 | B396: 同飞 | C396: 李绍兰 | D396: BA254EC-1 | E396: J9657MPZLP | G396: 6 | H396: 5.25 | I396: =RC[-2]*RC[-1] -> 31.5 | J396: 2016-4-18 | K396: 2016-05-04T00:00:00.000 | L396: 针织
A397: 2015-12-22T00:00:00.000 | B397: 同飞 | C397: 李绍兰 | D397: BA255-1 | E397: J9675MQFRP | F397: FRANCESCA'S | G397: 2652 | H397: 6 | I397: =RC[-2]*RC[-1] -> 15912 | J397: 2016-4-18 | K397: 2016-05-04T00:00:00.000 | L397: 针织
A398: 2015-12-23T00:00:00.000 | B398: 同飞 | C398: 李绍兰 | D398: BA250-1 | E398: J9639CARTC | F398: CATO | G398: 1813 | H398: 4.6500000000000004 | I398: =RC[-2]*RC[-1] -> 8430.4500000000007 | J398: 2016-3-28 | K398: 2016-04-20T00:00:00.000 | L398: 针织
A399: 2015-12-23T00:00:00.000 | B399: 同飞 | C399: 李绍兰 | D399: BA250-2 | E399: J9639CARTC | F399: CATO | G399: 1206 | H399: 4.6500000000000004 | I399: =RC[-2]*RC[-1] -> 5607.9000000000005 | J399: 2016-3-28 | K399: 2016-04-20T00:00:00.000 | L399: 针织
A400: 2015-12-23T00:00:00.000 | B400: 同飞 | C400: 李绍兰 | D400: BA250A-1 | E400: J9639CARTC | F400: CATO | G400: 120 | H400: 4.6500000000000004 | I400: =RC[-2]*RC[-1] -> 558 | J400: 2016-3-28 | K400: 2016-04-20T00:00:00.000 | L400: 针织
A401: 2015-12-24T00:00:00.000 | B401: 同飞 | C401: 李绍兰 | D401: BA251-1 | E401: B9639CARTC | F401: CATO | G401: 120 | H401: 5.75 | I401: =RC[-2]*RC[-1] -> 690 | J401: 2016-3-28 | K401: 2016-04-20T00:00:00.000 | L401: 针织
A402: 2015-12-24T00:00:00.000 | B402: 同飞 | C402: 李绍兰 | D402: BA251-2 | E402: B9639CARTC | F402: CATO | G402: 1638 | H402: 5.75 | I402: =RC[-2]*RC[-1] -> 9418.5 | J402: 2016-3-28 | K402: 2016-04-20T00:00:00.000 | L402: 针织
A403: 2015-12-24T00:00:00.000 | B403: 同飞 | C403: 李绍兰 | D403: BA251-3 | E403: B9639CARTC | F403: CATO | G403: 702 | H403: 5.75 | I403: =RC[-2]*RC[-1] -> 4036.5 | J403: 2016-3-28 | K403: 2016-04-20T00:00:00.000 | L403: 针织
A404: 2015-12-29T00:00:00.000 | B404: 同飞 | C404: 李绍兰 | D404: BA269-1 | E404: J2128CBAEG | F404: RED CAMEL | G404: 496 | H404: 7.1 | I404: =RC[-2]*RC[-1] -> 3521.6 | J404: 2016-5-16 | K404: 2016-06-08T00:00:00.000 | L404: 针织
A405: 2015-12-29T00:00:00.000 | B405: 同飞 | C405: 李绍兰 | D405: BA269-2 | E405: J2128CBAEG | F405: RED CAMEL | G405: 648 | H405: 7.1 | I405: =RC[-2]*RC[-1] -> 4600.8 | J405: 2016-5-16 | K405: 2016-06-08T00:00:00.000 | L405: 针织
A406: 2015-12-29T00:00:00.000 | B406: 同飞 | C406: 李绍兰 | D406: BA269-3 | E406: J2128CBAEG | F406: RED CAMEL | G406: 1768 | H406: 7.1 | I406: =RC[-2]*RC[-1] -> 12552.8 | J406: 2016-5-16 | K406: 2016-06-08T00:00:00.000 | L406: 针织
A407: 2015-12-29T00:00:00.000 | B407: 同飞 | C407: 李绍兰 | D407: BA269A-1 | E407: J2128CBAEG | F407: RED CAMEL | G407: 48 | H407: 6.9 | I407: =RC[-2]*RC[-1] -> 331.20000000000005 | J407: 2016-5-16 | K407: 2016-06-08T00:00:00.000 | L407: 针织
A408: 2016-01-06T00:00:00.000 | B408: 同飞 | C408: 李绍兰 | D408: BA274-1 | E408: B2128CBAEG | G408: 624 | H408: 8.1 | I408: =RC[-2]*RC[-1] -> 5054.3999999999996 | J408: 2016-5-16 | K408: 2016-06-08T00:00:00.000 | L408: 针织
A409: 2016-01-06T00:00:00.000 | B409: 同飞 | C409: 李绍兰 | D409: BA274-2 | E409: B2128CBAEG | G409: 72 | H409: 8.1 | I409: =RC[-2]*RC[-1] -> 583.19999999999993 | J409: 2016-5-16 | K409: 2016-06-08T00:00:00.000 | L409: 针织
A410: 2016-01-06T00:00:00.000 | B410: 同飞 | C410: 李绍兰 | D410: BA274A-1 | E410: B2128CBAEG | G410: 56 | H410: 7.9 | I410: =RC[-2]*RC[-1] -> 442.40000000000003 | J410: 2016-5-16 | K410: 2016-06-08T00:00:00.000 | L410: 针织
A411: 2016-01-06T00:00:00.000 | B411: 同飞 | C411: 吕婵娟 | D411: BA275-1 | E411: B8126MUSDG | G411: 1400 | H411: 7 | I411: =RC[-2]*RC[-1] -> 9800 | J411: 2016-4-18 | K411: 2016-05-11T00:00:00.000 | L411: 针织
A412: 2016-01-06T00:00:00.000 | B412: 同飞 | C412: 吕婵娟 | D412: BA275-2 | E412: B8126MUSDG | G412: 16 | H412: 7 | I412: =RC[-2]*RC[-1] -> 112 | J412: 2016-4-18 | K412: 2016-05-11T00:00:00.000 | L412: 针织
A413: 2016-01-06T00:00:00.000 | B413: 同飞 | C413: 吕婵娟 | D413: BA275A-1 | E413: B8126MUSDG | G413: 48 | H413: 6.8 | I413: =RC[-2]*RC[-1] -> 326.39999999999998 | J413: 2016-4-18 | K413: 2016-05-11T00:00:00.000 | L413: 针织
A414: 2016-01-06T00:00:00.000 | B414: 同飞 | C414: 李绍兰 | D414: BA278-1 | E414: J5903CBBIG | F414: RED CAMEL | G414: 280 | H414: 7 | I414: =RC[-2]*RC[-1] -> 1960 | J414: 2016-5-16 | K414: 2016-06-08T00:00:00.000 | L414: 针织
A415: 2016-01-06T00:00:00.000 | B415: 同飞 | C415: 李绍兰 | D415: BA278-2 | E415: J5903CBBIG | F415: RED CAMEL | G415: 352 | H415: 7 | I415: =RC[-2]*RC[-1] -> 2464 | J415: 2016-5-16 | K415: 2016-06-08T00:00:00.000 | L415: 针织
A416: 2016-01-06T00:00:00.000 | B416: 同飞 | C416: 李绍兰 | D416: BA278-3 | E416: J5903CBBIG | F416: RED CAMEL | G416: 920 | H416: 7 | I416: =RC[-2]*RC[-1] -> 6440 | J416: 2016-5-16 | K416: 2016-06-08T00:00:00.000 | L416: 针织
A417: 2016-01-06T00:00:00.000 | B417: 同飞 | C417: 李绍兰 | D417: BA278A-1 | E417: J5903CBBIG | F417: RED CAMEL | G417: 36 | H417: 6.8 | I417: =RC[-2]*RC[-1] -> 244.79999999999998 | J417: 2016-5-16 | K417: 2016-06-08T00:00:00.000 | L417: 针织
A418: 2016-01-06T00:00:00.000 | B418: 同飞 | C418: 李绍兰 | D418: BA279-1 | E418: B5903CBBIG | G418: 1392 | H418: 9 | I418: =RC[-2]*RC[-1] -> 12528 | J418: 2016-5-16 | K418: 2016-06-08T00:00:00.000 | L418: 针织
A419: 2016-01-06T00:00:00.000 | B419: 同飞 | C419: 李绍兰 | D419: BA279-2 | E419: B5903CBBIG | G419: 72 | H419: 9 | I419: =RC[-2]*RC[-1] -> 648 | J419: 2016-5-16 | K419: 2016-06-08T00:00:00.000 | L419: 针织
A420: 2016-01-06T00:00:00.000 | B420: 同飞 | C420: 李绍兰 | D420: BA279A-1 | E420: B5903CBBIG | G420: 56 | H420: 8.8000000000000007 | I420: =RC[-2]*RC[-1] -> 492.80000000000007 | J420: 2016-5-16 | K420: 2016-06-08T00:00:00.000 | L420: 针织
A421: 2016-01-19T00:00:00.000 | B421: 同飞 | C421: 吕婵娟 | D421: BA283-1 | E421: B8126CAIUG | G421: 880 | H421: 6.85 | I421: =RC[-2]*RC[-1] -> 6028 | J421: 2016-4-25 | K421: 2016-05-11T00:00:00.000 | L421: 针织
A422: 2016-01-19T00:00:00.000 | B422: 同飞 | C422: 吕婵娟 | D422: BA283-2 | E422: B8126CAIUG | G422: 16 | H422: 6.85 | I422: =RC[-2]*RC[-1] -> 109.6 | J422: 2016-4-25 | K422: 2016-05-11T00:00:00.000 | L422: 针织
A423: 2016-01-19T00:00:00.000 | B423: 同飞 | C423: 吕婵娟 | D423: BA283A-1 | E423: B8126CAIUG | G423: 48 | H423: 6.65 | I423: =RC[-2]*RC[-1] -> 319.20000000000005 | J423: 2016-4-25 | K423: 2016-05-11T00:00:00.000 | L423: 针织
A424: 2016-02-16T00:00:00.000 | B424: 同飞 | C424: 谭春艳 | D424: BA291ATS | E424: J5982CAVP | F424: HOUSE ACCOUNT | G424: 2664 | H424: 4.2 | I424: =RC[-2]*RC[-1] -> 11188.800000000001 | J424: 2016-5-9 | K424: 2016-06-01T00:00:00.000 | L424: 针织
A425: 2016-02-16T00:00:00.000 | B425: 同飞 | C425: 谭春艳 | D425: BA291ATS-02 | E425: J5982CAVP | F425: STAGE | G425: 2400 | H425: 4.2 | I425: =RC[-2]*RC[-1] -> 10080 | J425: 2016-5-9 | K425: 2016-06-01T00:00:00.000 | L425: 针织
A426: 2016-02-16T00:00:00.000 | B426: 同飞 | C426: 谭春艳 | D426: BA291ATSBT-01 | E426: J5982CAVP | G426: 96 | H426: 4 | I426: =RC[-2]*RC[-1] -> 384 | J426: 2016-5-9 | K426: 2016-06-01T00:00:00.000 | L426: 针织
A427: 2016-02-16T00:00:00.000 | B427: 同飞 | C427: 谭春艳 | D427: BA291ATS-01 | E427: J5982CAVP | F427: VON MAUR | G427: 240 | H427: 4.2 | I427: =RC[-2]*RC[-1] -> 1008 | J427: 2016-5-9 | K427: 2016-06-01T00:00:00.000 | L427: 针织
A428: 2016-02-16T00:00:00.000 | B428: 同飞 | C428: 谭春艳 | D428: BA292ATS | E428: J5982MPZL | F428: HOUSE ACCOUNT | G428: 1752 | H428: 4.2 | I428: =RC[-2]*RC[-1] -> 7358.4000000000005 | J428: 2016-5-9 | K428: 2016-06-01T00:00:00.000 | L428: 针织
A429: 2016-02-16T00:00:00.000 | B429: 同飞 | C429: 谭春艳 | D429: BA292ATSBT-01 | E429: J5982MPZL | G429: 48 | H429: 4 | I429: =RC[-2]*RC[-1] -> 192 | J429: 2016-5-9 | K429: 2016-06-01T00:00:00.000 | L429: 针织
A430: 2016-01-21T00:00:00.000 | B430: 同飞 | C430: 王晓檬 | D430: HFC#8625 | E430: 79482A01 | F430: AMERICAN RAG | G430: 8017 | I430: =RC[-2]*RC[-1] -> 0 | J430: 2016-05-02T00:00:00.000 | K430: 2016-05-18T00:00:00.000 | L430: 针织
A431: 2016-01-21T00:00:00.000 | B431: 同飞 | C431: 王晓檬 | D431: HFC#8625-1 | E431: 79482A01 | F431: AMERICAN RAG | G431: 421 | I431: =RC[-2]*RC[-1] -> 0 | J431: 2016-05-02T00:00:00.000 | K431: 2016-05-18T00:00:00.000 | L431: 针织
A432: 2016-01-21T00:00:00.000 | B432: 同飞 | C432: 王晓檬 | D432: HFC#8625-2 | E432: 79482A01 | F432: AMERICAN RAG | G432: 10 | I432: =RC[-2]*RC[-1] -> 0 | J432: 2016-05-02T00:00:00.000 | K432: 2016-05-10T00:00:00.000 | L432: 针织
A433: 2016-02-02T00:00:00.000 | B433: 同飞 | C433: 付连 | D433: HFC#91489 | E433: 92649A0001 | F433: ALFANI | G433: 3756 | I433: =RC[-2]*RC[-1] -> 0 | J433: 2016-05-16T00:00:00.000 | K433: 2016-06-08T00:00:00.000 | L433: 针织
A434: 2016-02-02T00:00:00.000 | B434: 同飞 | C434: 付连 | D434: HFC#91489-1 | E434: 92649A0001 | F434: ALFANI | G434: 351 | I434: =RC[-2]*RC[-1] -> 0 | J434: 2016-05-16T00:00:00.000 | K434: 2016-06-08T00:00:00.000 | L434: 针织
A435: 2016-01-08T00:00:00.000 | B435: 同飞 | C435: 付连 | D435: P170446 | E435: ZQ6161 | F435: BURLINGTON | G435: 1800 | H435: 3.6 | I435: =RC[-2]*RC[-1] -> 6480 | J435: 2016-3-20 | K435: 2016-04-13T00:00:00.000 | L435: 针织
A436: 2016-01-14T00:00:00.000 | B436: 同飞 | C436: 胡金文 | D436: P170546 | E436: ZT4977-7980(ZT4976-7283) | F436: STOCK | G436: 4800 | H436: 4 | I436: =RC[-2]*RC[-1] -> 19200 | J436: 2016-4-18 | K436: 2016-05-11T00:00:00.000 | L436: 针织
A437: 2016-01-21T00:00:00.000 | B437: 同飞 | C437: 胡金文 | D437: P170713 | E437: ZT4977-7980-RBW | F437: RAINBOW | G437: 3600 | H437: 4 | I437: =RC[-2]*RC[-1] -> 14400 | J437: 2016-4-18 | K437: 2016-05-11T00:00:00.000 | L437: 针织
A438: 2016-01-19T00:00:00.000 | B438: 同飞 | C438: 胡金文 | D438: P170570 | E438: XV1060-6973 | F438: STOCK | G438: 4800 | H438: 4.6500000000000004 | I438: =RC[-2]*RC[-1] -> 22320 | J438: 2016-4-18 | K438: 2016-05-11T00:00:00.000 | L438: 针织
A439: 2016-01-19T00:00:00.000 | B439: 同飞 | C439: 胡金文 | D439: P170571 | E439: LV1060-6973 | F439: STOCK | G439: 2400 | H439: 5.15 | I439: =RC[-2]*RC[-1] -> 12360 | J439: 2016-4-18 | K439: 2016-05-11T00:00:00.000 | L439: 针织
A440: 2016-02-15T00:00:00.000 | B440: 同飞 | C440: 胡金文 | D440: P171091 | E440: XV1060-6973-MJ | F440: MEIJER | G440: 3220 | H440: 4.6500000000000004 | I440: =RC[-2]*RC[-1] -> 14973.000000000002 | J440: 2016-5-8 | K440: 2016-06-01T00:00:00.000 | L440: 针织
A441: 2016-03-07T00:00:00.000 | B441: 同飞/支云塔 | C441: 胡金文 | D441: P171510 | E441: ZT8935-8546，8547 | F441: STOCK | G441: 3600 | H441: 3.95 | I441: =RC[-2]*RC[-1] -> 14220 | J441: 2016-5-8 | K441: 2016-06-02T00:00:00.000 | L441: 针织
A442: 2016-03-07T00:00:00.000 | B442: 同飞/支云塔 | C442: 胡金文 | D442: P171526 | E442: ZT8935-8546，8547 | F442: MACY.COM | G442: 571 | H442: 3.95 | I442: =RC[-2]*RC[-1] -> 2255.4500000000003 | J442: 2016-5-29 | K442: 2016-06-15T00:00:00.000 | L442: 针织
A443: 2016-03-07T00:00:00.000 | B443: 同飞/支云塔 | C443: 胡金文 | D443: P171527 | E443: ZT8935-8546，8547 | F443: MACYS | G443: 4756 | H443: 4.2 | I443: =RC[-2]*RC[-1] -> 19975.2 | J443: 2016-5-29 | K443: 2016-06-15T00:00:00.000 | L443: 针织
A444: 2016-03-07T00:00:00.000 | B444: 同飞/支云塔 | C444: 胡金文 | D444: P171573 | E444: ZT8935-8546，8547 | F444: MACYS | G444: 56 | H444: 4.2 | I444: =RC[-2]*RC[-1] -> 235.20000000000002 | J444: 2016-4-11 | K444: 2016-04-27T00:00:00.000 | L444: 针织
A445: 2016-03-07T00:00:00.000 | B445: 同飞/支云塔 | C445: 胡金文 | D445: P171576 | E445: ZT8935-8546，8547 | F445: MACYS | G445: 30 | H445: 4.2 | I445: =RC[-2]*RC[-1] -> 126 | J445: 2016-4-11 | K445: 2016-04-27T00:00:00.000 | L445: 针织
A446: 2016-03-07T00:00:00.000 | B446: 同飞/支云塔 | C446: 胡金文 | D446: P171577 | E446: ZT8935-8546，8547 | F446: MACYS | G446: 26 | H446: 4.2 | I446: =RC[-2]*RC[-1] -> 109.2 | J446: 2016-4-11 | K446: 2016-04-27T00:00:00.000 | L446: 针织
A447: 2016-03-07T00:00:00.000 | B447: 同飞/支云塔 | C447: 胡金文 | D447: P171578 | E447: ZT8935-8546，8547 | F447: MACYS | G447: 27 | H447: 4.2 | I447: =RC[-2]*RC[-1] -> 113.4 | J447: 2016-4-11 | K447: 2016-04-27T00:00:00.000 | L447: 针织
A448: 2016-03-07T00:00:00.000 | B448: 同飞/支云塔 | C448: 胡金文 | D448: P171579 | E448: ZT8935-8546，8547 | F448: MACYS | G448: 30 | H448: 4.2 | I448: =RC[-2]*RC[-1] -> 126 | J448: 2016-4-11 | K448: 2016-04-27T00:00:00.000 | L448: 针织
A449: 2016-03-07T00:00:00.000 | B449: 同飞/支云塔 | C449: 胡金文 | D449: P171509 | E449: ZT8935-8569 | F449: STOCK | G449: 4800 | H449: 3.95 | I449: =RC[-2]*RC[-1] -> 18960 | J449: 2016-5-8 | K449: 2016-06-02T00:00:00.000 | L449: 针织
A450: 2016-03-07T00:00:00.000 | B450: 同飞/支云塔 | C450: 胡金文 | D450: P171523 | E450: ZT8935-8569 | F450: MACY.COM | G450: 1076 | H450: 3.95 | I450: =RC[-2]*RC[-1] -> 4250.2 | J450: 2016-5-29 | K450: 2016-06-15T00:00:00.000 | L450: 针织
A451: 2016-03-07T00:00:00.000 | B451: 同飞/支云塔 | C451: 胡金文 | D451: P171525 | E451: ZT8935-8569 | F451: MACYS | G451: 8859 | H451: 4.2 | I451: =RC[-2]*RC[-1] -> 37207.800000000003 | J451: 2016-5-29 | K451: 2016-06-15T00:00:00.000 | L451: 针织
A452: 2016-03-07T00:00:00.000 | B452: 同飞/支云塔 | C452: 胡金文 | D452: P171568 | E452: ZT8935-8569 | F452: MACYS | G452: 104 | H452: 4.2 | I452: =RC[-2]*RC[-1] -> 436.8 | J452: 2016-4-11 | K452: 2016-04-27T00:00:00.000 | L452: 针织
A453: 2016-03-07T00:00:00.000 | B453: 同飞/支云塔 | C453: 胡金文 | D453: P171569 | E453: ZT8935-8569 | F453: MACYS | G453: 48 | H453: 4.2 | I453: =RC[-2]*RC[-1] -> 201.60000000000002 | J453: 2016-4-11 | K453: 2016-04-27T00:00:00.000 | L453: 针织
A454: 2016-03-07T00:00:00.000 | B454: 同飞/支云塔 | C454: 胡金文 | D454: P171570 | E454: ZT8935-8569 | F454: MACYS | G454: 50 | H454: 4.2 | I454: =RC[-2]*RC[-1] -> 210 | J454: 2016-4-11 | K454: 2016-04-27T00:00:00.000 | L454: 针织
A455: 2016-03-07T00:00:00.000 | B455: 同飞/支云塔 | C455: 胡金文 | D455: P171571 | E455: ZT8935-8569 | F455: MACYS | G455: 48 | H455: 4.2 | I455: =RC[-2]*RC[-1] -> 201.60000000000002 | J455: 2016-4-11 | K455: 2016-04-27T00:00:00.000 | L455: 针织
A456: 2016-03-07T00:00:00.000 | B456: 同飞/支云塔 | C456: 胡金文 | D456: P171572 | E456: ZT8935-8569 | F456: MACYS | G456: 52 | H456: 4.2 | I456: =RC[-2]*RC[-1] -> 218.4 | J456: 2016-4-11 | K456: 2016-04-27T00:00:00.000 | L456: 针织
A457: 2015-12-09T00:00:00.000 | B457: 唯路易 | C457: 张莉 | D457: 3215 | E457: 0XTH | F457: FRED MEYER | G457: 1642 | H457: 5.29 | I457: =RC[-2]*RC[-1] -> 8686.18 | J457: 2016-2-22 | K457: 2016-03-10T00:00:00.000 | L457: 针织
A458: 2016-01-04T00:00:00.000 | B458: 唯路易 | C458: 孙娟 | D458: 3598 | E458: 0ZBG | F458: MACYS | G458: 18788 | H458: 5.35 | I458: =RC[-2]*RC[-1] -> 100515.79999999999 | J458: 2016-4-25 | K458: 2016-05-04T00:00:00.000 | L458: 针织
A459: 2016-01-04T00:00:00.000 | B459: 唯路易 | C459: 孙娟 | D459: 3603 | E459: 0ZBG | F459: MACYS | G459: 3538 | H459: 5.2 | I459: =RC[-2]*RC[-1] -> 18397.600000000002 | J459: 2016-4-25 | K459: 2016-05-04T00:00:00.000 | L459: 针织
A460: 2016-01-04T00:00:00.000 | B460: 唯路易 | C460: 孙娟 | D460: 3614 | E460: 0YPB | F460: STAGE | G460: 1560 | H460: 7.6 | I460: =RC[-2]*RC[-1] -> 11856 | J460: 2016-4-25 | K460: 2016-05-11T00:00:00.000 | L460: 针织
A461: 2015-11-23T00:00:00.000 | B461: 唯路易 | C461: 付连 | D461: P169925 | E461: NJ26T150M | F461: WALMART | G461: 46448 | H461: 3.85 | I461: =RC[-2]*RC[-1] -> 178824.80000000002 | J461: 2016-2-29 | K461: 2016-03-23T00:00:00.000 | L461: 针织
A462: 2015-10-01T00:00:00.000 | B462: 唯路易 | C462: 谭春艳 | D462: 24683/009 | E462: 260 | G462: 2992 | H462: 3.47 | I462: =RC[-2]*RC[-1] -> 10382.24 | J462: 2016-3-11 | K462: 2016-3-11 | L462: 针织
A463: 2015-10-01T00:00:00.000 | B463: 唯路易 | C463: 谭春艳 | D463: 24683/010 | E463: 260 | G463: 1461 | H463: 3.47 | I463: =RC[-2]*RC[-1] -> 5069.67 | J463: 2016-3-11 | K463: 2016-3-11 | L463: 针织
A464: 2106-03-01T00:00:00.000 | B464: 唯路易 | C464: 谭春艳 | D464: CL160438(200) | E464: YOUTHSS | F464: Southern Marsh | G464: 968 | H464: 2.69 | I464: =RC[-2]*RC[-1] -> 2603.92 | J464: 2016-4-30 | K464: 2016-4-30 | L464: 针织
A465: 2106-03-01T00:00:00.000 | B465: 唯路易 | C465: 谭春艳 | D465: CL160439(200) | E465: YOUTHSS | F465: Southern Marsh | G465: 6400 | H465: 3.09 | I465: =RC[-2]*RC[-1] -> 19776 | J465: 2016-4-30 | K465: 2016-4-30 | L465: 针织
A466: 2106-03-01T00:00:00.000 | B466: 唯路易 | C466: 谭春艳 | D466: CL160440(200) | E466: ADULTSS | F466: Southern Marsh | G466: 14080 | H466: 3.03 | I466: =RC[-2]*RC[-1] -> 42662.399999999994 | J466: 2016-4-30 | K466: 2016-4-30 | L466: 针织
A467: 2106-03-01T00:00:00.000 | B467: 唯路易 | C467: 谭春艳 | D467: CL160441(200) | E467: ADULTSS | F467: Southern Marsh | G467: 2044 | H467: 3.43 | I467: =RC[-2]*RC[-1] -> 7010.92 | J467: 2016-4-30 | K467: 2016-4-30 | L467: 针织
A468: 2016-02-26T00:00:00.000 | B468: 炜雅娜 | C468: 谭春艳 | D468: BA299-1 | E468: B1502MMEY | F468: CATO | G468: 2196 | H468: 6.4 | I468: =RC[-2]*RC[-1] -> 14054.400000000001 | J468: 2016-5-9 | K468: 2016-06-01T00:00:00.000 | L468: 梭织
A469: 2016-02-26T00:00:00.000 | B469: 炜雅娜 | C469: 谭春艳 | D469: BA299A-1 | E469: B1502MMEY | F469: CATO | G469: 804 | H469: 6.4 | I469: =RC[-2]*RC[-1] -> 5145.6000000000004 | J469: 2016-5-9 | K469: 2016-06-01T00:00:00.000 | L469: 梭织
A470: 2016-02-26T00:00:00.000 | B470: 炜雅娜 | C470: 谭春艳 | D470: BA299ATS | E470: B1502MMEY | F470: HOUSE ACCOUNT | G470: 1800 | H470: 6.6 | I470: =RC[-2]*RC[-1] -> 11880 | J470: 2016-5-9 | K470: 2016-06-01T00:00:00.000 | L470: 梭织
A471: 2015-12-24T00:00:00.000 | B471: 炜雅娜 | C471: 付连 | D471: 1-16-1699 | E471: 15024A01 | F471: JCP | G471: 4966 | H471: 6.05 | I471: =RC[-2]*RC[-1] -> 30044.3 | J471: 2016-5-30 | K471: 2016-06-15T00:00:00.000 | L471: 梭织
A472: 2015-12-24T00:00:00.000 | B472: 炜雅娜 | C472: 付连 | D472: HFC#70143-1 | E472: 15024A01 | F472: JCP | G472: 20 | H472: 6.05 | I472: =RC[-2]*RC[-1] -> 121 | J472: 2016-5-9 | K472: 2016-05-25T00:00:00.000 | L472: 梭织
A473: 2015-12-24T00:00:00.000 | B473: 炜雅娜 | C473: 付连 | D473: HFC#70144 | E473: 15024A01 | F473: JCP | G473: 638 | H473: 6.05 | I473: =RC[-2]*RC[-1] -> 3859.9 | J473: 2016-7-11 | K473: 2016-07-27T00:00:00.000 | L473: 梭织
A474: 2015-12-24T00:00:00.000 | B474: 炜雅娜 | C474: 付连 | D474: 1-16-1707 | E474: 15024A01 | F474: JCP | G474: 328 | H474: 6.05 | I474: =RC[-2]*RC[-1] -> 1984.3999999999999 | J474: 2016-5-30 | K474: 2016-06-15T00:00:00.000 | L474: 梭织
A475: 2016-01-21T00:00:00.000 | B475: 炜雅娜 | C475: 王强 | D475: 8334 | E475: MT4893W4983R | G475: 180 | H475: 5.75 | I475: =RC[-2]*RC[-1] -> 1035 | J475: 2016-5-16 | K475: 2016-06-03T00:00:00.000 | L475: 梭织
A476: 2016-01-21T00:00:00.000 | B476: 炜雅娜 | C476: 王强 | D476: 8334 | E476: MT4893W4983R | G476: 1595 | H476: 5.9 | I476: =RC[-2]*RC[-1] -> 9410.5 | J476: 2016-5-16 | K476: 2016-06-03T00:00:00.000 | L476: 梭织
A477: 2016-01-28T00:00:00.000 | B477: 炜雅娜 | C477: 王强 | D477: 8600 | E477: MT4893W4983R | G477: 250 | H477: 5.9 | I477: =RC[-2]*RC[-1] -> 1475 | J477: 2016-5-16 | K477: 2016-06-03T00:00:00.000 | L477: 梭织
A478: 2015-12-02T00:00:00.000 | B478: 依尚 | C478: 孙娟 | D478: 3114 | E478: 03JX | F478: BELK | G478: 1760 | H478: 5.4 | I478: =RC[-2]*RC[-1] -> 9504 | J478: 2016-3-14 | K478: 2016-03-30T00:00:00.000 | L478: 梭织
A479: 2016-01-06T00:00:00.000 | B479: 依尚 | C479: 孙娟 | D479: 3660 | E479: 03JX | F479: BELK | G479: 936 | H479: 5.4 | I479: =RC[-2]*RC[-1] -> 5054.4000000000005 | J479: 2016-3-14 | K479: 2016-03-30T00:00:00.000 | L479: 梭织
A480: 2016-01-06T00:00:00.000 | B480: 依尚 | C480: 孙娟 | D480: 3663 | E480: 03JX | F480: BELK | G480: 40 | H480: 5.4 | I480: =RC[-2]*RC[-1] -> 216 | J480: 2016-3-14 | K480: 2016-03-30T00:00:00.000 | L480: 梭织
A481: 2015-11-24T00:00:00.000 | B481: 依尚 | C481: 唐琼茜 | D481: BA226-1 | E481: J1744MXQUP | F481: FRANCESCA'S | G481: 2760 | H481: 5.7 | I481: =RC[-2]*RC[-1] -> 15732 | J481: 2016-3-21 | K481: 2016-04-12T00:00:00.000 | L481: 梭织
A482: 2015-12-08T00:00:00.000 | B482: 依尚 | C482: 唐琼茜 | D482: BA226EC-1 | E482: J1744MXQUP | F482: LOVE ON HANGER | G482: 6 | H482: 5.7 | I482: =RC[-2]*RC[-1] -> 34.200000000000003 | J482: 2016-3-21 | K482: 2016-04-14T00:00:00.000 | L482: 梭织
A483: 2015-11-24T00:00:00.000 | B483: 依尚 | C483: 吕婵娟 | D483: BA227-1 | E483: J3404MA23P | F483: FRANCESCA'S | G483: 3978 | H483: 4.0999999999999996 | I483: =RC[-2]*RC[-1] -> 16309.8 | J483: 2016-3-21 | K483: 2016-04-12T00:00:00.000 | L483: 梭织
A484: 2016-01-08T00:00:00.000 | B484: 依尚 | C484: 王强 | D484: BA280-1 | E484: B7869MYST | G484: 648 | H484: 5.35 | I484: =RC[-2]*RC[-1] -> 3466.7999999999997 | J484: 2016-4-18 | K484: 2016-05-04T00:00:00.000 | L484: 梭织
A485: 2016-01-08T00:00:00.000 | B485: 依尚 | C485: 王强 | D485: BA280ATS-02 | E485: B7869MYST | F485: CATO | G485: 1152 | H485: 5.55 | I485: =RC[-2]*RC[-1] -> 6393.5999999999995 | J485: 2016-4-18 | K485: 2016-05-04T00:00:00.000 | L485: 梭织
A486: 2016-01-18T00:00:00.000 | B486: 依尚 | C486: 王强 | D486: BA280ATS-01 | E486: B7869MYST | F486: STAGE | G486: 600 | H486: 5.55 | I486: =RC[-2]*RC[-1] -> 3330 | J486: 2016-4-18 | K486: 2016-05-04T00:00:00.000 | L486: 梭织
A487: 2015-12-02T00:00:00.000 | B487: 依尚 | C487: 王晓檬 | D487: HFC#8595 | E487: 72483A01 | F487: BUCKLE | G487: 1200 | H487: 8.5 | I487: =RC[-2]*RC[-1] -> 10200 | J487: 2016-3-21 | K487: 2016-04-06T00:00:00.000 | L487: 梭织
A488: 2015-12-07T00:00:00.000 | B488: 依尚 | C488: 王晓檬 | D488: HFC#30536 | E488: 72483A01 | F488: NORDSTROM | G488: 120 | I488: =RC[-2]*RC[-1] -> 0 | J488: 2016-3-21 | K488: 2016-04-06T00:00:00.000 | L488: 梭织
A489: 2015-12-02T00:00:00.000 | B489: 依尚 | C489: 张莉 | D489: 105737 | E489: S3651D01CYCK | F489: PROJECTIONS | G489: 1200 | H489: 8.6 | I489: =RC[-2]*RC[-1] -> 10320 | J489: 2016-3-14 | K489: 2016-03-30T00:00:00.000 | L489: 梭织
A490: 2015-11-19T00:00:00.000 | B490: 依饰杰 | C490: 张莉 | D490: 2930 | E490: ADH2 | F490: WALMART | G490: 20168 | H490: 3.75 | I490: =RC[-2]*RC[-1] -> 75630 | J490: 2016-3-7 | K490: 2016-03-23T00:00:00.000 | L490: 针织
A491: 2016-01-04T00:00:00.000 | B491: 依饰杰 | C491: 张莉 | D491: 3685 | E491: AJV8 | F491: WALMART | G491: 144 | H491: 3.38 | I491: =RC[-2]*RC[-1] -> 486.71999999999997 | J491: 2016-4-25 | K491: 2016-05-11T00:00:00.000 | L491: 针织
A492: 2016-01-04T00:00:00.000 | B492: 依饰杰 | C492: 张莉 | D492: 3687 | E492: AJV8 | F492: WALMART | G492: 784 | H492: 3.38 | I492: =RC[-2]*RC[-1] -> 2649.92 | J492: 2016-4-25 | K492: 2016-05-11T00:00:00.000 | L492: 针织
A493: 2016-01-07T00:00:00.000 | B493: 依饰杰 | C493: 张莉 | D493: 3693 | E493: AJV8 | F493: WALMART | G493: 472 | H493: 3.38 | I493: =RC[-2]*RC[-1] -> 1595.36 | J493: 2016-4-25 | K493: 2016-05-11T00:00:00.000 | L493: 针织
A494: 2016-01-07T00:00:00.000 | B494: 依饰杰 | C494: 张莉 | D494: 3694 | E494: AJV8 | F494: WALMART | G494: 101912 | H494: 3.38 | I494: =RC[-2]*RC[-1] -> 344462.56 | J494: 2016-4-25 | K494: 2016-05-11T00:00:00.000 | L494: 针织
A495: 2016-01-07T00:00:00.000 | B495: 依饰杰 | C495: 张莉 | D495: 3696 | E495: AJV8 | F495: WALMART | G495: 25896 | H495: 3.38 | I495: =RC[-2]*RC[-1] -> 87528.48 | J495: 2016-4-25 | K495: 2016-05-11T00:00:00.000 | L495: 针织
A496: 2016-01-07T00:00:00.000 | B496: 依饰杰 | C496: 张莉 | D496: 3697 | E496: ALG0 | F496: WALMART | G496: 48 | H496: 3.6 | I496: =RC[-2]*RC[-1] -> 172.8 | J496: 2016-4-25 | K496: 2016-05-11T00:00:00.000 | L496: 针织
A497: 2016-01-07T00:00:00.000 | B497: 依饰杰 | C497: 张莉 | D497: 3699 | E497: ALG0 | F497: WALMART | G497: 192 | H497: 3.6 | I497: =RC[-2]*RC[-1] -> 691.2 | J497: 2016-4-25 | K497: 2016-05-11T00:00:00.000 | L497: 针织
A498: 2016-01-07T00:00:00.000 | B498: 依饰杰 | C498: 张莉 | D498: 3700 | E498: ALG0 | F498: WALMART | G498: 22912 | H498: 3.6 | I498: =RC[-2]*RC[-1] -> 82483.199999999997 | J498: 2016-4-25 | K498: 2016-05-11T00:00:00.000 | L498: 针织
A499: 2016-01-13T00:00:00.000 | B499: 依饰杰 | C499: 张莉 | D499: 3739 | E499: ALB6 | F499: WALMART | G499: 192 | H499: 5.75 | I499: =RC[-2]*RC[-1] -> 1104 | J499: 2016-4-25 | K499: 2016-05-11T00:00:00.000 | L499: 梭织
A500: 2016-01-13T00:00:00.000 | B500: 依饰杰 | C500: 张莉 | D500: 3740 | E500: ALB6 | F500: WALMART | G500: 936 | H500: 5.75 | I500: =RC[-2]*RC[-1] -> 5382 | J500: 2016-4-25 | K500: 2016-05-11T00:00:00.000 | L500: 梭织
A501: 2016-01-13T00:00:00.000 | B501: 依饰杰 | C501: 张莉 | D501: 3747 | E501: ALB6 | F501: WALMART | G501: 84120 | H501: 5.75 | I501: =RC[-2]*RC[-1] -> 483690 | J501: 2016-4-25 | K501: 2016-05-11T00:00:00.000 | L501: 梭织
A502: 2016-01-21T00:00:00.000 | B502: 依饰杰 | C502: 张莉 | D502: 3811 | E502: AMC8 | F502: WALMART | G502: 324 | H502: 3.62 | I502: =RC[-2]*RC[-1] -> 1172.8800000000001 | J502: 2016-5-2 | K502: 2016-05-20T00:00:00.000 | L502: 梭织
A503: 2016-01-21T00:00:00.000 | B503: 依饰杰 | C503: 张莉 | D503: 3812 | E503: AMC8 | F503: WALMART | G503: 2205 | H503: 3.62 | I503: =RC[-2]*RC[-1] -> 7982.1 | J503: 2016-5-2 | K503: 2016-05-20T00:00:00.000 | L503: 梭织
A504: 2016-01-21T00:00:00.000 | B504: 依饰杰 | C504: 张莉 | D504: 3813 | E504: AMC8 | F504: WALMART | G504: 450 | H504: 3.62 | I504: =RC[-2]*RC[-1] -> 1629 | J504: 2016-5-2 | K504: 2016-05-20T00:00:00.000 | L504: 梭织
A505: 2016-01-21T00:00:00.000 | B505: 依饰杰 | C505: 张莉 | D505: 3815 | E505: AMC8 | F505: WALMART | G505: 271341 | H505: 3.62 | I505: =RC[-2]*RC[-1] -> 982254.42 | J505: 2016-5-2 | K505: 2016-05-20T00:00:00.000 | L505: 梭织
A506: 2016-01-21T00:00:00.000 | B506: 依饰杰 | C506: 张莉 | D506: 3816 | E506: AMC8 | F506: WALMART | G506: 12267 | H506: 3.62 | I506: =RC[-2]*RC[-1] -> 44406.54 | J506: 2016-5-2 | K506: 2016-05-20T00:00:00.000 | L506: 梭织
A507: 2016-01-21T00:00:00.000 | B507: 依饰杰 | C507: 张莉 | D507: 3817 | E507: AMC8 | F507: WALMART | G507: 2862 | H507: 3.62 | I507: =RC[-2]*RC[-1] -> 10360.44 | J507: 2016-5-2 | K507: 2016-05-20T00:00:00.000 | L507: 梭织
A508: 2015-11-12T00:00:00.000 | B508: 依饰杰 | C508: 王强 | D508: HFC#1358 | E508: 50617F01 | F508: WALMART | G508: 50000 | H508: 5.55 | I508: =RC[-2]*RC[-1] -> 277500 | J508: 2016-2-29 | K508: 2016-03-16T00:00:00.000 | L508: 梭织
A509: 2015-12-02T00:00:00.000 | B509: 依饰杰 | C509: 付连 | D509: P170086 | E509: NJ26T370M | F509: WALMART | G509: 104368 | H509: 6.1 | I509: =RC[-2]*RC[-1] -> 636644.79999999993 | J509: 2016-3-14 | K509: 2016-04-06T00:00:00.000 | L509: 针织
A510: 2015-12-02T00:00:00.000 | B510: 依饰杰 | C510: 付连 | D510: P170087 | E510: NJ26T370M | F510: WALMART | G510: 144 | H510: 6.1 | I510: =RC[-2]*RC[-1] -> 878.4 | J510: 2016-3-14 | K510: 2016-04-06T00:00:00.000 | L510: 针织
A511: 2015-11-23T00:00:00.000 | B511: 依饰杰 | C511: 胡金文 | D511: P169908 | E511: NJ26T162M | F511: WALMART | G511: 113856 | H511: 3 | I511: =RC[-2]*RC[-1] -> 341568 | J511: 2016-3-14 | K511: 2016-04-06T00:00:00.000 | L511: 针织
A512: 2015-11-23T00:00:00.000 | B512: 依饰杰 | C512: 胡金文 | D512: P169910 | E512: NJ26T162M | F512: WALMART | G512: 38264 | H512: 3 | I512: =RC[-2]*RC[-1] -> 114792 | J512: 2016-3-14 | K512: 2016-04-06T00:00:00.000 | L512: 针织
A513: 2015-12-02T00:00:00.000 | B513: 依饰杰/忆莱/高梵 | C513: 胡金文 | D513: P170090 | E513: NJ26T182M | F513: WALMART | G513: 233840 | H513: 4.05 | I513: =RC[-2]*RC[-1] -> 947052 | J513: 2016-2-29 | K513: 2016-03-23T00:00:00.000 | L513: 梭织
A514: 2015-12-02T00:00:00.000 | B514: 依饰杰/忆莱/高梵 | C514: 胡金文 | D514: P170091 | E514: NJ26T182M | F514: WALMART | G514: 6944 | H514: 4.05 | I514: =RC[-2]*RC[-1] -> 28123.199999999997 | J514: 2016-2-29 | K514: 2016-03-23T00:00:00.000 | L514: 梭织
A515: 2015-12-02T00:00:00.000 | B515: 依饰杰/忆莱/高梵 | C515: 胡金文 | D515: P170092 | E515: NJ26T182M | F515: WALMART | G515: 5256 | H515: 4.05 | I515: =RC[-2]*RC[-1] -> 21286.799999999999 | J515: 2016-2-29 | K515: 2016-03-23T00:00:00.000 | L515: 梭织
A516: 2015-11-25T00:00:00.000 | B516: 忆莱 | C516: 周婷 | D516: BA230-1 | E516: J2027MNP0Z | F516: TARGET | G516: 27293 | H516: 8.6999999999999993 | I516: =RC[-2]*RC[-1] -> 237449.09999999998 | J516: 2016-3-14 | K516: 2016-04-06T00:00:00.000 | L516: 梭织
A517: 2015-12-10T00:00:00.000 | B517: 忆莱 | C517: 周婷 | D517: BA230A-1 | E517: J2027MNP0Z | F517: TARGET.COM | G517: 234 | H517: 8.5 | I517: =RC[-2]*RC[-1] -> 1989 | J517: 2016-3-14 | K517: 2016-04-06T00:00:00.000 | L517: 梭织
A518: 2015-12-08T00:00:00.000 | B518: 忆莱 | C518: 周婷 | D518: BA230EC-1 | E518: J2027MNP0Z | F518: LOVE ON HANGER | G518: 12 | H518: 8.5 | I518: =RC[-2]*RC[-1] -> 102 | J518: 2016-3-14 | K518: 2016-04-06T00:00:00.000 | L518: 梭织
A519: 2015-12-03T00:00:00.000 | B519: 忆莱 | C519: 唐琼茜 | D519: BA237-1 | E519: B1502MMEY | F519: MACY.COM | G519: 396 | H519: 6.4 | I519: =RC[-2]*RC[-1] -> 2534.4 | J519: 2016-3-21 | K519: 2016-04-13T00:00:00.000 | L519: 梭织
A520: 2015-12-03T00:00:00.000 | B520: 忆莱 | C520: 唐琼茜 | D520: BA237ATS | E520: B1502MMEY | F520: HOUSE ACCOUNT | G520: 564 | H520: 6.6 | I520: =RC[-2]*RC[-1] -> 3722.3999999999996 | J520: 2016-3-21 | K520: 2016-04-13T00:00:00.000 | L520: 梭织
A521: 2015-12-03T00:00:00.000 | B521: 忆莱 | C521: 唐琼茜 | D521: BA237ATS-02 | E521: B1502MMEY | F521: CATO | G521: 804 | H521: 6.4 | I521: =RC[-2]*RC[-1] -> 5145.6000000000004 | J521: 2016-3-21 | K521: 2016-04-13T00:00:00.000 | L521: 梭织
A522: 2016-01-21T00:00:00.000 | B522: 忆莱 | C522: 唐琼茜 | D522: BA237ATS-01 | E522: B1502MMEY | F522: CARSON'S | G522: 630 | H522: 6.6 | I522: =RC[-2]*RC[-1] -> 4158 | J522: 2016-3-21 | K522: 2016-04-13T00:00:00.000 | L522: 梭织
A523: 2016-01-18T00:00:00.000 | B523: 忆莱 | C523: 唐琼茜 | D523: BA237ATSEC-01 | E523: B1502MMEY | F523: HOUSE ACCOUNT | G523: 6 | H523: 6.4 | I523: =RC[-2]*RC[-1] -> 38.400000000000006 | J523: 2016-3-21 | K523: 2016-04-13T00:00:00.000 | L523: 梭织
A524: 2015-12-23T00:00:00.000 | B524: 忆莱 | C524: 董灏 | D524: BA262-1 | E524: J8056MYUSZ | F524: TARGET | G524: 13876 | H524: 5.5 | I524: =RC[-2]*RC[-1] -> 76318 | J524: 2016-4-4 | K524: 2016-04-27T00:00:00.000 | L524: 梭织
A525: 2016-01-14T00:00:00.000 | B525: 忆莱 | C525: 董灏 | D525: BA262A-1 | E525: J8056MYUSZ | F525: TARGET.COM | G525: 62 | H525: 5.3 | I525: =RC[-2]*RC[-1] -> 328.59999999999997 | J525: 2016-4-4 | K525: 2016-04-27T00:00:00.000 | L525: 梭织
A526: 2015-12-31T00:00:00.000 | B526: 忆莱 | C526: 董灏 | D526: BA262EC-1 | E526: J8056MYUSZ | G526: 6 | H526: 5.3 | I526: =RC[-2]*RC[-1] -> 31.799999999999997 | J526: 2016-4-4 | K526: 2016-04-27T00:00:00.000 | L526: 梭织
A527: 2015-12-23T00:00:00.000 | B527: 忆莱 | C527: 董灏 | D527: BA263-1 | E527: J8056MZ84Z | F527: TARGET | G527: 15127 | H527: 5.5 | I527: =RC[-2]*RC[-1] -> 83198.5 | J527: 2016-4-4 | K527: 2016-04-27T00:00:00.000 | L527: 梭织
A528: 2016-01-14T00:00:00.000 | B528: 忆莱 | C528: 董灏 | D528: BA263A-1 | E528: J8056MZ84Z | F528: TARGET.COM | G528: 69 | H528: 5.3 | I528: =RC[-2]*RC[-1] -> 365.7 | J528: 2016-4-4 | K528: 2016-04-27T00:00:00.000 | L528: 梭织
A529: 2015-12-31T00:00:00.000 | B529: 忆莱 | C529: 董灏 | D529: BA263EC-1 | E529: J8056MZ84Z | G529: 6 | H529: 5.3 | I529: =RC[-2]*RC[-1] -> 31.799999999999997 | J529: 2016-4-4 | K529: 2016-04-27T00:00:00.000 | L529: 梭织
A530: 2015-12-29T00:00:00.000 | B530: 忆莱 | C530: 董灏 | D530: BA273-1 | E530: B7881MMEYG | G530: 2016 | H530: 6.1 | I530: =RC[-2]*RC[-1] -> 12297.599999999999 | J530: 2016-4-18 | K530: 2016-05-11T00:00:00.000 | L530: 梭织
A531: 2015-12-29T00:00:00.000 | B531: 忆莱 | C531: 董灏 | D531: BA273-2 | E531: B7881MMEYG | G531: 144 | H531: 6.1 | I531: =RC[-2]*RC[-1] -> 878.4 | J531: 2016-4-18 | K531: 2016-05-11T00:00:00.000 | L531: 梭织
A532: 2015-12-29T00:00:00.000 | B532: 忆莱 | C532: 董灏 | D532: BA273A-1 | E532: B7881MMEYG | G532: 96 | H532: 5.9 | I532: =RC[-2]*RC[-1] -> 566.40000000000009 | J532: 2016-4-18 | K532: 2016-05-11T00:00:00.000 | L532: 梭织
A533: 2016-01-08T00:00:00.000 | B533: 忆莱 | C533: 王强 | D533: BA281ATS | E533: B7869CAET | F533: HOUSE ACCOUNT | G533: 1440 | H533: 6.3 | I533: =RC[-2]*RC[-1] -> 9072 | J533: 2016-4-25 | K533: 2016-05-11T00:00:00.000 | L533: 梭织
A534: 2016-01-08T00:00:00.000 | B534: 忆莱 | C534: 王强 | D534: BA281ATS-01 | E534: B7869CAET | F534: BUCKLE | G534: 960 | H534: 6.1 | I534: =RC[-2]*RC[-1] -> 5856 | J534: 2016-4-25 | K534: 2016-05-11T00:00:00.000 | L534: 梭织
A535: 2015-12-18T00:00:00.000 | B535: 忆莱 | C535: 王强 | D535: 7858 | E535: MT4731W4932 | G535: 240 | H535: 8 | I535: =RC[-2]*RC[-1] -> 1920 | J535: 2016-3-27 | K535: 2016-04-15T00:00:00.000 | L535: 梭织
A536: 2015-12-18T00:00:00.000 | B536: 忆莱 | C536: 王强 | D536: 7854 | E536: MT4731W4932 | G536: 1577 | H536: 8.15 | I536: =RC[-2]*RC[-1] -> 12852.550000000001 | J536: 2016-3-27 | K536: 2016-04-15T00:00:00.000 | L536: 梭织
A537: 2016-01-13T00:00:00.000 | B537: 忆莱 | C537: 王强 | D537: 8017 | E537: XT4731W4358R | G537: 120 | H537: 8.15 | I537: =RC[-2]*RC[-1] -> 978 | J537: 2016-3-27 | K537: 2016-04-15T00:00:00.000 | L537: 梭织
A538: 2016-01-13T00:00:00.000 | B538: 忆莱 | C538: 王强 | D538: 8017 | E538: XT4731W4358R | G538: 764 | H538: 8.3000000000000007 | I538: =RC[-2]*RC[-1] -> 6341.2000000000007 | J538: 2016-3-27 | K538: 2016-04-15T00:00:00.000 | L538: 梭织
A539: 2015-12-01T00:00:00.000 | B539: 忆莱/云英 | C539: 鲁晨诗 | D539: HFC#70133 | E539: 14970A01 | F539: KOHLS.COM | G539: 144 | H539: 6 | I539: =RC[-2]*RC[-1] -> 864 | J539: 2016-3-7 | K539: 2016-03-23T00:00:00.000 | L539: 针织
A540: 2015-12-01T00:00:00.000 | B540: 忆莱/云英 | C540: 鲁晨诗 | D540: HFC#70133 | E540: 14896A01 | F540: KOHLS.COM | G540: 144 | H540: 5.55 | I540: =RC[-2]*RC[-1] -> 799.19999999999993 | J540: 2016-3-21 | K540: 2016-04-06T00:00:00.000 | L540: 针织
A541: 2015-12-01T00:00:00.000 | B541: 忆莱/云英 | C541: 鲁晨诗 | D541: HFC#70133-1 | E541: 14970A01 | F541: KOHLS.COM | G541: 2856 | H541: 6 | I541: =RC[-2]*RC[-1] -> 17136 | J541: 2016-3-7 | K541: 2016-03-23T00:00:00.000 | L541: 针织
A542: 2015-12-01T00:00:00.000 | B542: 忆莱/云英 | C542: 鲁晨诗 | D542: HFC#70133-1 | E542: 14896A01 | F542: KOHLS.COM | G542: 2856 | H542: 5.55 | I542: =RC[-2]*RC[-1] -> 15850.8 | J542: 2016-3-21 | K542: 2016-04-06T00:00:00.000 | L542: 针织
A543: 2015-12-17T00:00:00.000 | B543: 云英 | C543: 董灏 | D543: BA246-1 | E543: J5651MWQUC | F543: CATO | G543: 7665 | H543: 4.95 | I543: =RC[-2]*RC[-1] -> 37941.75 | J543: 2016-3-21 | K543: 2016-04-13T00:00:00.000 | L543: 针织
A544: 2015-12-17T00:00:00.000 | B544: 云英 | C544: 董灏 | D544: BA246-2 | E544: J5651MWQUC | F544: CATO | G544: 5106 | H544: 4.95 | I544: =RC[-2]*RC[-1] -> 25274.7 | J544: 2016-3-21 | K544: 2016-04-13T00:00:00.000 | L544: 针织
A545: 2015-12-17T00:00:00.000 | B545: 云英 | C545: 董灏 | D545: BA246A-1 | E545: J5651MWQUC | F545: CATO | G545: 120 | H545: 4.95 | I545: =RC[-2]*RC[-1] -> 594 | J545: 2016-3-21 | K545: 2016-04-13T00:00:00.000 | L545: 针织
A546: 2015-12-24T00:00:00.000 | B546: 云英 | C546: 唐琼茜 | D546: BA252-1 | E546: J9652MFKJC | F546: CATO | G546: 3486 | H546: 6.1 | I546: =RC[-2]*RC[-1] -> 21264.6 | J546: 2016-3-21 | K546: 2016-04-13T00:00:00.000 | L546: 针织
A547: 2015-12-24T00:00:00.000 | B547: 云英 | C547: 唐琼茜 | D547: BA252-2 | E547: J9652MFKJC | F547: CATO | G547: 5229 | H547: 6.1 | I547: =RC[-2]*RC[-1] -> 31896.899999999998 | J547: 2016-3-21 | K547: 2016-04-13T00:00:00.000 | L547: 针织
A548: 2015-12-24T00:00:00.000 | B548: 云英 | C548: 唐琼茜 | D548: BA252A-1 | E548: J9652MFKJC | F548: CATO | G548: 120 | H548: 6.1 | I548: =RC[-2]*RC[-1] -> 732 | J548: 2016-3-21 | K548: 2016-04-13T00:00:00.000 | L548: 针织
A549: 2015-12-24T00:00:00.000 | B549: 云英 | C549: 唐琼茜 | D549: BA253-1 | E549: B9652MFKJC | F549: CATO | G549: 180 | H549: 7 | I549: =RC[-2]*RC[-1] -> 1260 | J549: 2016-3-21 | K549: 2016-04-13T00:00:00.000 | L549: 针织
A550: 2015-12-24T00:00:00.000 | B550: 云英 | C550: 唐琼茜 | D550: BA253-2 | E550: B9652MFKJC | F550: CATO | G550: 4620 | H550: 7 | I550: =RC[-2]*RC[-1] -> 32340 | J550: 2016-3-21 | K550: 2016-04-13T00:00:00.000 | L550: 针织
A551: 2015-12-24T00:00:00.000 | B551: 云英 | C551: 唐琼茜 | D551: BA253-3 | E551: B9652MFKJC | F551: CATO | G551: 1980 | H551: 7 | I551: =RC[-2]*RC[-1] -> 13860 | J551: 2016-3-21 | K551: 2016-04-13T00:00:00.000 | L551: 针织
A552: 2015-12-29T00:00:00.000 | B552: 云英 | C552: 吕婵娟 | D552: BA270-1 | E552: J8126MUSDG | G552: 5032 | H552: 6 | I552: =RC[-2]*RC[-1] -> 30192 | J552: 2016-5-25 | K552: 2016-06-15T00:00:00.000 | L552: 针织
A553: 2015-12-29T00:00:00.000 | B553: 云英 | C553: 吕婵娟 | D553: BA270-2 | E553: J8126MUSDG | G553: 2000 | H553: 6 | I553: =RC[-2]*RC[-1] -> 12000 | J553: 2016-5-25 | K553: 2016-06-15T00:00:00.000 | L553: 针织
A554: 2015-12-29T00:00:00.000 | B554: 云英 | C554: 吕婵娟 | D554: BA270-3 | E554: J8126MUSDG | G554: 408 | H554: 6 | I554: =RC[-2]*RC[-1] -> 2448 | J554: 2016-5-25 | K554: 2016-06-15T00:00:00.000 | L554: 针织
A555: 2015-12-29T00:00:00.000 | B555: 云英 | C555: 吕婵娟 | D555: BA270A-1 | E555: J8126MUSDG | G555: 152 | H555: 5.8 | I555: =RC[-2]*RC[-1] -> 881.6 | J555: 2016-5-25 | K555: 2016-06-15T00:00:00.000 | L555: 针织
A556: 2016-01-13T00:00:00.000 | B556: 云英 | C556: 李绍兰 | D556: BA282-1 | E556: B5759MZIXP | F556: TORRID | G556: 1026 | H556: 7 | I556: =RC[-2]*RC[-1] -> 7182 | J556: 2016-4-25 | K556: 2016-05-10T00:00:00.000 | L556: 针织
A557: 2016-01-22T00:00:00.000 | B557: 云英 | C557: 李绍兰 | D557: BA282-2 | E557: B5759MZIXP | F557: TORRID | G557: 1211 | H557: 7 | I557: =RC[-2]*RC[-1] -> 8477 | J557: 2016-4-25 | K557: 2016-05-10T00:00:00.000 | L557: 针织
A558: 2016-01-22T00:00:00.000 | B558: 云英 | C558: 李绍兰 | D558: BA282A-1 | E558: B5759MZIXP | F558: TORRID | G558: 1362 | H558: 7 | I558: =RC[-2]*RC[-1] -> 9534 | J558: 2016-4-25 | K558: 2016-05-10T00:00:00.000 | L558: 针织
A559: 2016-01-22T00:00:00.000 | B559: 云英 | C559: 李绍兰 | D559: BA282A-2 | E559: B5759MZIXP | F559: TORRID | G559: 1617 | H559: 7 | I559: =RC[-2]*RC[-1] -> 11319 | J559: 2016-4-25 | K559: 2016-05-10T00:00:00.000 | L559: 针织
A560: 2016-01-22T00:00:00.000 | B560: 云英 | C560: 李绍兰 | D560: BA282B-1 | E560: B5759MZIXP | F560: TORRID | G560: 639 | H560: 7 | I560: =RC[-2]*RC[-1] -> 4473 | J560: 2016-4-25 | K560: 2016-05-10T00:00:00.000 | L560: 针织
A561: 2016-01-22T00:00:00.000 | B561: 云英 | C561: 李绍兰 | D561: BA282C-1 | E561: B5759MZIXP | F561: TORRID | G561: 134 | H561: 7 | I561: =RC[-2]*RC[-1] -> 938 | J561: 2016-4-25 | K561: 2016-05-10T00:00:00.000 | L561: 针织
A562: 2015-11-26T00:00:00.000 | B562: 云英 | C562: 王强 | D562: HFC#91445 | E562: 21369A0001 | F562: MACYS | G562: 7698 | I562: =RC[-2]*RC[-1] -> 0 | J562: 2016-3-28 | K562: 2016-04-13T00:00:00.000 | L562: 针织
A563: 2015-11-26T00:00:00.000 | B563: 云英 | C563: 王强 | D563: HFC#91445-1 | E563: 21369A0001 | F563: MACYS | G563: 609 | I563: =RC[-2]*RC[-1] -> 0 | J563: 2016-3-28 | K563: 2016-04-13T00:00:00.000 | L563: 针织
A564: 2015-11-26T00:00:00.000 | B564: 云英 | C564: 王强 | D564: HFC#91449 | E564: 21369C0001 | F564: MACYS | G564: 5352 | I564: =RC[-2]*RC[-1] -> 0 | J564: 2016-3-28 | K564: 2016-04-13T00:00:00.000 | L564: 针织
A565: 2015-11-26T00:00:00.000 | B565: 云英 | C565: 王强 | D565: HFC#91449-1 | E565: 21369C0001 | F565: MACYS | G565: 228 | I565: =RC[-2]*RC[-1] -> 0 | J565: 2016-3-28 | K565: 2016-04-13T00:00:00.000 | L565: 针织
A566: 2016-02-23T00:00:00.000 | B566: 云英 | C566: 王晓檬 | D566: HFC#30585 | E566: 41841A0001 | F566: NORDSTROM | G566: 2904 | H566: 4.8 | I566: =RC[-2]*RC[-1] -> 13939.199999999999 | J566: 2016-05-16T00:00:00.000 | K566: 2016-06-01T00:00:00.000 | L566: 针织
A567: 2016-02-23T00:00:00.000 | B567: 云英 | C567: 王晓檬 | D567: HFC#30585-1 | E567: 41841A0001 | F567: NORDSTROM | G567: 504 | H567: 4.8 | I567: =RC[-2]*RC[-1] -> 2419.1999999999998 | J567: 2016-05-16T00:00:00.000 | K567: 2016-06-01T00:00:00.000 | L567: 针织
A568: 2016-02-23T00:00:00.000 | B568: 云英 | C568: 王晓檬 | D568: HFC#30585-2 | E568: 41841A0001 | F568: NORDSTROM | G568: 24 | H568: 4.8 | I568: =RC[-2]*RC[-1] -> 115.19999999999999 | J568: 2016-05-16T00:00:00.000 | K568: 2016-06-01T00:00:00.000 | L568: 针织
A569: 2016-01-19T00:00:00.000 | B569: 云英 | C569: 胡金文 | D569: P170586 | E569: AT1716 | F569: STOCK | G569: 3600 | H569: 4.75 | I569: =RC[-2]*RC[-1] -> 17100 | J569: 2016-4-25 | K569: 2016-05-18T00:00:00.000 | L569: 针织
A570: 2016-02-06T00:00:00.000 | B570: 支云塔 | C570: 吕婵娟 | D570: BA288-2 | E570: J7443MSOSP | F570: VANITY | G570: 2004 | H570: 7.05 | I570: =RC[-2]*RC[-1] -> 14128.199999999999 | J570: 2016-5-16 | K570: 2016-06-08T00:00:00.000 | L570: 针织
A571: 2016-02-06T00:00:00.000 | B571: 支云塔 | C571: 吕婵娟 | D571: BA288-1 | E571: J7443MSOSP | F571: VANITY | G571: 2202 | H571: 7.05 | I571: =RC[-2]*RC[-1] -> 15524.1 | J571: 2016-5-16 | K571: 2016-06-08T00:00:00.000 | L571: 针织
A572: 2016-02-26T00:00:00.000 | B572: 支云塔 | C572: 武玲玲 | D572: 016879 | E572: BFTK1677 | F572: BELK | G572: 6596 | H572: 4.5 | I572: =RC[-2]*RC[-1] -> 29682 | J572: 2016-5-22 | K572: 2016-06-08T00:00:00.000 | L572: 针织
A573: 2016-02-26T00:00:00.000 | B573: 支云塔 | C573: 武玲玲 | D573: 016879 | E573: BFTK1677S | F573: BELK | G573: 4516 | H573: 5.05 | I573: =RC[-2]*RC[-1] -> 22805.8 | J573: 2016-5-22 | K573: 2016-06-08T00:00:00.000 | L573: 针织
A574: 2016-02-26T00:00:00.000 | B574: 支云塔 | C574: 武玲玲 | D574: 016880 | E574: BFTK1677 | F574: BELK | G574: 144 | H574: 4.5 | I574: =RC[-2]*RC[-1] -> 648 | J574: 2016-5-22 | K574: 2016-06-08T00:00:00.000 | L574: 针织
A575: 2016-02-26T00:00:00.000 | B575: 支云塔 | C575: 武玲玲 | D575: 016880 | E575: BFTK1677S | F575: BELK | G575: 96 | H575: 5.05 | I575: =RC[-2]*RC[-1] -> 484.79999999999995 | J575: 2016-5-22 | K575: 2016-06-08T00:00:00.000 | L575: 针织
A576: 2015-10-16T00:00:00.000 | B576: 支云塔 | C576: 王强 | D576: HFC#70120 | E576: 32059A0001 | F576: JCP | G576: 16776 | H576: 3.7 | I576: =RC[-2]*RC[-1] -> 62071.200000000004 | J576: 2016-3-21 | K576: 2016-04-07T00:00:00.000 | L576: 针织
A577: 2015-10-16T00:00:00.000 | B577: 支云塔 | C577: 王强 | D577: HFC#70120-1 | E577: 32059A0001 | F577: JCP | G577: 503 | H577: 3.55 | I577: =RC[-2]*RC[-1] -> 1785.6499999999999 | J577: 2016-3-21 | K577: 2016-04-07T00:00:00.000 | L577: 针织
A578: 2015-10-16T00:00:00.000 | B578: 支云塔 | C578: 王强 | D578: HFC#70120-2 | E578: 32059A0001 | F578: JCP | G578: 48 | H578: 3.7 | I578: =RC[-2]*RC[-1] -> 177.60000000000002 | J578: 2016-3-21 | K578: 2016-04-07T00:00:00.000 | L578: 针织
A579: 2015-10-16T00:00:00.000 | B579: 支云塔 | C579: 王强 | D579: HFC#70121 | E579: 32059A0001 | F579: JCP | G579: 5000 | H579: 3.7 | I579: =RC[-2]*RC[-1] -> 18500 | J579: 2016-3-21 | K579: 2016-04-07T00:00:00.000 | L579: 针织
A580: 2016-01-29T00:00:00.000 | B580: 支云塔 | C580: 鲁晨诗 | D580: HFC#8628 | E580: 73384B01 | F580: AMERICAN RAG | G580: 1274 | H580: 7.45 | I580: =RC[-2]*RC[-1] -> 9491.3000000000011 | J580: 2016-05-16T00:00:00.000 | K580: 2016-06-08T00:00:00.000 | L580: 针织
A581: 2016-01-29T00:00:00.000 | B581: 支云塔 | C581: 鲁晨诗 | D581: HFC#8628-1 | E581: 73384B01 | F581: AMERICAN RAG | G581: 468 | H581: 7.45 | I581: =RC[-2]*RC[-1] -> 3486.6 | J581: 2016-05-16T00:00:00.000 | K581: 2016-06-08T00:00:00.000 | L581: 针织
A582: 2016-01-18T00:00:00.000 | B582: 支云塔 | C582: 胡金文 | D582: P170605 | E582: XT1007 | F582: STOCK | G582: 5400 | H582: 5.45 | I582: =RC[-2]*RC[-1] -> 29430 | J582: 2016-4-18 | K582: 2016-05-11T00:00:00.000 | L582: 针织
A583: 2016-01-29T00:00:00.000 | B583: 支云塔 | C583: 付连 | D583: P170794 | E583: NJ36T296M(ZQ6162-DXXX-7497-1916) | F583: WALMART | G583: 64 | H583: 3.85 | I583: =RC[-2]*RC[-1] -> 246.4 | J583: 2016-5-2 | K583: 2016-05-25T00:00:00.000 | L583: 针织
A584: 2016-02-02T00:00:00.000 | B584: 支云塔 | C584: 付连 | D584: P170846 | E584: NJ36T296M(ZQ6162-DXXX-7497-1916) | F584: WALMART | G584: 336 | H584: 3.85 | I584: =RC[-2]*RC[-1] -> 1293.6000000000001 | J584: 2016-5-23 | K584: 2016-06-15T00:00:00.000 | L584: 针织
A585: 2016-02-02T00:00:00.000 | B585: 支云塔 | C585: 付连 | D585: P170847 | E585: NJ36T296M(ZQ6162-DXXX-7497-1916) | F585: WALMART | G585: 48976 | H585: 3.85 | I585: =RC[-2]*RC[-1] -> 188557.6 | J585: 2016-5-23 | K585: 2016-06-15T00:00:00.000 | L585: 针织
A586: 2016-02-06T00:00:00.000 | B586: 支云塔 | C586: 胡金文 | D586: P171044 | E586: XT1007-8292-0014 | F586: STAGE | G586: 5232 | H586: 5.7 | I586: =RC[-2]*RC[-1] -> 29822.400000000001 | J586: 2016-4-25 | K586: 2016-05-18T00:00:00.000 | L586: 针织
A587: 2016-02-15T00:00:00.000 | B587: 支云塔 | C587: 胡金文 | D587: P171094 | E587: XT1007-8248-0014-MJ | F587: MEIJER | G587: 5152 | H587: 5.7 | I587: =RC[-2]*RC[-1] -> 29366.400000000001 | J587: 2016-5-8 | K587: 2016-06-01T00:00:00.000 | L587: 针织
A588: 2016-02-18T00:00:00.000 | B588: 支云塔 | C588: 胡金文 | D588: P171207 | E588: LT1007-8247-0014 | F588: MEIJER | G588: 4788 | H588: 6.2 | I588: =RC[-2]*RC[-1] -> 29685.600000000002 | J588: 2016-5-8 | K588: 2016-06-01T00:00:00.000 | L588: 针织
A589: 2015-12-02T00:00:00.000 | B589: 支云塔 | C589: 卿春艳 | D589: 100-00019749 | E589: J5629Z47 | F589: OPENLINE | G589: 252 | H589: 5.25 | I589: =RC[-2]*RC[-1] -> 1323 | J589: 2016-3-20 | K589: 2016-04-12T00:00:00.000 | L589: 针织
A590: 2015-12-02T00:00:00.000 | B590: 支云塔 | C590: 卿春艳 | D590: 100-00019746 | E590: J5629Z47 | F590: BONTON | G590: 1516 | H590: 5.25 | I590: =RC[-2]*RC[-1] -> 7959 | J590: 2016-3-20 | K590: 2016-04-12T00:00:00.000 | L590: 针织
A591: 2015-12-02T00:00:00.000 | B591: 支云塔 | C591: 卿春艳 | D591: 100-00019746 | E591: J5629Z47 | F591: BONTON.COM | G591: 36 | H591: 5.25 | I591: =RC[-2]*RC[-1] -> 189 | J591: 2016-3-20 | K591: 2016-04-12T00:00:00.000 | L591: 针织
A592: 2015-12-02T00:00:00.000 | B592: 支云塔 | C592: 卿春艳 | D592: 100-00019751 | E592: JV5752Z47 | F592: VANITY | G592: 1800 | H592: 5.2 | I592: =RC[-2]*RC[-1] -> 9360 | J592: 2016-3-20 | K592: 2016-04-12T00:00:00.000 | L592: 针织
A593: 2015-12-15T00:00:00.000 | B593: 支云塔 | C593: 卿春艳 | D593: 100-00019746 | E593: J5629Z47 | F593: BONTON | G593: 1516 | H593: 5.25 | I593: =RC[-2]*RC[-1] -> 7959 | J593: 2016-3-20 | K593: 2016-04-12T00:00:00.000 | L593: 针织
A594: 2015-12-15T00:00:00.000 | B594: 支云塔 | C594: 卿春艳 | D594: 100-00019746 | E594: J5629Z47 | F594: BONTON | G594: 36 | H594: 5.25 | I594: =RC[-2]*RC[-1] -> 189 | J594: 2016-3-20 | K594: 2016-04-12T00:00:00.000 | L594: 针织
A595: 2015-12-15T00:00:00.000 | B595: 支云塔 | C595: 卿春艳 | D595: 100-00019749 | E595: J5629Z47 | F595: OPENLINE | G595: 252 | H595: 5.25 | I595: =RC[-2]*RC[-1] -> 1323 | J595: 2016-3-20 | K595: 2016-04-12T00:00:00.000 | L595: 针织
A596: 2015-12-15T00:00:00.000 | B596: 支云塔 | C596: 卿春艳 | D596: 100-00019751 | E596: J5629Z47 | F596: VANITY | G596: 1800 | H596: 5.2 | I596: =RC[-2]*RC[-1] -> 9360 | J596: 2016-3-20 | K596: 2016-04-12T00:00:00.000 | L596: 针织
A597: 2015-12-30T00:00:00.000 | B597: 支云塔 | C597: 卿春艳 | D597: 10000020524 | E597: NY5629538 | F597: MACYS | G597: 6218 | H597: 4.7 | I597: =RC[-2]*RC[-1] -> 29224.600000000002 | J597: 2016-4-3 | K597: 2016-04-20T00:00:00.000 | L597: 针织
A598: 2015-12-30T00:00:00.000 | B598: 支云塔 | C598: 卿春艳 | D598: 10000020525 | E598: NY5629Z47 | F598: MACYS | G598: 6228 | H598: 4.7 | I598: =RC[-2]*RC[-1] -> 29271.600000000002 | J598: 2016-4-3 | K598: 2016-04-20T00:00:00.000 | L598: 针织
A599: 2015-12-30T00:00:00.000 | B599: 支云塔 | C599: 卿春艳 | D599: 10000020526 | E599: NY5788GNL | F599: MACYS | G599: 4872 | H599: 4.8899999999999997 | I599: =RC[-2]*RC[-1] -> 23824.079999999998 | J599: 2016-4-3 | K599: 2016-04-20T00:00:00.000 | L599: 针织
A600: 2015-12-30T00:00:00.000 | B600: 支云塔 | C600: 卿春艳 | D600: 10000020527 | E600: NY5788GNL | F600: MACYS | G600: 4876 | H600: 4.8899999999999997 | I600: =RC[-2]*RC[-1] -> 23843.64 | J600: 2016-4-3 | K600: 2016-04-20T00:00:00.000 | L600: 针织
A601: 2015-12-30T00:00:00.000 | B601: 支云塔 | C601: 卿春艳 | D601: 10000020528 | E601: NY5789B36 | F601: MACYS | G601: 5146 | H601: 4.8899999999999997 | I601: =RC[-2]*RC[-1] -> 25163.94 | J601: 2016-4-3 | K601: 2016-04-20T00:00:00.000 | L601: 针织
A602: 2015-12-30T00:00:00.000 | B602: 支云塔 | C602: 卿春艳 | D602: 10000020529 | E602: NY5789Z77 | F602: MACYS | G602: 5196 | H602: 4.8899999999999997 | I602: =RC[-2]*RC[-1] -> 25408.44 | J602: 2016-4-3 | K602: 2016-04-20T00:00:00.000 | L602: 针织
A603: 2016-01-06T00:00:00.000 | B603: 支云塔 | C603: 卿春艳 | D603: 10000020555 | E603: J5629Z47 | F603: GORDMANS | G603: 600 | H603: 5.25 | I603: =RC[-2]*RC[-1] -> 3150 | J603: 2016-4-3 | K603: 2016-04-26T00:00:00.000 | L603: 针织
A604: 2016-01-06T00:00:00.000 | B604: 支云塔 | C604: 卿春艳 | D604: 10000020556 | E604: J5629538 | F604: GORDMANS | G604: 600 | H604: 5.25 | I604: =RC[-2]*RC[-1] -> 3150 | J604: 2016-4-3 | K604: 2016-04-26T00:00:00.000 | L604: 针织
A605: 2016-01-13T00:00:00.000 | B605: 支云塔 | C605: 卿春艳 | D605: 10000020643 | E605: N5629Z47 | F605: BEALLS | G605: 516 | H605: 5.15 | I605: =RC[-2]*RC[-1] -> 2657.4 | J605: 2016-4-11 | K605: 2016-04-27T00:00:00.000 | L605: 针织
A606: 2016-01-13T00:00:00.000 | B606: 支云塔 | C606: 卿春艳 | D606: 10000020644 | E606: N5629538 | F606: BEALLS | G606: 516 | H606: 5.15 | I606: =RC[-2]*RC[-1] -> 2657.4 | J606: 2016-4-11 | K606: 2016-04-27T00:00:00.000 | L606: 针织
A607: 2016-01-13T00:00:00.000 | B607: 支云塔 | C607: 卿春艳 | D607: 10000020645 | E607: N5788GNL | F607: BEALLS | G607: 480 | H607: 5.25 | I607: =RC[-2]*RC[-1] -> 2520 | J607: 2016-4-11 | K607: 2016-04-27T00:00:00.000 | L607: 针织
A608: 2016-01-13T00:00:00.000 | B608: 支云塔 | C608: 卿春艳 | D608: 10000020652 | E608: J5629Z47 | F608: Bovscov | G608: 360 | H608: 5.15 | I608: =RC[-2]*RC[-1] -> 1854.0000000000002 | J608: 2016-4-11 | K608: 2016-04-27T00:00:00.000 | L608: 针织
A609: 2016-01-13T00:00:00.000 | B609: 支云塔 | C609: 卿春艳 | D609: 10000020653 | E609: J5629538 | F609: Bovscov | G609: 360 | H609: 5.15 | I609: =RC[-2]*RC[-1] -> 1854.0000000000002 | J609: 2016-4-11 | K609: 2016-04-27T00:00:00.000 | L609: 针织
A610: 2016-01-13T00:00:00.000 | B610: 支云塔 | C610: 卿春艳 | D610: 10000020654 | E610: N5788GNL | F610: Bovscov | G610: 360 | H610: 5.25 | I610: =RC[-2]*RC[-1] -> 1890 | J610: 2016-4-11 | K610: 2016-04-27T00:00:00.000 | L610: 针织
A611: 2016-01-13T00:00:00.000 | B611: 支云塔 | C611: 卿春艳 | D611: 10000020655 | E611: J5789Z77 | F611: Bovscov | G611: 360 | H611: 5.25 | I611: =RC[-2]*RC[-1] -> 1890 | J611: 2016-4-11 | K611: 2016-04-27T00:00:00.000 | L611: 针织
A612: 2016-02-04T00:00:00.000 | B612: 支云塔 | C612: 王强 | D612: 6000355 | E612: M3503960S | G612: 600 | H612: 6.8 | I612: =RC[-2]*RC[-1] -> 4080 | J612: 2016-4-18 | K612: 2016-05-11T00:00:00.000 | L612: 针织
A613: 2016-02-04T00:00:00.000 | B613: 支云塔 | C613: 王强 | D613: 6000360 | E613: M3663960S | G613: 400 | H613: 8 | I613: =RC[-2]*RC[-1] -> 3200 | J613: 2016-4-18 | K613: 2016-05-11T00:00:00.000 | L613: 针织
A614: 2016-02-04T00:00:00.000 | B614: 支云塔 | C614: 王强 | D614: 6000367 | E614: M4013960S | G614: 500 | H614: 8.8000000000000007 | I614: =RC[-2]*RC[-1] -> 4400 | J614: 2016-4-18 | K614: 2016-05-11T00:00:00.000 | L614: 针织
A615: 2016-03-03T00:00:00.000 | B615: 支云塔 | C615: 王强 | D615: 9723 | E615: JB0613K3708 | G615: 1200 | H615: 5.6 | I615: =RC[-2]*RC[-1] -> 6720 | J615: 2016-5-30 | K615: 2016-6-17 | L615: 针织
A616: 2015-12-04T00:00:00.000 | B616: 支云塔/百利达 | C616: 付连 | D616: P170158 | E616: NJ26T145M | F616: WALMART | G616: 76344 | H616: 3.9 | I616: =RC[-2]*RC[-1] -> 297741.59999999998 | J616: 2016-3-7 | K616: 2016-03-30T00:00:00.000 | L616: 针织
A617: 2015-12-04T00:00:00.000 | B617: 支云塔/百利达 | C617: 付连 | D617: P170159 | E617: NJ26T145M | F617: WALMART | G617: 46160 | H617: 3.9 | I617: =RC[-2]*RC[-1] -> 180024 | J617: 2016-3-7 | K617: 2016-03-30T00:00:00.000 | L617: 针织
A618: 2016-01-13T00:00:00.000 | C618: 张莉 | D618: 3753 | E618: AHM4 | F618: WALMART | G618: 72216 | H618: 3.4 | I618: =RC[-2]*RC[-1] -> 245534.4 | J618: 2016-4-25 | K618: 2016-05-13T00:00:00.000 | L618: 梭织
A619: 2016-01-13T00:00:00.000 | C619: 张莉 | D619: 3752 | E619: AHM4 | F619: WALMART | G619: 944 | H619: 3.4 | I619: =RC[-2]*RC[-1] -> 3209.6 | J619: 2016-4-25 | K619: 2016-05-13T00:00:00.000 | L619: 梭织
A620: 2016-02-29T00:00:00.000 | C620: 张莉 | D620: 0008 | E620: 0YVX | F620: STAGE | G620: 5722 | H620: 4.3499999999999996 | I620: =RC[-2]*RC[-1] -> 24890.699999999997 | J620: 2016-5-9 | K620: 2016-05-25T00:00:00.000 | L620: 针织
A621: 2016-02-29T00:00:00.000 | C621: 张莉 | D621: 0013 | E621: 0YVX | F621: STAGE.COM | G621: 112 | H621: 4.2 | I621: =RC[-2]*RC[-1] -> 470.40000000000003 | J621: 2016-5-9 | K621: 2016-05-25T00:00:00.000 | L621: 针织
A622: 2016-02-29T00:00:00.000 | C622: 张莉 | D622: 0017 | E622: 0YVX | F622: BONTON | G622: 1238 | H622: 4.3499999999999996 | I622: =RC[-2]*RC[-1] -> 5385.2999999999993 | J622: 2016-5-9 | K622: 2016-05-25T00:00:00.000 | L622: 针织
A623: 2016-02-29T00:00:00.000 | C623: 孙娟 | D623: 9910 | E623: 1ALS | F623: BURLINGTON | G623: 2808 | H623: 4.3499999999999996 | I623: =RC[-2]*RC[-1] -> 12214.8 | J623: 2016-5-9 | K623: 2016-05-25T00:00:00.000 | L623: 针织
A624: 2016-03-01T00:00:00.000 | C624: 孙娟 | D624: 0159 | E624: 0ZMN | F624: MACYS | G624: 268 | H624: 3.85 | I624: =RC[-2]*RC[-1] -> 1031.8 | J624: 2016-5-9 | K624: 2016-05-25T00:00:00.000 | L624: 针织
A625: 2016-03-01T00:00:00.000 | C625: 孙娟 | D625: 0172 | E625: 0ZMN | F625: ROSS | G625: 1488 | H625: 3.7 | I625: =RC[-2]*RC[-1] -> 5505.6 | J625: 2016-5-9 | K625: 2016-05-25T00:00:00.000 | L625: 针织
A626: 2016-03-08T00:00:00.000 | C626: 孙娟 | D626: 1041 | E626: 0ZMN | F626: MACYS | G626: 122 | H626: 3.85 | I626: =RC[-2]*RC[-1] -> 469.7 | J626: 2016-4-18 | K626: 2016-04-22T00:00:00.000 | L626: 针织
A627: 2016-03-08T00:00:00.000 | C627: 孙娟 | D627: 1063 | E627: 0ZMN | F627: MACYS | G627: 122 | H627: 3.85 | I627: =RC[-2]*RC[-1] -> 469.7 | J627: 2016-4-18 | K627: 2016-04-22T00:00:00.000 | L627: 针织
A628: 2016-03-08T00:00:00.000 | C628: 孙娟 | D628: 1064 | E628: 0ZMN | F628: MACYS | G628: 122 | H628: 3.85 | I628: =RC[-2]*RC[-1] -> 469.7 | J628: 2016-4-18 | K628: 2016-04-22T00:00:00.000 | L628: 针织
A629: 2016-03-08T00:00:00.000 | C629: 孙娟 | D629: 1065 | E629: 0ZMN | F629: MACYS | G629: 122 | H629: 3.85 | I629: =RC[-2]*RC[-1] -> 469.7 | J629: 2016-4-18 | K629: 2016-04-22T00:00:00.000 | L629: 针织
A630: 2016-01-29T00:00:00.000 | C630: 谭春艳 | D630: BA284-1 | E630: J7860MMEY | F630: CARSON'S | G630: 3052 | H630: 5.35 | I630: =RC[-2]*RC[-1] -> 16328.199999999999 | J630: 2016-4-25 | K630: 2016-05-18T00:00:00.000 | L630: 针织
A631: 2016-01-29T00:00:00.000 | C631: 谭春艳 | D631: BA284ATS | E631: J7860MMEY | F631: CARSON'S | G631: 2400 | H631: 5.35 | I631: =RC[-2]*RC[-1] -> 12840 | J631: 2016-4-25 | K631: 2016-05-18T00:00:00.000 | L631: 针织
A632: 2016-02-16T00:00:00.000 | C632: 吕婵娟 | D632: BA290-1 | E632: B7899CAEUC | F632: CATO | G632: 120 | H632: 6.35 | I632: =RC[-2]*RC[-1] -> 762 | J632: 2016-4-25 | K632: 2016-05-20T00:00:00.000 | L632: 针织
A633: 2016-02-16T00:00:00.000 | C633: 吕婵娟 | D633: BA290-2 | E633: B7899CAEUC | F633: CATO | G633: 1884 | H633: 6.35 | I633: =RC[-2]*RC[-1] -> 11963.4 | J633: 2016-4-25 | K633: 2016-05-20T00:00:00.000 | L633: 针织
A634: 2016-02-16T00:00:00.000 | C634: 吕婵娟 | D634: BA290-3 | E634: B7899CAEUC | F634: CATO | G634: 2958 | H634: 6.35 | I634: =RC[-2]*RC[-1] -> 18783.3 | J634: 2016-4-25 | K634: 2016-05-20T00:00:00.000 | L634: 针织
A635: 2016-02-06T00:00:00.000 | C635: 武玲玲 | D635: CL160271 | E635: VFDK5440 | F635: VON MAUR | G635: 360 | H635: 5.25 | I635: =RC[-2]*RC[-1] -> 1890 | J635: 2016-5-1 | K635: 2016-05-17T00:00:00.000 | L635: 针织
A636: 2016-02-06T00:00:00.000 | C636: 武玲玲 | D636: CL160272 | E636: VFDK5185 | F636: VON MAUR | G636: 360 | H636: 5.35 | I636: =RC[-2]*RC[-1] -> 1925.9999999999998 | J636: 2016-5-1 | K636: 2016-05-17T00:00:00.000 | L636: 针织
A637: 2016-02-06T00:00:00.000 | C637: 武玲玲 | D637: CL160272 | E637: VFDK5185 | F637: VON MAUR | G637: 360 | H637: 5 | I637: =RC[-2]*RC[-1] -> 1800 | J637: 2016-5-1 | K637: 2016-05-17T00:00:00.000 | L637: 针织
A638: 2016-02-14T00:00:00.000 | C638: 武玲玲 | D638: CL160275-1 | E638: DGFDK5185 | F638: DRY GOODS | G638: 222 | H638: 5.35 | I638: =RC[-2]*RC[-1] -> 1187.6999999999998 | J638: 2016-5-1 | K638: 2016-05-17T00:00:00.000 | L638: 针织
A639: 2016-02-14T00:00:00.000 | C639: 武玲玲 | D639: 016607 | E639: VNFDK5440 | F639: VANITY | G639: 54 | H639: 5 | I639: =RC[-2]*RC[-1] -> 270 | J639: 2016-5-1 | K639: 2016-05-17T00:00:00.000 | L639: 针织
A640: 2016-02-14T00:00:00.000 | C640: 武玲玲 | D640: 016607 | E640: VNFDK5440 | F640: VANITY | G640: 54 | H640: 5.25 | I640: =RC[-2]*RC[-1] -> 283.5 | J640: 2016-5-1 | K640: 2016-05-17T00:00:00.000 | L640: 针织
A641: 2016-03-08T00:00:00.000 | C641: 武玲玲 | D641: CL160527 | E641: VFTK1677S | F641: VON MAUR | G641: 738 | H641: 5.05 | I641: =RC[-2]*RC[-1] -> 3726.9 | J641: 2016-6-12 | K641: 2016-07-04T00:00:00.000 | L641: 针织
A642: 2016-03-08T00:00:00.000 | C642: 武玲玲 | D642: CL160527 | E642: VFTK1677 | F642: VON MAUR | G642: 684 | H642: 4.5 | I642: =RC[-2]*RC[-1] -> 3078 | J642: 2016-6-12 | K642: 2016-07-04T00:00:00.000 | L642: 针织
A643: 2016-01-27T00:00:00.000 | C643: 付连 | D643: HFC#91481 | E643: 25992A0001 | F643: MACYS | G643: 5199 | I643: =RC[-2]*RC[-1] -> 0 | J643: 2016-05-16T00:00:00.000 | K643: 2016-06-08T00:00:00.000 | L643: 针织
A644: 2016-01-27T00:00:00.000 | C644: 付连 | D644: HFC#91485 | E644: 25992B0001 | F644: MACYS | G644: 84 | I644: =RC[-2]*RC[-1] -> 0 | J644: 2016-05-16T00:00:00.000 | K644: 2016-06-08T00:00:00.000 | L644: 针织
A645: 2016-01-27T00:00:00.000 | C645: 付连 | D645: HFC#91485-1 | E645: 25992B0001 | F645: MACYS | G645: 1326 | I645: =RC[-2]*RC[-1] -> 0 | J645: 2016-05-16T00:00:00.000 | K645: 2016-06-08T00:00:00.000 | L645: 针织
A646: 2016-02-02T00:00:00.000 | C646: 付连 | D646: HFC#1387-1 | E646: 79629A03 | G646: 180 | I646: =RC[-2]*RC[-1] -> 0 | J646: 2016-04-18T00:00:00.000 | K646: 2016-05-04T00:00:00.000 | L646: 针织
A647: 2016-02-02T00:00:00.000 | C647: 付连 | D647: HFC#1387-1 | E647: 79629A02 | G647: 144 | I647: =RC[-2]*RC[-1] -> 0 | J647: 2016-04-18T00:00:00.000 | K647: 2016-05-04T00:00:00.000 | L647: 针织
A648: 2016-02-02T00:00:00.000 | C648: 付连 | D648: HFC#1387-1 | E648: 79629A01 | G648: 144 | I648: =RC[-2]*RC[-1] -> 0 | J648: 2016-04-18T00:00:00.000 | K648: 2016-05-04T00:00:00.000 | L648: 针织
A649: 2016-02-02T00:00:00.000 | C649: 付连 | D649: HFC#1387-1 | E649: 79629A04 | G649: 144 | I649: =RC[-2]*RC[-1] -> 0 | J649: 2016-04-18T00:00:00.000 | K649: 2016-05-04T00:00:00.000 | L649: 针织
A650: 2016-02-17T00:00:00.000 | C650: 王强 | D650: HFC#1398 | E650: 22689A0007 | F650: WALMART | G650: 24036 | H650: 3.85 | I650: =RC[-2]*RC[-1] -> 92538.6 | J650: 2016-05-16T00:00:00.000 | K650: 2016-06-01T00:00:00.000 | L650: 针织
A651: 2016-02-17T00:00:00.000 | C651: 王强 | D651: HFC#1398 | E651: 22689A0008 | F651: WALMART | G651: 22200 | H651: 3.85 | I651: =RC[-2]*RC[-1] -> 85470 | J651: 2016-05-16T00:00:00.000 | K651: 2016-06-01T00:00:00.000 | L651: 针织
A652: 2016-02-17T00:00:00.000 | C652: 王强 | D652: HFC#1398 | E652: 22689A0004 | F652: WALMART | G652: 22200 | H652: 3.85 | I652: =RC[-2]*RC[-1] -> 85470 | J652: 2016-05-16T00:00:00.000 | K652: 2016-06-01T00:00:00.000 | L652: 针织
A653: 2016-02-17T00:00:00.000 | C653: 王强 | D653: HFC#1398 | E653: 22689A0002 | F653: WALMART | G653: 24036 | H653: 3.85 | I653: =RC[-2]*RC[-1] -> 92538.6 | J653: 2016-05-16T00:00:00.000 | K653: 2016-06-01T00:00:00.000 | L653: 针织
A654: 2016-02-17T00:00:00.000 | C654: 王强 | D654: HFC#1398 | E654: 22689A0006 | F654: WALMART | G654: 10584 | H654: 3.85 | I654: =RC[-2]*RC[-1] -> 40748.400000000001 | J654: 2016-05-16T00:00:00.000 | K654: 2016-06-01T00:00:00.000 | L654: 针织
A655: 2016-02-17T00:00:00.000 | C655: 王强 | D655: HFC#1398 | E655: 22689A0009 | F655: WALMART | G655: 10296 | H655: 3.85 | I655: =RC[-2]*RC[-1] -> 39639.599999999999 | J655: 2016-05-16T00:00:00.000 | K655: 2016-06-01T00:00:00.000 | L655: 针织
A656: 2016-03-02T00:00:00.000 | C656: 付连 | D656: 4-16-403985 | E656: 49572A0001 | F656: WALMART | G656: 600 | H656: 5.55 | I656: =RC[-2]*RC[-1] -> 3330 | J656: 2016-06-20T00:00:00.000 | K656: 2016-07-06T00:00:00.000 | L656: 梭织
A657: 2016-03-02T00:00:00.000 | C657: 王强 | D657: 2-16-204687 | E657: 22689A0007 | F657: WALMART | G657: 408 | H657: 3.99 | I657: =RC[-2]*RC[-1] -> 1627.92 | J657: 2016-05-16T00:00:00.000 | K657: 2016-06-01T00:00:00.000 | L657: 针织
A658: 2016-03-02T00:00:00.000 | C658: 王强 | D658: 2-16-204687 | E658: 22689A0004 | F658: WALMART | G658: 480 | H658: 3.85 | I658: =RC[-2]*RC[-1] -> 1848 | J658: 2016-05-16T00:00:00.000 | K658: 2016-06-01T00:00:00.000 | L658: 针织
A659: 2016-03-02T00:00:00.000 | C659: 王强 | D659: 2-16-204687 | E659: 22689A0009 | F659: WALMART | G659: 240 | H659: 3.99 | I659: =RC[-2]*RC[-1] -> 957.6 | J659: 2016-05-16T00:00:00.000 | K659: 2016-06-01T00:00:00.000 | L659: 针织
A660: 2016-03-02T00:00:00.000 | C660: 王强 | D660: 2-16-204687 | E660: 22689A0002 | F660: WALMART | G660: 552 | H660: 3.85 | I660: =RC[-2]*RC[-1] -> 2125.2000000000003 | J660: 2016-05-16T00:00:00.000 | K660: 2016-06-01T00:00:00.000 | L660: 针织
A661: 2016-03-02T00:00:00.000 | C661: 王强 | D661: 2-16-204687 | E661: 22689A0006 | F661: WALMART | G661: 480 | H661: 3.85 | I661: =RC[-2]*RC[-1] -> 1848 | J661: 2016-05-16T00:00:00.000 | K661: 2016-06-01T00:00:00.000 | L661: 针织
A662: 2016-03-02T00:00:00.000 | C662: 王强 | D662: 2-16-204687 | E662: 22689A0008 | F662: WALMART | G662: 360 | H662: 3.99 | I662: =RC[-2]*RC[-1] -> 1436.4 | J662: 2016-05-16T00:00:00.000 | K662: 2016-06-01T00:00:00.000 | L662: 针织
A663: 2016-01-13T00:00:00.000 | C663: 付连 | D663: P170555 | E663: NJ26B588M | F663: WALMART | G663: 492 | H663: 4 | I663: =RC[-2]*RC[-1] -> 1968 | J663: 2016-4-25 | K663: 2016-05-18T00:00:00.000 | L663: 针织
A664: 2016-01-13T00:00:00.000 | C664: 付连 | D664: P170556 | E664: NJ26B588M | F664: WALMART | G664: 492 | H664: 4 | I664: =RC[-2]*RC[-1] -> 1968 | J664: 2016-4-25 | K664: 2016-05-18T00:00:00.000 | L664: 针织
A665: 2016-01-13T00:00:00.000 | C665: 付连 | D665: P170557 | E665: NJ26B588M | F665: WALMART | G665: 65796 | H665: 4 | I665: =RC[-2]*RC[-1] -> 263184 | J665: 2016-4-25 | K665: 2016-05-18T00:00:00.000 | L665: 针织
A666: 2016-01-13T00:00:00.000 | C666: 付连 | D666: P170560 | E666: NJ26B588M | F666: WALMART | G666: 37872 | H666: 4 | I666: =RC[-2]*RC[-1] -> 151488 | J666: 2016-4-25 | K666: 2016-05-18T00:00:00.000 | L666: 针织
A667: 2016-01-13T00:00:00.000 | C667: 付连 | D667: P170561 | E667: NJ26B588M | F667: WALMART | G667: 65796 | H667: 4 | I667: =RC[-2]*RC[-1] -> 263184 | J667: 2016-4-25 | K667: 2016-05-18T00:00:00.000 | L667: 针织
A668: 2016-01-13T00:00:00.000 | C668: 付连 | D668: P170562 | E668: NJ26B588M | F668: WALMART | G668: 37872 | H668: 4 | I668: =RC[-2]*RC[-1] -> 151488 | J668: 2016-4-25 | K668: 2016-05-18T00:00:00.000 | L668: 针织
A669: 2016-01-18T00:00:00.000 | C669: 付连 | D669: P170625 | E669: ZQ6161 | F669: STOCK | G669: 4800 | H669: 3.65 | I669: =RC[-2]*RC[-1] -> 17520 | J669: 2016-3-20 | K669: 2016-04-13T00:00:00.000 | L669: 针织
A670: 2016-01-19T00:00:00.000 | C670: 胡金文 | D670: P170531 | E670: ZT1716-6650 | F670: STOCK | G670: 7200 | H670: 4 | I670: =RC[-2]*RC[-1] -> 28800 | J670: 2016-4-25 | K670: 2016-05-18T00:00:00.000 | L670: 针织
A671: 2016-01-20T00:00:00.000 | C671: 付连 | D671: P170678 | E671: TT9011-1998 | F671: STOCK | G671: 4800 | H671: 3.85 | I671: =RC[-2]*RC[-1] -> 18480 | J671: 2016-4-25 | K671: 2016-05-18T00:00:00.000 | L671: 梭织
A672: 2016-01-25T00:00:00.000 | C672: 付连 | D672: P170723 | E672: NJ26B588M | F672: WALMART | G672: 37872 | H672: 4 | I672: =RC[-2]*RC[-1] -> 151488 | J672: 2016-4-25 | K672: 2016-05-18T00:00:00.000 | L672: 针织
A673: 2016-01-25T00:00:00.000 | C673: 胡金文 | D673: P170732 | E673: ZT1716-6650 | F673: STOCK | G673: 6000 | H673: 4 | I673: =RC[-2]*RC[-1] -> 24000 | J673: 2016-4-25 | K673: 2016-05-18T00:00:00.000 | L673: 针织
A674: 2016-01-28T00:00:00.000 | C674: 胡金文 | D674: P170795 | E674: ZT1716-6650 | F674: FRED MEYER | G674: 1656 | H674: 4 | I674: =RC[-2]*RC[-1] -> 6624 | J674: 2016-4-25 | K674: 2016-05-18T00:00:00.000 | L674: 针织
A675: 2016-02-04T00:00:00.000 | C675: 胡金文 | D675: P170884 | E675: ZT1716-6650-JCP | F675: JCP | G675: 17811 | H675: 4.1500000000000004 | I675: =RC[-2]*RC[-1] -> 73915.650000000009 | J675: 2016-5-8 | K675: 2016-06-01T00:00:00.000 | L675: 针织
A676: 2016-02-04T00:00:00.000 | C676: 胡金文 | D676: P170886 | E676: ZT1716-6650-JCP | F676: JCP | G676: 950 | H676: 4.1500000000000004 | I676: =RC[-2]*RC[-1] -> 3942.5000000000005 | J676: 2016-5-8 | K676: 2016-06-01T00:00:00.000 | L676: 针织
A677: 2016-02-04T00:00:00.000 | C677: 胡金文 | D677: P170888 | E677: ZT1716-6650-JCP | F677: JCP.COM | G677: 648 | H677: 3.9 | I677: =RC[-2]*RC[-1] -> 2527.1999999999998 | J677: 2016-5-8 | K677: 2016-05-30T00:00:00.000 | L677: 针织
A678: 2016-02-04T00:00:00.000 | C678: 胡金文 | D678: P170889 | E678: ZT1716-6650-JCP | F678: JCP | G678: 23 | H678: 4.1500000000000004 | I678: =RC[-2]*RC[-1] -> 95.45 | J678: 2016-4-3 | K678: 2016-04-20T00:00:00.000 | L678: 针织
A679: 2016-03-01T00:00:00.000 | C679: 王强 | D679: 6000393 | E679: M380-S | G679: 600 | H679: 8.3000000000000007 | I679: =RC[-2]*RC[-1] -> 4980 | J679: 2016-5-23 | K679: 2016-06-08T00:00:00.000 | L679: 梭织
A680: 2016-03-02T00:00:00.000 | C680: 王强 | D680: 9686 | E680: JT5112K3854 | G680: 4950 | H680: 5.3 | I680: =RC[-2]*RC[-1] -> 26235 | J680: 2016-6-6 | K680: 2016-6-22 | L680: 针织
A681: 2016-03-02T00:00:00.000 | C681: 王强 | D681: 9687 | E681: ZT5112K3854 | G681: 1680 | H681: 6.05 | I681: =RC[-2]*RC[-1] -> 10164 | J681: 2016-6-6 | K681: 2016-6-22 | L681: 针织